Topic,Words,Frequency,Timestamp,comment_sentiment,name
74,"cuomo, andrew cuomo, mario, andrew, inspire generation americans",3,February 2021,-0.5232749999999999,74_cuomo_andrew cuomo_gov cuomo_andrew
75,"relief delay, americans miss, americans miss billion, benefit month, miss billion",1,February 2021,0.3312333333333333,75_unemployment_jobless_benefit_unemployment benefit
76,"china private ownership, control order license, expansive gun, problem change, lee introduce expansive",2,February 2021,0.00315,76_gun_open carry_ban open_carry
80,"immigration, immigration policies, biden tread, biden tread carefully, loyalists homeland security",3,February 2021,-0.9523,80_immigration_immigrants_undocumented_undocumented immigrants
83,"aid trump conviction, presidential crimes commission, public statement, public statement congressional, rare public",3,February 2021,-0.4368571428571428,83_prosecute_trump prosecute_comey_jam comey
86,"ally nunes presidential, trump ally nunes, nunes presidential medal, nunes presidential, ally nunes",3,February 2021,0.3024,86_medal_medal freedom_freedom_presidential medal
87,"government donald, government donald trump, donald trump leave, trump leave, government",1,February 2021,0.4701499999999999,87_leave white house_leave white_leave_trump leave
90,"gamestop, incarnation, affair latest incarnation, people capitalism, people capitalism delusion",7,February 2021,-0.3611999999999999,90_gamestop_robinhood_stock_trade
92,"mar lago, lago, mar, mar lago florida, lago florida",7,February 2021,-0.9805,92_mar lago_lago_mar_palm beach
95,"highlight failures health, report highlight failures, highlight failures, failures health pandemic, health pandemic",1,February 2021,-0.36972,95_pandemic_pandemic trump_control pandemic_go control pandemic
96,"gender specific, specific word, gender specific word, gender, specific",4,February 2021,-0.778575,96_women_suburban women_suburban_white women
98,"opinion trump commission, commission san, francisco board education, trump commission san, board education lot",1,February 2021,-0.9945,98_school_education_degree_university
103,"buttigieg, pete, pete buttigieg, transportation secretary antigay, secretary antigay",6,February 2021,0.250545,103_buttigieg_pete_pete buttigieg_transportation
104,"biden record start, president biden record, order sign president, record start, sign president biden",1,February 2021,-0.4762545454545454,104_executive order_executive_order_reverse trump policies
105,"writer comic, cruz call watchmen, people accuse sedition, say people accuse, watchmen writer comic",2,February 2021,-0.5529238095238095,105_cruz_ted_ted cruz_resign
106,"romney, criticize democrats big, egregious ploy, disingenuous criticize democrats, romney disingenuous",10,February 2021,-0.3803999999999999,106_romney_mitt romney_mitt_romney say
109,"patriots republican push, trump power doom, push trump power, traitors patriots republican, republican push trump",1,February 2021,-0.6842,109_insurrection_treason_insurrection trump_violent insurrection
110,"grow gop mcconnell, gop mcconnell mccarthy, gulf grow, gulf grow gop, mcconnell mccarthy",1,February 2021,-0.3732999999999999,110_mccarthy_kevin mccarthy_kevin_leader kevin mccarthy
111,"row execute, death row execute, way woman federal, clear way woman, way woman",1,February 2021,-0.9937,111_executions_execution_execute_death penalty
112,"trump access classify, access classify intelligence, house cut, brief biden white, white house cut",1,February 2021,-0.8414,112_brief_intelligence_intelligence brief_intel
113,"steal election, steal, biggest horse, impeachment attorney say, biggest horse race",2,February 2021,0.17962,113_steal election_steal_steal election trump_try steal
121,"reimbursement raise, flag ethics, reimbursement raise red, mileage reimbursement raise, boebert mileage",1,February 2021,0.9666,121_boebert_lauren boebert_lauren_rep lauren boebert
124,"dems feel, urgency ahead, dems feel great, deal urgency ahead, deal urgency",1,February 2021,-0.1052,124_abrams_stacey_stacey abrams_abrams say
128,"trump epa rule, latest trump epa, epa rule toss, rule toss secret, secret science ban",1,February 2021,-0.493425,128_epa_trump epa_environmental_pollution
130,"georgia gop lawmakers, reject lawmaker bid, reject lawmaker, lawmaker bid pence, court reject lawmaker",2,February 2021,-0.8414999999999999,130_georgia_judge_absentee_voter purge
131,"ivanka trump report, trump report drop, report drop income, drop income, report drop",1,February 2021,-0.8785,131_kushner_jar_jar kushner_ivanka
134,"overturn, overturn election, result cheat democracy, gop scheme undo, temper tantrum republicans",4,February 2021,-0.779611111111111,134_overturn election_overturn_effort overturn_effort overturn election
136,"amazon, charge steal driver, million settle, effort discourage warehouse, intensify severe effort",2,February 2021,-0.4767,136_amazon_uber_prop_lyft
140,"wood, lin wood, lin, wood investigation, lin wood investigation",17,February 2021,-0.7901857142857143,140_wood_lin wood_lin_lawyer lin
145,"trump conspiracy canards, canards right, canards, right hoax, right hoax theories",1,February 2021,-0.9862,145_conspiracy_conspiracy theories_theories_theorists
149,"kennedy blast immeasurably, chuck todd rip, foolish biden order, gut louisiana like, arsonist chuck todd",2,February 2021,-0.2154799999999999,149_provoke_trump provoke_mcconnell_feed lie
154,"janet yellen regulator, volatility seek, yellen regulator, seek ethics, seek ethics waiver",1,February 2021,0.0972499999999999,154_yellen_janet yellen_janet_treasury
159,"minimum wage, wage, minimum, hike, hike mandate raise",4,February 2021,0.9806,159_wage_minimum wage_minimum_raise minimum wage
169,"newsom approval rat, disapprove approve, plummet disapprove, rat plummet disapprove, plummet disapprove approve",1,February 2021,0.009,169_approval rat_approval_rat_trump approval rat
170,"return glory, win return glory, nyc win return, nyc win, glory law",2,February 2021,-0.4921571428571428,170_aoc_squad_aoc squad_aoc win
175,"oversee biden case, division associate hunter, criminal division, oversee biden, criminal division associate",1,February 2021,0.659,175_hunter biden_hunter_tax_investigation
182,"avoid midterm letdown, democrats jump republican, effort avoid, jump republican, jump republican divisions",1,February 2021,-0.2289391304347826,182_democrats_democrats decade_decade_lose deserve
195,"manchin, joe manchin, manchin say, sen joe, sen joe manchin",4,February 2021,0.5367888888888889,195_manchin_joe manchin_sen joe manchin_sen joe
196,"gohmert, dismiss gohmert, appeal court dismiss, court dismiss gohmert, violence streets",6,February 2021,-0.4708133333333333,196_gohmert_louie gohmert_louie_rep louie gohmert
197,"oath take, unite state exactly, election oath take, oath take swear, vote affirm election",1,February 2021,0.0056666666666666,197_swear_biden swear_swear president_swear president unite
200,"newsom, lobby newsom, schiff lobby newsom, schiff lobby, schiff",3,February 2021,0.9972,200_newsom_gavin newsom_gavin_recall
201,"lockheed, lockheed martin, martin, lockheed martin executive, evans executive",1,February 2021,-0.9686,201_atlas_scott atlas_scott_atlas resign
207,"deport lawyer, ice deport lawyer, haiti stop, deport lawyer say, haiti stop ice",1,February 2021,-0.76085,207_ice_deport_detention_medical abuse
220,"mike reese, reese, die, chafin, contract highly contagious",4,February 2021,-0.3464454545454545,220_die covid_die_complications_senator die
225,"cosby victim, new lawyers canadian, boss cosby, boss cosby victim, canadian connections",1,February 2021,-0.89835,225_epstein_maxwell_ghislaine maxwell_ghislaine
240,"biden strategy deal, deal trump ignore, strategy deal, strategy deal trump, biden strategy",1,February 2021,-0.2153,240_foreign policy_foreign_policy_trump foreign
245,"experts note, legal experts note, trump sec, trump sec state, challenge prosecute",1,February 2021,-0.9531,245_legal_legal challenge_challenge_trump legal
247,"people alien, bomb suspect believe, suspect believe lizard, suspect believe, lizard people alien",1,February 2021,0.0966,247_nashville_explosion_bomber_nashville bomber
249,"schumer, schumer mcconnell, power share, power share agreement, share agreement",11,February 2021,-0.8921,249_schumer_power share_share agreement_power share agreement
256,"trump destroy, destroy, trump, danger, trump danger",1,February 2021,-0.327,256_danger_trump danger_dangerous_dangerous donald trump
263,"yellen crack dark, artist win, head table event, head table, democrats urge yellen",2,February 2021,-0.83865,263_rally_heiress_organize rally_dark money group
271,"blackwater, iraq, investigator blackwater case, investigator blackwater, action iraq",2,February 2021,-0.979675,271_blackwater_blackwater guard_pardon_pardon blackwater
308,"sue school district, reopen earn, school district board, board reopen earn, sue school",1,February 2021,-0.9931,308_reopen_school_reopen school_school reopen
321,"say win challenge, win challenge election, house republicans say, conservative house republicans, republicans say win",1,February 2021,-0.22214,321_challenge_challenge election_election challenge_challenge election result
328,"psaki take, heat space force, jen psaki take, take heat space, heat space",1,February 2021,0.41222,328_psaki_jen_jen psaki_press secretary jen
331,"result mockery, republicans attempt subvert, gop governor criticize, result mockery americans, election result mockery",1,February 2021,-0.9582,331_hogan_maryland_maryland gop governor_maryland gop
343,"vandalize, mcconnell home, home vandalize, home, pelosi",5,February 2021,-0.0530304347826086,343_vandalize_home vandalize_home_mcconnell home
0,"toll fake, death toll fake, toll fake news, death toll, fake news",8,March 2021,-0.5010533333333334,0_covid_coronavirus_relief_covid relief
1,"georgia, trump georgia, georgia election, runoffs, phone",106,March 2021,-0.1920454545454545,1_georgia_runoffs_georgia senate_senate runoffs
2,"impeach, congress impeach trump, congress impeach, impeach trump, impeachment",12,March 2021,-0.1399105263157894,2_impeachment_graham_lindsey graham_lindsey
3,"half speed, dose half speed, dose half, cut moderna, speed",6,March 2021,-0.58339,3_vaccine_covid vaccine_pfizer_vaccines
4,"iran, uranium, face minefield new, trump safe earth, biggest likely",7,March 2021,-0.45835,4_iran_china_nuclear_israel
5,"state employee pay, squad prove supreme, lawmakers sue undo, lizard squad, lizard squad prove",2,March 2021,-0.9621,5_wisconsin_court_supreme court_supreme
7,"baker joe, biden trump sad, charlie baker joe, good sign biden, square republican efforts",3,March 2021,-0.1915055555555555,7_joe biden_joe_biden_biden win
8,"fraud, election fraud, fraud trump, admit oppose, president act properly",5,March 2021,-0.51432,8_fraud_voter fraud_voter_election fraud
9,"mcconnell, anti election scheme, election scheme, anti election, mitch",7,March 2021,-0.0167,9_mcconnell_mitch_mitch mcconnell_mcconnell say
11,"pelosi, speaker, reelect, nancy pelosi, nancy",4,March 2021,-0.0178041666666666,11_pelosi_nancy_nancy pelosi_speaker
12,"block congress count, judge reject effort, effort block congress, block congress, reject effort block",1,March 2021,-0.1993,12_pennsylvania_nevada_trump campaign_court
15,"mask protest temporarily, protest temporarily, shutter fresno trader, shutter fresno, protest temporarily shutter",1,March 2021,0.3179999999999999,15_mask_wear_wear mask_mask mandate
16,"gregory mcmichael, wear blm attire, call ahmaud arbery, call ahmaud, ban spectators wear",1,March 2021,-0.9459,16_giuliani_rudy_rudy giuliani_lawyer rudy
18,"virtual parade, parade, feature virtual parade, inauguration feature virtual, feature virtual",5,March 2021,-0.0437545454545454,18_inauguration_biden inauguration_inauguration trump_attend
21,"forget steal, election stop count, pence welcome congressional, republicans bid challenge, congressional republicans bid",1,March 2021,-0.332775,21_pence_mike pence_mike_vice
22,"qanon, theories georgia dark, qanon chan create, georgia dark, georgia dark reality",3,March 2021,-0.3479333333333333,22_qanon_conspiracy_believers_qanon conspiracy
23,"mask swear, wear mask swear, refuse wear, scream match, greene",3,March 2021,-0.8155869565217392,23_greene_taylor greene_marjorie_marjorie taylor
25,"newsmax com, foxnews com, foxnews, newsmax, news crazy",1,March 2021,-0.9334875,25_fox_fox news_news_newsmax
26,"positive, granger test, granger test positive, kay granger test, test",4,March 2021,0.9933,26_positive_test_test positive_positive covid
27,"hawley, john danforth, slam hawley, danforth, hawley cruz",8,March 2021,-0.9954,27_hawley_josh hawley_josh_cruz
31,"transgender, budget guarantee, high school sport, school sport latest, transgender health service",2,March 2021,-0.9931,31_lgbtq_transgender_trans_gay
32,"electoral college, college, electoral, journal gop, college threaten",6,March 2021,-0.2260799999999999,32_electoral college_college_electoral_college vote
33,"republicans break trump, republicans break, break trump, irvine time real, real gop",4,March 2021,-0.1337944444444444,33_party_republican party_republican_gop
35,"demand trump resign, time demand trump, bernstein time demand, time demand, bernstein time",1,March 2021,-0.9806666666666668,35_resign_capitol police_officer_police
37,"ist media american, social ist media, social ist, ist media, harris social ist",1,March 2021,0.3485333333333333,37_kamala_kamala harris_harris_vice
38,"race matter climate, senate race public, service commission race, race public service, public service commission",1,March 2021,-0.5362272727272728,38_senate_senators_democrats_gop senators
40,"extraordinary warn trump, extraordinary warn, pentagon chiefs, warn trump pentagon, trump pentagon chiefs",11,March 2021,-0.3028545454545454,40_pentagon_loyalists_pentagon chief_advisory board
41,"secretaries, defense secretaries, guard, national guard, national",23,March 2021,-0.926,41_guard_national guard_national_guard troop
43,"elise stefanik object, stefanik object certify, object certify electoral, stefanik object, object certify",2,March 2021,-0.8814500000000001,43_texas_texas lawsuit_lawsuit_supreme court
48,"protest trump election, protest, protest trump, warn residents, incite brace",6,March 2021,0.0280499999999999,48_protest_arm protest_rally_arm
49,"plan look buy, buy farmers skeptical, buy farmers, plan look, climate plan look",1,March 2021,-0.5956,49_climate_climate change_change_biden climate
50,"turn socialite role, friends turn socialite, friends turn, turn socialite, socialite",1,March 2021,-0.9821,50_melania_melania trump_ivanka_ivanka trump
52,"foe trump cruz, foe trump, trump cruz lead, lead charge reverse, cruz lead charge",1,March 2021,-0.9665333333333334,52_lose_lose election_trump lose_loss
53,"tax, transition court, acknowledge presidential transition, department lawyers, lawyers acknowledge presidential",3,March 2021,0.1605333333333333,53_tax_trump tax_tax return_tax cut
59,"later trump phone, new volunteer, trump new volunteer, anchor months, anchor months later",3,March 2021,-0.59065,59_lawsuits_election lawsuits_lawyers_trump election lawsuits
60,"elect georgia ossoff, ossoff warnock lead, say elect georgia, warnock lead stimulus, lead stimulus check",1,March 2021,0.91035,60_ossoff_jon ossoff_jon_warnock
61,"trump presidency win, presidency win halt, presidency win, halt extremism rise, win halt",1,March 2021,-0.9968,61_domestic_terrorism_extremism_domestic terrorism
62,"proud boys, boys, proud, proud boys leader, boys leader",5,March 2021,-0.51085,62_proud_proud boys_boys_boys leader
63,"fish california seafood, california seafood trade, fish california, drift net fish, drift net",1,March 2021,-0.7453000000000001,63_veto_trump veto_defense_override
67,"coup, stag dirty, impeachment censure, coup deserve, censure criminal investigation",3,March 2021,-0.9834,67_coup_attempt coup_attempt_trump coup
68,"better biden student, better biden, biden student loan, biden student, student loan debt",1,March 2021,-0.32975,68_student_student loan_loan_debt
69,"loeffler, election result loeffler, object certification presidential, loeffler object certification, loeffler object",6,March 2021,-0.0244499999999999,69_loeffler_kelly loeffler_kelly_perdue
71,"families linger, want biden administration, separation policy civil, torture families linger, administration reunify victims",1,March 2021,-0.9754,71_children_separate_migrant_parent
72,"include cabinet, second amendment president, president see include, amendment president see, see include",1,March 2021,0.9042,72_cabinet_biden cabinet_cabinet pick_biden cabinet pick
74,"cuomo, york gov cuomo, york gov, new york gov, gov cuomo",3,March 2021,-0.0791333333333333,74_cuomo_andrew cuomo_gov cuomo_andrew
75,"time try obtain, try obtain, sympathy lose, lose oil job, lose oil",1,March 2021,-0.970725,75_unemployment_jobless_benefit_unemployment benefit
76,"gun, square amendment red, post notice, gun downtown, flag law police",3,March 2021,-0.9828,76_gun_open carry_ban open_carry
83,"crimes, isolate diminish, steady focus, crimes reform break, crimes commit lifetime",4,March 2021,-0.986075,83_prosecute_trump prosecute_comey_jam comey
86,"medal freedom, medal, freedom, nunes, presidential medal freedom",37,March 2021,-0.2215,86_medal_medal freedom_freedom_presidential medal
92,"mar lago, lago, mar, legislator, fin close",2,March 2021,0.41614,92_mar lago_lago_mar_palm beach
95,"pandemic, latest politicians disclose, focus pandemic rag, politicians disclose international, politicians disclose",3,March 2021,-0.048225,95_pandemic_pandemic trump_control pandemic_go control pandemic
96,"marsha blackburn democrats, senate gender, specificity completely eliminate, specificity completely, gender specificity",1,March 2021,-0.9584,96_women_suburban women_suburban_white women
102,"need smash, scaramucci cnn, republican supporters, smash politically say, republican supporters need",1,March 2021,-0.9906,102_video_cnn video_youtube_cnn
103,"buttigieg save, save mass, buttigieg save mass, pete buttigieg save, save mass transit",1,March 2021,-0.4657,103_buttigieg_pete_pete buttigieg_transportation
105,"cruz, hyperbole calm, crowd try, sedition hyperbole, folly cruz",3,March 2021,-0.5468636363636364,105_cruz_ted_ted cruz_resign
106,"call bad metaphor, suggest guillotine, suggest guillotine mitt, romney call bad, gop official suggest",1,March 2021,0.2648181818181818,106_romney_mitt romney_mitt_romney say
109,"worse treason, treason, overthrow american election, advocate overthrow american, worse treason rationalize",2,March 2021,-0.9657,109_insurrection_treason_insurrection trump_violent insurrection
121,"boebert plan bring, police contact gop, police contact, boebert plan, contact gop rep",1,March 2021,-0.8979,121_boebert_lauren boebert_lauren_rep lauren boebert
124,"stacey, abrams, stacey abrams, judge play block, sister federal judge",3,March 2021,-0.9912,124_abrams_stacey_stacey abrams_abrams say
134,"condemn scheme undo, republicans condemn scheme, condemn scheme, scheme undo, scheme undo election",6,March 2021,-0.45593125,134_overturn election_overturn_effort overturn_effort overturn election
140,"job convince, helluva job, wood helluva, people insane, helluva job convince",1,March 2021,-0.7267428571428571,140_wood_lin wood_lin_lawyer lin
141,"mccain, meghan mccain, meghan, call mandatory pay, call mandatory",2,March 2021,-0.05265,141_mccain_cindy mccain_cindy_meghan
142,"scotland, biden inauguration plane, inauguration plane, inauguration plane sight, plane sight fuel",7,March 2021,-0.9878,142_scotland_scottish_golf_golf course
144,"cheney sign, cking cheney, cking cheney sign, dick cking, dick cking cheney",1,March 2021,-0.874575,144_cheney_liz cheney_liz_vote impeach
145,"talk accidental, accidental conspiracists, talk accidental conspiracists, learn talk, need learn talk",1,March 2021,-0.9741,145_conspiracy_conspiracy theories_theories_theorists
158,"native, haaland, hawaiian serve congress, native hawaiian, swear representative native",2,March 2021,-0.9648,158_haaland_interior_deb_deb haaland
163,"fearful american, fearful american democracy, trump leave ally, leave ally fearful, ally fearful",4,March 2021,-0.9675,163_democracy_american democracy_democracy trump_american
166,"black woman bear, woman bear, defeat barack obama, defeat barack, barack obama successor",1,March 2021,-0.01635,166_civil war_civil_war_gop parrot far
170,"squad, cori bush jamaal, squad big, big cori bush, squad big cori",1,March 2021,0.0026999999999999,170_aoc_squad_aoc squad_aoc win
172,"democrats ask, probe trump leak, wray open, democrats ask fbi, trump leak",6,March 2021,-0.6998142857142857,172_election secure american_secure american_secure american history_election secure
192,"zoom ban tear, senate staffer zoom, michigan senate staffer, ban tear, staffer zoom",1,March 2021,-0.9906,192_wray_fbi director_director_wray fbi
209,"asylum, assange, prepare offer assange, ready offer asylum, offer assange",2,March 2021,-0.9571,209_asylum_deportations_refugee_asylum seekers
220,"reese die follow, die follow apparent, brain aneurysm test, follow apparent, follow apparent brain",2,March 2021,-0.6200190476190477,220_die covid_die_complications_senator die
240,"trump policies america, policies america, policies america great, retain trump policies, biden retain trump",1,March 2021,-0.4316333333333333,240_foreign policy_foreign_policy_trump foreign
247,"nashville, write espouse conspiracy, people days blast, espouse conspiracy, days blast",1,March 2021,-0.9985,247_nashville_explosion_bomber_nashville bomber
283,"appoint attorney resign, attorney resign georgia, appoint attorney, trump appoint attorney, north georgia resign",7,March 2021,-0.326975,283_attorney_atlanta_resign_attorney atlanta
308,"biden want tens, tens billions dollars, billions dollars reopen, want tens, dollars reopen",1,March 2021,-0.9761,308_reopen_school_reopen school_school reopen
315,"supreme leader voter, leader voter, leader voter suppression, supreme leader, voter suppression",1,March 2021,-0.5336222222222222,315_suppression_voter suppression_voter_despite smooth
321,"efforts congress challenge, baker blast, efforts congress, gop efforts congress, democracy baker blast",1,March 2021,-0.5610125,321_challenge_challenge election_election challenge_challenge election result
331,"say lawmakers scheme, lawmakers scheme overturn, result make mockery, lawmakers scheme, hogan say lawmakers",1,March 2021,-0.8742333333333333,331_hogan_maryland_maryland gop governor_maryland gop
352,"bernstein, watergate, bernstein say, worse watergate, carl bernstein",2,March 2021,-0.97605,352_bernstein_carl bernstein_carl_contempt
359,"standards police use, lawmaker propose statewide, propose statewide standards, propose statewide, statewide standards police",1,March 2021,-0.9767333333333332,359_kill gun_police face_police_gun police face
0,"irs send, irs, cut risk covid, spark standoff, lice drug",5,April 2021,-0.4465333333333333,0_covid_coronavirus_relief_covid relief
1,"georgia, runoffs, trump georgia, senate runoffs, georgia senate",115,April 2021,-0.6350145454545455,1_georgia_runoffs_georgia senate_senate runoffs
2,"impeachment affront voters, impeachment affront, affront voters, voters plan reject, decry impeachment affront",1,April 2021,-0.2705952380952381,2_impeachment_graham_lindsey graham_lindsey
3,"vaccine, vaccine rollout, rollout, covid vaccine, cnn reporter",12,April 2021,0.4336857142857143,3_vaccine_covid vaccine_pfizer_vaccines
4,"iran, iran issue, delist chinese, interpol, nyse",9,April 2021,-0.2360666666666666,4_iran_china_nuclear_israel
6,"wrong number michigan, number michigan lawmaker, number michigan, wrong number, michigan lawmaker",7,April 2021,0.0541499999999999,6_michigan_certify_board_vote certify
7,"congress certify, koch, business leaders sign, joe biden decent, leaders sign",5,April 2021,-0.6561333333333333,7_joe biden_joe_biden_biden win
8,"fraud, actual proof, lou dobbs, dobbs, lou",6,April 2021,-0.2996166666666667,8_fraud_voter fraud_voter_election fraud
9,"suffer mitch, block check reason, suffer mitch mcconnell, biden point mcconnell, sycophancy mcconnell",3,April 2021,-0.2948,9_mcconnell_mitch_mitch mcconnell_mcconnell say
11,"nancy pelosi disregard, democrats start eye, disregard election, start eye, disregard election challenge",2,April 2021,0.12705,11_pelosi_nancy_nancy pelosi_speaker
15,"tense exchange house, pelosi tell conservative, mask floor, mask floor tense, lawmakers wear face",5,April 2021,-0.328,15_mask_wear_wear mask_mask mandate
18,"rosalynn carter, rosalynn carter win, rosalynn, carter win attend, carter win",1,April 2021,-0.13875,18_inauguration_biden inauguration_inauguration trump_attend
20,"administration announce billion, turn trump trade, trade carnage, announce billion puerto, trade carnage go",2,April 2021,0.9822,20_money_debt_raise_million
22,"qanon, rep greene back, commitment discredit, loeffler cite commitment, win qanon supporter",3,April 2021,-0.96805,22_qanon_conspiracy_believers_qanon conspiracy
23,"new favorite member, favorite member, greene qanon believer, take republican party, qanon take republican",1,April 2021,-0.2797,23_greene_taylor greene_marjorie_marjorie taylor
25,"craze election coup, society rig republicans, news host think, trump increasingly craze, think society rig",2,April 2021,-0.6934666666666667,25_fox_fox news_news_newsmax
27,"hawley, josh hawley, josh, altar presidential, altar presidential ambition",7,April 2021,-0.9941,27_hawley_josh hawley_josh_cruz
32,"electoral college, college, electoral, object, gop opposition grow",13,April 2021,-0.31140625,32_electoral college_college_electoral_college vote
33,"go worst, hours go worst, worst republicans, hours go, republican party apart",10,April 2021,-0.2846833333333333,33_party_republican party_republican_gop
