Topic,Words,Frequency,Timestamp,comment_sentiment,name
374,"cnn, cnn project, state cnn project, unite state cnn, state cnn",16,June 2020,0.00445,374_cnn_cnn project_state cnn project_unite state cnn
375,"alien hide, mankind ready say, say israeli, say israeli space, mankind ready",1,June 2020,-0.9858,375_ufos_alien_ufo_threaten alien
387,"rahm, rahm emanuel, emanuel, help lay retail, lay retail",1,June 2020,0.9403,387_rahm_rahm emanuel_emanuel_transportation
390,"key administration roles, biden eye defeat, eye defeat candidates, eye defeat, candidates key administration",1,June 2020,-0.11475,390_administration_biden administration_administration biden_roles biden administration
0,"covid, coronavirus, case, coronavirus case biden, stimulus",38,August 2020,-0.5457028571428572,0_covid_coronavirus_relief_covid relief
0,"covid, coronavirus, task force, task, relief",59,August 2020,-0.5457028571428572,0_covid_coronavirus_relief_covid relief
1,"georgia, runoffs, senate runoffs, georgia runoffs, reduce early vote",26,August 2020,0.16003125,1_georgia_runoffs_georgia senate_senate runoffs
1,"georgia, runoffs, runoffs georgia, senate runoffs, runoff",29,August 2020,0.16003125,1_georgia_runoffs_georgia senate_senate runoffs
2,"graham, lindsey graham, lindsey, lose grip reality, grip reality",15,August 2020,0.29332,2_impeachment_graham_lindsey graham_lindsey
2,"graham, lindsey graham, lindsey, mean save, chris cuomo",14,August 2020,0.29332,2_impeachment_graham_lindsey graham_lindsey
3,"vaccine, pfizer, dose, vaccine dose, covid vaccine",57,August 2020,-0.1336507936507936,3_vaccine_covid vaccine_pfizer_vaccines
3,"vaccine, pfizer, covid vaccine, vaccine effective, effective",69,August 2020,-0.1336507936507936,3_vaccine_covid vaccine_pfizer_vaccines
5,"trump think court, think court, court, win judge, supreme court",23,August 2020,0.13346,5_wisconsin_court_supreme court_supreme
5,"court, supreme court, supreme, wisconsin, obamacare",22,August 2020,0.13346,5_wisconsin_court_supreme court_supreme
6,"michigan, michigan lawmaker criticize, dead people cast, lawmaker criticize giuliani, criticize giuliani",10,August 2020,-0.011,6_michigan_certify_board_vote certify
6,"michigan, michigan supreme court, michigan supreme, michigan sad, sad confuse election",22,August 2020,-0.011,6_michigan_certify_board_vote certify
7,"joe biden, joe, biden win, acknowledge, acknowledge biden",46,August 2020,0.018060606060606,7_joe biden_joe_biden_biden win
7,"joe, joe biden, biden win, joe mitch, moderate biden",27,August 2020,0.018060606060606,7_joe biden_joe_biden_biden win
8,"fraud, election fraud, voter fraud, voter, claim",20,August 2020,-0.30038,8_fraud_voter fraud_voter_election fraud
8,"fraud, little evidence fraud, despite little, despite little evidence, little evidence",31,August 2020,-0.30038,8_fraud_voter fraud_voter_election fraud
9,"mcconnell, liability protection, mitch, mitch mcconnell, liability",13,August 2020,0.2556176470588235,9_mcconnell_mitch_mitch mcconnell_mcconnell say
9,"mcconnell, mitch, mitch mcconnell, mcconnell say trump, biden win mcconnell",34,August 2020,0.2556176470588235,9_mcconnell_mitch_mitch mcconnell_mcconnell say
11,"pair covid relief, pair covid, suggestion pair covid, suggestion pair, blast mcconnell suggestion",3,August 2020,-0.3722428571428571,11_pelosi_nancy_nancy pelosi_speaker
11,"pelosi, pelosi schumer blast, pelosi coronavirus relief, pelosi coronavirus, house coronavirus relief",6,August 2020,-0.3722428571428571,11_pelosi_nancy_nancy pelosi_speaker
12,"pennsylvania, pennsylvania win, court reject, biden pennsylvania win, supreme court reject",27,August 2020,0.1823413793103448,12_pennsylvania_nevada_trump campaign_court
12,"pennsylvania, nevada, court reject, reject trump campaign, trump campaign",18,August 2020,0.1823413793103448,12_pennsylvania_nevada_trump campaign_court
13,"twitter, trump family, tweet, impersonate trump, members twitter spread",9,August 2020,-0.9544857142857144,13_twitter_permanently_ban_twitter permanently
13,"loser twitter, donald trump result, trump result search, search loser, search loser twitter",7,August 2020,-0.9544857142857144,13_twitter_permanently_ban_twitter permanently
14,"lead contender, doug jones, biden attorney general, biden attorney, contender",5,August 2020,-0.9432,14_barr_attorney general_attorney_general
14,"barr appoint special, barr appoint, appoint special counsel, appoint special, special counsel",5,August 2020,-0.9432,14_barr_attorney general_attorney_general
15,"mask, overdo mask, overdo, wear, wear mask",7,August 2020,0.0414625,15_mask_wear_wear mask_mask mandate
15,"mask, mask mandate, mandate, wear, wear mask",37,August 2020,0.0414625,15_mask_wear_wear mask_mask mandate
16,"giuliani, rudy, rudy giuliani, disbar, watch rudy giuliani",8,August 2020,-0.0923846153846153,16_giuliani_rudy_rudy giuliani_lawyer rudy
16,"giuliani, rudy giuliani, rudy, witness, win quarantine",17,August 2020,-0.0923846153846153,16_giuliani_rudy_rudy giuliani_lawyer rudy
17,"election map, additional intervention supreme, allow stop day, vote look like, designer",8,August 2020,-0.977,17_turnout_early vote_early_vote
17,"turnout, trump shatter, referendum trump shatter, trump shatter turnout, voter turnout",11,August 2020,-0.977,17_turnout_early vote_early_vote
18,"inauguration, biden inauguration, lady gaga, gaga, lady",8,August 2020,-0.4131777777777777,18_inauguration_biden inauguration_inauguration trump_attend
18,"letter george, bush leave clinton, george bush leave, lesson grace, leave clinton",1,August 2020,-0.4131777777777777,18_inauguration_biden inauguration_inauguration trump_attend
19,"pardon, flynn, michael flynn, flynn judge, trump pardon",22,August 2020,0.0358384615384615,19_pardon_trump pardon_flynn_michael flynn
19,"pardon, pardon trump family, trump self pardon, trump self, trump pardon",9,August 2020,0.0358384615384615,19_pardon_trump pardon_flynn_michael flynn
20,"debt, fec record raise, private jet company, fee election fec, boyhood",8,August 2020,0.2497857142857142,20_money_debt_raise_million
20,"million sale, private helicopter, donald trump private, helicopter worth, helicopter worth million",8,August 2020,0.2497857142857142,20_money_debt_raise_million
21,"pence miss action, reject election loss, action trump administration, miss action trump, administration reject election",1,August 2020,0.9815,21_pence_mike pence_mike_vice
21,"pence, mike pence, credit pfizer vaccine, mike, credit pfizer",8,August 2020,0.9815,21_pence_mike pence_mike_vice
22,"qanon, tiktok, trounce trump attempt, congresswoman dismiss, aren task",5,August 2020,-0.8512666666666666,22_qanon_conspiracy_believers_qanon conspiracy
22,"qanon, lose election insist, silent followers suffer, ignore fact trump, victory plan qanon",4,August 2020,-0.8512666666666666,22_qanon_conspiracy_believers_qanon conspiracy
25,"fox news, fox, news, news try tell, tell trump party",17,August 2020,-0.005847619047619,25_fox_fox news_news_newsmax
25,"fox news, fox, news, news start feel, start feel pain",7,August 2020,-0.005847619047619,25_fox_fox news_news_newsmax
26,"giuliani positive coronavirus, session staffer positive, host mock rudy, coronavirus diagnosis get, staffer positive covid",2,August 2020,-0.4950272727272727,26_positive_test_test positive_positive covid
26,"test positive, positive, test, carson, ben carson",33,August 2020,-0.4950272727272727,26_positive_test_test positive_positive covid
28,"trump view poll, trump choices republican, panel poll, com poll afji, poll hate people",2,August 2020,-0.1366,28_poll_poll biden_biden lead_lead
28,"poll miss shy, way vote cast, voters fail predict, voters fail, trump voters fail",2,August 2020,-0.1366,28_poll_poll biden_biden lead_lead
30,"conservatives rally support, popular app, app conservatives rally, app conservatives, support leave twitter",1,August 2020,0.9698,30_parler_app_amazon_apple
30,"app store rank, parler top app, store rank, store rank follow, top app",1,August 2020,0.9698,30_parler_app_amazon_apple
31,"transgender, lgbtq, students supreme court, transgender students supreme, students supreme",12,August 2020,-0.2163428571428571,31_lgbtq_transgender_trans_gay
31,"frustration build biden, build biden cabinet, lgbtq pick, include lgbtq pick, include lgbtq",4,August 2020,-0.2163428571428571,31_lgbtq_transgender_trans_gay
32,"electoral college, electoral, college, biden win electoral, win electoral college",7,August 2020,-0.1302428571428571,32_electoral college_college_electoral_college vote
32,"electoral college, electoral, college, explainer electoral college, explainer electoral",7,August 2020,-0.1302428571428571,32_electoral college_college_electoral_college vote
33,"party, republican party, choose country party, defeat supporters, defeat supporters hold",9,August 2020,-0.15755,33_party_republican party_republican_gop
33,"understand hold, retire gop, party, republican party, republicans abandon retire",9,August 2020,-0.15755,33_party_republican party_republican_gop
34,"transition, plant loyalists biden, plant loyalists, loyalists biden transition, administration plant loyalists",6,August 2020,-0.6478833333333333,34_transition_biden transition_transition biden_transition trump
34,"transition, face call work, call work biden, call work, biden team transition",21,August 2020,-0.6478833333333333,34_transition_biden transition_transition biden_transition trump
35,"arkansas police, arkansas police chief, police chief, call violence democrats, police chief resign",8,August 2020,-0.2118,35_resign_capitol police_officer_police
35,"arkansas police chief, arkansas police, police chief, police chief resign, arkansas",7,August 2020,-0.2118,35_resign_capitol police_officer_police
37,"kamala harris, kamala, harris, vice president elect, vice president",25,August 2020,0.11678,37_kamala_kamala harris_harris_vice
37,"kamala harris, kamala, harris, call kamala, call kamala harris",14,August 2020,0.11678,37_kamala_kamala harris_harris_vice
38,"race gop senate, senate control presidency, win race gop, dems win race, presidency pbs",1,August 2020,-0.1834,38_senate_senators_democrats_gop senators
38,"leave win senate, trump biggest arm, democrats narrow path, johnson use senate, platform profoundly",5,August 2020,-0.1834,38_senate_senators_democrats_gop senators
40,"pentagon, limit imagination, defense department people, people loyal, raytheon lobbyist",3,August 2020,-0.1103666666666666,40_pentagon_loyalists_pentagon chief_advisory board
40,"pentagon, pentagon chief, general lead pentagon, retire general lead, general lead",7,August 2020,-0.1103666666666666,40_pentagon_loyalists_pentagon chief_advisory board
43,"texas sue, texas sue battleground, sue battleground, sue battleground state, texas",22,August 2020,-0.2764854838709677,43_texas_texas lawsuit_lawsuit_supreme court
43,"texas, texas lawsuit, lawsuit, join texas, support texas",47,August 2020,-0.2764854838709677,43_texas_texas lawsuit_lawsuit_supreme court
46,"arizona, arizona gop ask, gop ask, gop ask followers, arizona gop",15,August 2020,-0.4942833333333333,46_arizona_win arizona_biden win arizona_arizona gop
46,"arizona, will die, result arizona, will, arizona gop",9,August 2020,-0.4942833333333333,46_arizona_win arizona_biden win arizona_arizona gop
48,"judge seattle, outside oregon state, participate act violence, result participate act, blast ball rally",2,August 2020,-0.5356,48_protest_arm protest_rally_arm
48,"rally legal team, legal team gird, continue hold campaign, style rally legal, team gird",7,August 2020,-0.5356,48_protest_arm protest_rally_arm
49,"climate, climate change, change, isolate climate, use message biden",7,August 2020,-0.1296285714285714,49_climate_climate change_change_biden climate
49,"climate, climate change, biden climate, best time, carbon",8,August 2020,-0.1296285714285714,49_climate_climate change_change_biden climate
50,"melania, concede report melania, report melania, try husband, husband concede report",11,August 2020,0.3713875,50_melania_melania trump_ivanka_ivanka trump
50,"melania, melania trump, want home melania, trump want home, want home",16,August 2020,0.3713875,50_melania_melania trump_ivanka_ivanka trump
51,"ocasio, cortez, ocasio cortez, alexandria, alexandria ocasio cortez",9,August 2020,0.1143692307692307,51_ocasio_ocasio cortez_cortez_alexandria
51,"cortez, ocasio, ocasio cortez, alexandria ocasio cortez, alexandria ocasio",8,August 2020,0.1143692307692307,51_ocasio_ocasio cortez_cortez_alexandria
52,"lose, underwhelmed trump election, maddow underwhelmed, underwhelmed, small pitiful irrelevant",11,August 2020,-0.0483999999999999,52_lose_lose election_trump lose_loss
52,"lose, graham trump consider, consider run lose, trump consider run, run lose",12,August 2020,-0.0483999999999999,52_lose_lose election_trump lose_loss
53,"raise tax, trump raise tax, raise tax trump, republicans biden raise, raise tax biden",2,August 2020,-0.39625,53_tax_trump tax_tax return_tax cut
53,"tax, order trump administration, judge order trump, order trump, judge order",6,August 2020,-0.39625,53_tax_trump tax_tax return_tax cut
54,"biden laptop come, russia plant, hunter laptop hell, plant hunter, laptop come",2,August 2020,-0.9501,54_hunter_hunter biden_email_biden email
55,"say accept job, accept job joe, accept job, joe biden chief, fauci say accept",1,August 2020,-0.9252,55_fauci_fauci say_anthony fauci_anthony
56,"role play bomb, confront role play, play bomb, bomb hospital, play bomb hospital",1,August 2020,-0.90205,56_obama_barack obama_barack_obama say
56,"term obama presidency, term obama, obama presidency, obama, call generation",3,August 2020,-0.90205,56_obama_barack obama_barack_obama say
58,"krebs, krebs sue, cybersecurity, christopher krebs, christopher krebs sue",12,August 2020,-0.7288375,58_krebs_cybersecurity_fire_trump fire
58,"public policy clash, reckon public policy, secretary post election, policy clash, election reckon public",2,August 2020,-0.7288375,58_krebs_cybersecurity_fire_trump fire
59,"oligarchs fuel fever, lawyer eastern, lawyer eastern european, fuel fever dream, eastern european",6,August 2020,-0.65237,59_lawsuits_election lawsuits_lawyers_trump election lawsuits
59,"lawsuits, election lawsuits, lawsuits win, outcome professor trump, trump lawsuits",14,August 2020,-0.65237,59_lawsuits_election lawsuits_lawyers_trump election lawsuits
62,"proud boys, boys, proud, boys threaten, boys lawyer",2,August 2020,-0.52735,62_proud_proud boys_boys_boys leader
62,"boys leader hawaii, leader hawaii house, tam, local proud boys, leader hawaii",1,August 2020,-0.52735,62_proud_proud boys_boys_boys leader
63,"veto, trump veto, defense, pass defense, veto threat",11,August 2020,-0.7474583333333333,63_veto_trump veto_defense_override
63,"veto, veto proof, house pass defense, defense, pass defense",8,August 2020,-0.7474583333333333,63_veto_trump veto_defense_override
66,"cannabis coo, say cannabis coo, say cannabis, symbolic say, symbolic say cannabis",1,August 2020,-0.50905,66_marijuana_legalize_decriminalize_cannabis
66,"marijuana, marijuana survey find, marijuana survey, new high percent, program legalize weed",3,August 2020,-0.50905,66_marijuana_legalize_decriminalize_cannabis
67,"run reason, call attempt coup, attempt coup call, meyers call attempt, coup run reason",2,August 2020,0.008725,67_coup_attempt coup_attempt_trump coup
67,"gop nod crazy, crybaby trump go, column crybaby trump, coup gop nod, trump go coup",1,August 2020,0.008725,67_coup_attempt coup_attempt_trump coup
68,"student, student loan, loan, debt, forgive",4,August 2020,0.5869199999999999,68_student_student loan_loan_debt
68,"loan, student, student loan, cancel student loan, cancel student",3,August 2020,0.5869199999999999,68_student_student loan_loan_debt
69,"kelly loeffler, loeffler, kelly, sen kelly loeffler, sen kelly",3,August 2020,-0.9356,69_loeffler_kelly loeffler_kelly_perdue
69,"loeffler, state resign, secretary state resign, perdue, loeffler perdue",14,August 2020,-0.9356,69_loeffler_kelly loeffler_kelly_perdue
70,"warnock, raphael warnock, raphael, loeffler, newly uncover write",5,August 2020,-0.458375,70_warnock_raphael_raphael warnock_loeffler
70,"warnock, yes georgia senate, real radical, warnock real radical, yes georgia",2,August 2020,-0.458375,70_warnock_raphael_raphael warnock_loeffler
72,"cabinet, cabinet arwa mahdawi, tanden unremorseful bully, tanden unremorseful, neera tanden unremorseful",3,August 2020,-0.4020875,72_cabinet_biden cabinet_cabinet pick_biden cabinet pick
72,"cabinet, cabinet pick, biden cabinet pick, biden cabinet, pick",5,August 2020,-0.4020875,72_cabinet_biden cabinet_cabinet pick_biden cabinet pick
73,"concede, trump concede, concede amps, amps pressure gop, concede amps pressure",13,August 2020,-0.2592391304347826,73_concede_refusal_trump refusal_concede election
73,"concede, concede election, refuse concede, vocabulary right, word concede",11,August 2020,-0.2592391304347826,73_concede_refusal_trump refusal_concede election
74,"cuomo, deny covid go, pressure deny, pressure deny covid, political pressure deny",4,August 2020,-0.3249333333333333,74_cuomo_andrew cuomo_gov cuomo_andrew
74,"cuomo, news pfizer, bad news pfizer, bad news, pfizer",8,August 2020,-0.3249333333333333,74_cuomo_andrew cuomo_gov cuomo_andrew
76,"signal path gun, key pick, signal path, biden key pick, pick signal path",1,August 2020,-0.9997,76_gun_open carry_ban open_carry
76,"mall santa fire, right group blast, liberal mall santa, liberal mall, fire deny kid",2,August 2020,-0.9997,76_gun_open carry_ban open_carry
77,"kemp recertifies, kemp recertifies biden, recertifies biden win, recertifies biden, win georgia recount",1,August 2020,0.19942,77_recount_georgia recount_hand recount_georgia
77,"recount, collins lead recount, trump ally doug, recount trump ally, ally doug",2,August 2020,0.19942,77_recount_georgia recount_hand recount_georgia
79,"wall, border wall, border, smuggle, trump border wall",9,August 2020,-0.2765285714285714,79_border_border wall_wall_trump border
79,"construction, wall, border wall, construction cancel biden, actually build label",2,August 2020,-0.2765285714285714,79_border_border wall_wall_trump border
82,"sanders, bernie, bernie sanders, sanders lead, bernie sanders lead",10,August 2020,-0.19668,82_sanders_bernie_bernie sanders_mittens
82,"sanders, relief right msnbc, challenge sanders, msnbc ruhle challenge, msnbc ruhle",2,August 2020,-0.19668,82_sanders_bernie_bernie sanders_mittens
83,"prosecute, laws break, prosecute uphold laws, solution prosecute uphold, prosecute uphold",4,August 2020,-0.58524,83_prosecute_trump prosecute_comey_jam comey
83,"presidential criminal nightmare, criminal nightmare, presidential criminal, post presidential criminal, criminal nightmare begin",8,August 2020,-0.58524,83_prosecute_trump prosecute_comey_jam comey
84,"afghanistan soar, air strike afghanistan, kill air strike, civilians kill air, kill air",1,August 2020,-0.989,84_afghanistan_troop_taliban_withdrawal
84,"errors afghanistan, billions absurd, absurd errors, waste billions absurd, waste billions",1,August 2020,-0.989,84_afghanistan_troop_taliban_withdrawal
86,"medal, medal freedom, freedom, freedom ceremony, medal freedom ceremony",5,August 2020,0.4298999999999999,86_medal_medal freedom_freedom_presidential medal
86,"launch sidney powell, powell legal fund, fund toxic, scion launch, scion",1,August 2020,0.4298999999999999,86_medal_medal freedom_freedom_presidential medal
87,"aide exit white, complain presidency, away trump amp, house great, brat white house",3,August 2020,-0.3248777777777778,87_leave white house_leave white_leave_trump leave
87,"leave white, leave white house, leave, trump leave, continue trump leave",7,August 2020,-0.3248777777777778,87_leave white house_leave white_leave_trump leave
89,"lincoln project, lincoln, project def, lincoln project def, def",2,August 2020,0.3308999999999999,89_lincoln project_lincoln_project_lincoln project founder
89,"twitter work study, campaign ads twitter, work study, ads twitter work, hottest campaign ads",2,August 2020,0.3308999999999999,89_lincoln project_lincoln_project_lincoln project founder
95,"pandemic, pandemic ahead apparent, trump admin execution, pandemic interfere trump, elizabeth warren ayanna",3,August 2020,-0.28145,95_pandemic_pandemic trump_control pandemic_go control pandemic
95,"face public, compound ineptitude, public health poverty, malevolent mismanagement, malevolent mismanagement covid",1,August 2020,-0.28145,95_pandemic_pandemic trump_control pandemic_go control pandemic
96,"nance election, election wave republican, double number house, wave republican, wave republican women",1,August 2020,0.932,96_women_suburban women_suburban_white women
96,"record diversity, expect record diversity, congress expect record, expect record, congress expect",1,August 2020,0.932,96_women_suburban women_suburban_white women
97,"golf, golf course, course, second time defeat, club second",8,August 2020,-0.592425,97_golf_pga_trump golf_championship
97,"golf, golf course, course, cheat, church work transition",3,August 2020,-0.592425,97_golf_pga_trump golf_championship
102,"trump win election, win video falsely, youtube win video, falsely claim donald, youtube win",5,August 2020,-0.96815,102_video_cnn video_youtube_cnn
102,"youtube remove, youtube, videos, remove new videos, remove new",12,August 2020,-0.96815,102_video_cnn video_youtube_cnn
104,"reverse trump policies, order reverse trump, order reverse, executive order, trump policies",9,August 2020,0.2346066666666666,104_executive order_executive_order_reverse trump policies
104,"trump latest executive, order head scratcher, executive order head, scratcher historians, order head",1,August 2020,0.2346066666666666,104_executive order_executive_order_reverse trump policies
105,"think war, soldier think war, japanese soldier think, fnc wallace, think war go",1,August 2020,0.07298,105_cruz_ted_ted cruz_resign
106,"romney, call nation biden, nation biden, romney call nation, call nation",12,August 2020,0.1393416666666666,106_romney_mitt romney_mitt_romney say
106,"romney, mitt romney, mitt, tear republicans threaten, romney tear republicans",3,August 2020,0.1393416666666666,106_romney_mitt romney_mitt_romney say
110,"believe democracy stand, democracy stand trump, mccarthy believe democracy, mccarthy believe, incinerate",1,August 2020,-0.9771,110_mccarthy_kevin mccarthy_kevin_leader kevin mccarthy
111,"executions, governor mike, ohio governor mike, speed pace executions, mike dewine lethal",3,August 2020,-0.985775,111_executions_execution_execute_death penalty
111,"executions, executions lame duck, trump order series, federal executions lame, order series",3,August 2020,-0.985775,111_executions_execution_execute_death penalty
113,"steal election, steal, trump steal election, steal election trump, trump steal",8,August 2020,-0.2043071428571428,113_steal election_steal_steal election trump_try steal
113,"steal, steal election, try steal, claim steal, claim steal election",8,August 2020,-0.2043071428571428,113_steal election_steal_steal election trump_try steal
114,"opinion trump give, trump give lie, give lie election, election let away, give lie",1,August 2020,-0.7973500000000001,114_lie_fact check_fact_mislead claim
115,"come attack, attack city council, choice vote overwhelmingly, vote overwhelmingly approve, approve nyc",1,August 2020,0.7964,115_alaska_rank choice_rank choice vote_choice vote
115,"alaska, colorado, rank choice vote, rank choice, choice vote",8,August 2020,0.7964,115_alaska_rank choice_rank choice vote_choice vote
116,"takers tell, census takers, census takers tell, enter false, takers tell enter",2,August 2020,-0.2957,116_census_halt census_census count_end census
116,"takers tell, census takers, census takers tell, enter false, takers tell enter",2,August 2020,-0.2957,116_census_halt census_census count_end census
122,"amid pandemic, hill bar ski, christmas bring covid, carry amid, trump defend hold",3,August 2020,-0.04835,122_thanksgiving_holiday_holiday party_house plan
122,"concern state department, plan christmas party, department host, leftover best, reeve plan",2,August 2020,-0.04835,122_thanksgiving_holiday_holiday party_house plan
124,"abrams, stacey, stacey abrams, days crucial, help raise days",7,August 2020,0.4436428571428571,124_abrams_stacey_stacey abrams_abrams say
124,"stacey, abrams, stacey abrams, stacey abrams say, abrams say",11,August 2020,0.4436428571428571,124_abrams_stacey_stacey abrams_abrams say
125,"food, families hungry food, money early, billion trump food, scramble save economy",2,August 2020,-0.8783000000000001,125_food_food stamp_stamp_hunger
125,"biden help million, years biden help, help million americans, help million, sanders mcconnell",2,August 2020,-0.8783000000000001,125_food_food stamp_stamp_hunger
128,"pollution crisis, address pollution crisis, urge biden executive, address pollution, executive action address",1,August 2020,-0.9749,128_epa_trump epa_environmental_pollution
128,"trump epa, epa, trump epa finalize, epa finalize, finalize",3,August 2020,-0.9749,128_epa_trump epa_environmental_pollution
129,"mary, mary trump, uncle, uncle donald break, donald break",4,August 2020,-0.3304666666666666,129_mary_hitler_mary trump_mary miller
129,"mary trump warn, mary trump, mary, start break things, president start break",3,August 2020,-0.3304666666666666,129_mary_hitler_mary trump_mary miller
131,"kushner, jar, jar kushner, kushner approach, kushner approach trump",21,August 2020,0.2843799999999999,131_kushner_jar_jar kushner_ivanka
131,"kushner, jar kushner, jar, island, ivanka",4,August 2020,0.2843799999999999,131_kushner_jar_jar kushner_ivanka
132,"mcenany, kayleigh, kayleigh mcenany, biden supporters superspreader, house celebrations biden",2,August 2020,-0.9618,132_mcenany_kayleigh_kayleigh mcenany_secretary kayleigh
