Topic,Words,Frequency,Timestamp,comment_sentiment,name
0,"covid, coronavirus, bipartisan, relief, covid relief",59,January 2020,-0.4654880952380952,0_covid_coronavirus_relief_covid relief
1,"georgia, runoffs, georgia senate, senate, official",36,January 2020,-0.3130962962962962,1_georgia_runoffs_georgia senate_senate runoffs
2,"impeachment officially file, article impeachment officially, impeachment officially, officially file, dewine",4,January 2020,-0.56974,2_impeachment_graham_lindsey graham_lindsey
3,"vaccine, covid vaccine, fda, cdc, vaccine distribution",15,January 2020,-0.1468666666666666,3_vaccine_covid vaccine_pfizer_vaccines
4,"uae, iran, trump tell pompeo, pompeo wild iran, iran risk",11,January 2020,0.9315,4_iran_china_nuclear_israel
5,"wisconsin, wisconsin election result, wisconsin election, supreme court, supreme",21,January 2020,0.19752,5_wisconsin_court_supreme court_supreme
6,"michigan, lawmakers hear lot, hear lot theories, lawsuits target, lawsuit cite fraud",6,January 2020,-0.9638,6_michigan_certify_board_vote certify
7,"joe biden, joe, biden joe biden, biden joe, hyperpolarized politics",10,January 2020,0.1327866666666666,7_joe biden_joe_biden_biden win
8,"fraud, barr say, barr, voter fraud, widespread",34,January 2020,-0.4437055555555556,8_fraud_voter fraud_voter_election fraud
9,"mcconnell, coronavirus stimulus plan, coronavirus stimulus, stimulus plan, mitch",9,January 2020,-0.3971461538461538,9_mcconnell_mitch_mitch mcconnell_mcconnell say
11,"pelosi derelict, derelict duties, mcenany pelosi, duties covid, duties covid relief",1,January 2020,-0.9196333333333334,11_pelosi_nancy_nancy pelosi_speaker
12,"pennsylvania, court ask hear, democrats grow anxious, ask hear challenge, ask hear",3,January 2020,0.4373,12_pennsylvania_nevada_trump campaign_court
14,"barr, special counsel, durham, demand lock, durham special counsel",13,January 2020,-0.0004,14_barr_attorney general_attorney_general
15,"mask, mask mandate, mandate, wear mask, wear",7,January 2020,-0.9528,15_mask_wear_wear mask_mask mandate
16,"giuliani, rudy giuliani, rudy, giuliani reportedly, giuliani discuss",26,January 2020,0.0779666666666666,16_giuliani_rudy_rudy giuliani_lawyer rudy
17,"turnout, early vote, election day, early, american customer satisfaction",17,January 2020,-0.0703210526315789,17_turnout_early vote_early_vote
18,"graham trump attend, trump attend biden, graham trump, trump attend, attend biden inauguration",3,January 2020,-0.073576923076923,18_inauguration_biden inauguration_inauguration trump_attend
19,"pardon, push trump preemptively, pardon request push, vet pardon request, vet pardon",5,January 2020,-0.0962285714285714,19_pardon_trump pardon_flynn_michael flynn
20,"trump raise, trump raise million, raise million, raise, million",21,January 2020,-0.5617285714285715,20_money_debt_raise_million
21,"pence, mike pence, mike, rally attendees early, distribution begin weeks",5,January 2020,0.00805,21_pence_mike pence_mike_vice
23,"get busy, busy back conspiracy, pac get busy, get busy back, back conspiracy friendly",1,January 2020,-0.991,23_greene_taylor greene_marjorie_marjorie taylor
25,"surround outcasts crank, dangerous republicans, begin surround outcasts, turn independent taxpayer, turn independent",3,January 2020,-0.9456142857142856,25_fox_fox news_news_newsmax
26,"oppose new covid, seek profit, covid aid husband, firm seek, firm seek profit",4,January 2020,-0.94206,26_positive_test_test positive_positive covid
28,"poll, biden lead, lead trump, biden lead trump, poll biden",26,January 2020,0.2414333333333333,28_poll_poll biden_biden lead_lead
31,"gay parent, birth certificate, certificate, lgbt, birth",5,January 2020,-0.75815,31_lgbtq_transgender_trans_gay
32,"smith concede, christy smith concede, smith concede mike, concede mike garcia, concede mike",5,January 2020,-0.4466285714285715,32_electoral college_college_electoral_college vote
33,"leaders sense, leaders sense decency, sense decency, republican leaders sense, trump republican leaders",7,January 2020,0.4555333333333333,33_party_republican party_republican_gop
37,"kamala harris pick, patriotic american kamala, harris pick tina, tina flournoy chief, tina flournoy",2,January 2020,0.17635,37_kamala_kamala harris_harris_vice
38,"ahead key vote, ask bother, vote republicans ahead, ahead key, post ask bother",7,January 2020,-0.1575454545454545,38_senate_senators_democrats_gop senators
40,"pentagon, progressives demand pentagon, pentagon shake continue, lead isis, reportedly oust pentagon",3,January 2020,-0.7974600000000001,40_pentagon_loyalists_pentagon chief_advisory board
42,"debate, piss, chris wallace, wallace, trump family mask",3,January 2020,-0.9148,42_debate_presidential debate_virtual_debate trump
44,"drop time movement, mail ballot days, usps report drop, drop time, movement mail",5,January 2020,-0.9161333333333334,44_mail_ballot_usps_postal
45,"black america trump, black, racism, black america, america trump",9,January 2020,-0.0765,45_black_racist_black voters_racism
46,"arizona, ducey, trump certify, gov doug, gov doug ducey",18,January 2020,-0.0896947368421052,46_arizona_win arizona_biden win arizona_arizona gop
48,"assembly declare beverly, big vote, days trump hop, assembly declare, unlawful assembly declare",2,January 2020,-0.0787692307692307,48_protest_arm protest_rally_arm
50,"melania, famous daughter, cool famous daughter, hit slovenia, christmas season wish",4,January 2020,-0.1001363636363636,50_melania_melania trump_ivanka_ivanka trump
51,"tweet legislate, cortez tweet legislate, vote aoc raise, aoc raise fight, legislate miss vote",2,January 2020,-0.9934,51_ocasio_ocasio cortez_cortez_alexandria
52,"say lose election, trump say lose, say lose, donald trump say, trump election mean",3,January 2020,-0.3898071428571428,52_lose_lose election_trump lose_loss
53,"tax, gop plan increase, irs fund wealthy, rise wealth, rise wealth gap",3,January 2020,0.421325,53_tax_trump tax_tax return_tax cut
55,"figure approval, rise associate donald, associate donald trump, rise associate, rat rise associate",1,January 2020,-0.9442,55_fauci_fauci say_anthony fauci_anthony
56,"comedy series trump, giant kup, trump giant kup, kup, series trump giant",5,January 2020,-0.13874,56_obama_barack obama_barack_obama say
57,"trump declare position, ivanka trump declare, declare position, declare position abortion, position abortion",1,January 2020,0.6428,57_abortion_abortions_anti abortion_abortion pill
58,"cybersecurity, krebs, cybersecurity chief, trump campaign lawyer, lawyer",30,January 2020,-0.8270263157894737,58_krebs_cybersecurity_fire_trump fire
59,"antitrust, politicize antitrust effort, case trump use, scandal result law, politicization antitrust",1,January 2020,-0.6322285714285714,59_lawsuits_election lawsuits_lawyers_trump election lawsuits
60,"shift georgia democrats, highlight shift georgia, sanders highlight shift, embrace bernie, highlight shift",1,January 2020,0.9978,60_ossoff_jon ossoff_jon_warnock
62,"interview answer, supporter honest, supporter honest interview, honest interview, honest interview answer",1,January 2020,0.9964,62_proud_proud boys_boys_boys leader
63,"slip section, offer slip, offer slip section, section change defense, section change",1,January 2020,-0.937,63_veto_trump veto_defense_override
66,"marijuana, marijuana november, marijuana legal arizona, recreational marijuana legal, arizona way legally",2,January 2020,-0.9964,66_marijuana_legalize_decriminalize_cannabis
68,"student, free college, socialist takeover, college amount socialist, say free college",8,January 2020,0.28065,68_student_student loan_loan_debt
69,"kelly loeffler, loeffler, kelly, kelly loeffler ensure, protections preexist",2,January 2020,0.0389999999999999,69_loeffler_kelly loeffler_kelly_perdue
70,"warnock, rev ralph warnock, pulpit senate, suggest wnba tip, senate run pivotal",2,January 2020,-0.94145,70_warnock_raphael_raphael warnock_loeffler
72,"cabinet, biden cabinet, cabinet pick, term cabinet purge, possible second term",7,January 2020,0.48215,72_cabinet_biden cabinet_cabinet pick_biden cabinet pick
74,"cuomo, credentials, loopholes allow cop, want close, allow cop credentials",2,January 2020,-0.956675,74_cuomo_andrew cuomo_gov cuomo_andrew
75,"unemployment, unemployment benefit, benefit, nonsense months health, shortchanged unemployment",3,January 2020,-0.4747428571428571,75_unemployment_jobless_benefit_unemployment benefit
77,"sterling tell trump, gabriel sterling tell, sterling tell, man georgia recount, tell trump bigger",1,January 2020,-0.475375,77_recount_georgia recount_hand recount_georgia
79,"wall, border, wall despite, despite maintain, see write",8,January 2020,-0.66439,79_border_border wall_wall_trump border
80,"census, immigrants, justices, justices wary, conservative justices wary",3,January 2020,-0.9707,80_immigration_immigrants_undocumented_undocumented immigrants
81,"evangelicals stand trump, evangelicals stand, evangelicals, stand trump, stand",1,January 2020,-0.997,81_evangelicals_christian_evangelical_christians
82,"rep finkenauer, consideration biden labor, rep finkenauer consideration, finkenauer consideration biden, finkenauer consideration",1,January 2020,0.0051499999999999,82_sanders_bernie_bernie sanders_mittens
83,"mueller, abramsky, personally betray, sasha abramsky remove, andrew weissman break",2,January 2020,-0.6699,83_prosecute_trump prosecute_comey_jam comey
84,"mess afghanistan depart, fully repudiate, embrace fully, afghanistan depart president, repudiate america",1,January 2020,-0.9779,84_afghanistan_troop_taliban_withdrawal
86,"freedom screwup, say dolly parton, get medal freedom, say dolly, dolly parton get",1,January 2020,0.99,86_medal_medal freedom_freedom_presidential medal
87,"worth leave, donors worth leave, donors worth, worth leave office, camp explain trump",2,January 2020,-0.61685,87_leave white house_leave white_leave_trump leave
89,"lincoln, lincoln project, billboards, project, ivanka trump",5,January 2020,0.3071666666666666,89_lincoln project_lincoln_project_lincoln project founder
91,"agenda major policy, biden higher, devos blast, higher agenda, major policy",1,January 2020,0.9702,91_devos_betsy_betsy devos_education
95,"pandemic, vote nightmare people, pandemic get harder, secure house, nightmare people secure",3,January 2020,-0.2573260869565217,95_pandemic_pandemic trump_control pandemic_go control pandemic
96,"women, election trope, hyde smith vote, smith vote mike, smith vote",3,January 2020,0.9042,96_women_suburban women_suburban_white women
100,"bus, campaign bus, biden bus, caravan, biden campaign",39,January 2020,-0.4590161290322581,100_bus_campaign bus_biden bus_caravan
102,"issue violence election, official cnn, official cnn video, cybersecurity official cnn, violence election cybersecurity",1,January 2020,0.2178999999999999,102_video_cnn video_youtube_cnn
108,"rittenhouse, kyle rittenhouse, kyle, kyle rittenhouse shoot, ago witness",2,January 2020,-0.9821,108_rittenhouse_kyle rittenhouse_kyle_kenosha
110,"gop silence trump, recall mccarthy, election claim recall, claim recall mccarthy, recall mccarthy era",1,January 2020,-0.9913,110_mccarthy_kevin mccarthy_kevin_leader kevin mccarthy
111,"executions biden rally, rally america, duck executioner trump, duck executioner, trump prepare execute",2,January 2020,-0.9979,111_executions_execution_execute_death penalty
113,"steal election, steal election trump, steal, election trump adviser, trump adviser",7,January 2020,-0.2348,113_steal election_steal_steal election trump_try steal
114,"dishonesty define, presidency consequences last, trump presidency consequences, presidency consequences, consequences last",2,January 2020,0.9545,114_lie_fact check_fact_mislead claim
116,"trump bid census, hop high court, say hop high, hop high, bid census",1,January 2020,-0.9680333333333334,116_census_halt census_census count_end census
120,"finally admit wrong, wrong begin, experts finally admit, experts finally, admit wrong begin",1,January 2020,-0.96905,120_tucker_carlson_tucker carlson_carlson apologize
122,"holiday party, holiday, holiday party white, party white house, house plan",10,January 2020,0.0959666666666666,122_thanksgiving_holiday_holiday party_house plan
123,"editorial dismiss trump, editorial dismiss, dismiss trump learn, trump learn, dismiss trump",1,January 2020,-0.9426666666666668,123_remove_removal_remove office_trump remove
125,"families desperately need, insecurity rise congress, families desperately, desperately need economic, food insecurity rise",1,January 2020,-0.9705,125_food_food stamp_stamp_hunger
128,"push automakers abandon, automakers abandon, abandon trump suit, automakers abandon trump, trump suit challenge",1,January 2020,0.0395,128_epa_trump epa_environmental_pollution
129,"mary, second book america, uncle corrupt, immoral policies, second book",3,January 2020,-0.96465,129_mary_hitler_mary trump_mary miller
130,"report absentee, ballot request senate, georgia report absentee, report absentee ballot, request senate runoff",2,January 2020,-0.93545,130_georgia_judge_absentee_voter purge
132,"mcenany, kayleigh, kayleigh mcenany, mcenany whca, whca investigate",2,January 2020,0.0215,132_mcenany_kayleigh_kayleigh mcenany_secretary kayleigh
133,"authority order, defy governor covid, home order michigan, urge defy governor, restaurants urge defy",2,January 2020,-0.9834,133_restaurants_michigan_whitmer_restrictions
134,"overturn election, ally shoot, hill ally shoot, shoot overturn election, shoot overturn",4,January 2020,-0.4018285714285715,134_overturn election_overturn_effort overturn_effort overturn election
138,"fcc, ajit pai, ajit, pai, ajit pai departure",3,January 2020,0.00495,138_fcc_pai_ajit pai_ajit
141,"mccain, meghan, meghan mccain, close despite political, countrymen",2,January 2020,0.3472333333333333,141_mccain_cindy mccain_cindy_meghan
143,"vote texas, texas supreme court, texas supreme, harris county, texas",17,January 2020,0.1007166666666666,143_drive_drive vote_harris county_texas
147,"exercise right, felons exercise right, exercise right vote, florida felons exercise, felons exercise",1,January 2020,-0.5092714285714286,147_florida_felons_early vote_early
148,"arctic, oil arctic refuge, join big, bank win finance, join big bank",1,January 2020,0.9939,148_arctic_refuge_drill_wildlife refuge
157,"stock, perdue, technology big, new argue, know covid technology",2,January 2020,-0.1764,157_perdue_stock_trade_stock trade
163,"world threat, democracies world threat, world threat exception, threat exception, democracies world",2,January 2020,0.2273,163_democracy_american democracy_democracy trump_american
169,"presidency separate, majority job, separate poll, rat entire, trump receive majority",1,January 2020,-0.0018999999999999,169_approval rat_approval_rat_trump approval rat
174,"latino, democrats shouldn panic, latino voter turnout, latino mayor take, latino mayor",2,January 2020,0.058675,174_latino_latino voters_latinos_latino vote
182,"haunt hold tight, tight campaign, tight campaign close, bruise haunt hold, bruise haunt",2,January 2020,-0.0209499999999999,182_democrats_democrats decade_decade_lose deserve
183,"protest cause uptick, cause uptick, matter protest cause, cause uptick covid, protest cause",1,January 2020,0.8856,183_black live matter_live matter_black live_matter
187,"trudeau vote, americans flock canada, hopeful proceed smoothly, canada record number, proceed smoothly",2,January 2020,0.96095,187_trudeau_canada_canadians_canada trudeau
188,"defund police, defund, militarization sound better, appropriately respond domestic, refuse appropriately respond",2,January 2020,0.09105,188_defund_defund police_police_civil right leaders
189,"republic democracy, democracy dangerous wrong, republic democracy dangerous, america republic, america republic democracy",1,January 2020,0.9785333333333334,189_democracy_american democracy_fight democracy_democracy opinion
192,"biden urge pick, attorney fight, fight sweatshop, attorney fight sweatshop, labour department",1,January 2020,-0.4543071428571428,192_wray_fbi director_director_wray fbi
195,"aoc amid, manchin knock, aoc amid ongoing, ongoing feud, knock aoc amid",1,January 2020,0.97,195_manchin_joe manchin_sen joe manchin_sen joe
199,"trump era worse, era worse, trump era, worse, era",1,January 2020,-0.9799,199_worst_worst president_trump worst_trump worst president
201,"atlas, scott atlas, scott, atlas resign, scott atlas resign",42,January 2020,-0.7884447368421053,201_atlas_scott atlas_scott_atlas resign
202,"swamp birth trump, purge way door, purge way, swamp birth, massive government purge",2,January 2020,-0.3287,202_swamp_trump revoke_door_revoke
204,"governor kemp say, election illegal, say interfere election, say interfere, kemp say interfere",1,January 2020,-0.8386,204_kemp_brian kemp_georgia gov_brian
214,"say state remain, governor election war, reckless governor election, covid reckless, covid case time",2,January 2020,0.7293,214_desantis_florida_ron desantis_ron
219,"sign, people steal, people steal trump, confront people, confront people steal",5,January 2020,-0.514575,219_sign_paint_steal_trump sign
226,"campaign officials feel, say biden campaign, good pathways victory, good pathways, officials feel good",1,January 2020,0.9624,226_progressives_progressive_corporate_biden corporate hire
227,"ceiec, undermine venezuelan democracy, support illegitimate, support illegitimate maduro, regime efforts",1,January 2020,-0.9914,227_cuba_sponsor_sponsor terrorism_state sponsor
229,"elite legal, elite, kraken keeper, elite legal strike, sidney powell elite",1,January 2020,-0.9482,229_sidney powell_sidney_powell_kraken
230,"company base owner, owner condo, plasma company, base owner, base owner condo",4,January 2020,-0.8288,230_ppp_ppp loan_loan_company
231,"murkowski, concede say race, house race republican, senator murkowski tell, murkowski trump concede",2,January 2020,-0.04455,231_murkowski_lisa murkowski_murkowski call_lisa
233,"socialism, privilege wealth reveal, american socialist, socialist candidates, socialist candidates help",2,January 2020,0.2035166666666666,233_socialism_socialist_gay communists_communists socialism
236,"intimidation, noose, voter intimidation, missouri cover follow, hangman",3,January 2020,0.9533,236_intimidation_voter intimidation_voter_poll
237,"card seniors remain, remain limbo, seniors remain, seniors remain limbo, drug card seniors",1,January 2020,0.9903,237_drug_drug price_price_drug discount
240,"policy build trump, tough days, pitch normal biden, pitch normal, warn tough days",2,January 2020,-0.5445,240_foreign policy_foreign_policy_trump foreign
245,"legal challenge, challenge remain trump, say prepare legal, prepare legal, prepare legal challenge",2,January 2020,-0.0035,245_legal_legal challenge_challenge_trump legal
254,"ignore justice, rip repeatedly, alito rip, ignore justice sotomayor, rip repeatedly ignore",1,January 2020,0.9118,254_alito_justice alito_justice_speech
261,"republican miller meeks, district vote, iowa board, board certify republican, win iowas",1,January 2020,0.95335,261_iowa_caucus_iowa democrat_iowa caucus
265,"martial law, martial, impose martial, impose martial law, trump impose martial",6,January 2020,-0.9665333333333334,265_martial law_martial_law_declare martial
268,"information program, vet information program, vet information, hannity, admission vet",4,January 2020,-0.1971133333333333,268_hannity_sean hannity_sean_cough
278,"democrats journalists conspire, conspire rig election, shoot democrats journalists, admin shoot, admin shoot democrats",1,January 2020,-0.9719,278_christian_pastor_christian nationalist_pastor urge
279,"puerto, relationship puerto rico, year love hate, year love, love hate relationship",1,January 2020,0.9968,279_puerto_rico_puerto rico_statehood
287,"rename army, base defense, trump say oppose, rename army base, oppose rename",1,January 2020,-0.9959,287_rename_confederate_base_rename base
289,"plan declare, trump plan declare, premature victory, declare premature victory, declare premature",19,January 2020,-0.4460086956521739,289_plan declare_trump plan declare_premature victory_premature
295,"want successful, kushner, jar kushner, successful, jar",2,January 2020,0.1531,295_want successful_kushner_successful_jar kushner
297,"confusion militia, sow chaos post, post election confusion, chaos post, pro trump militias",2,January 2020,-0.9644666666666666,297_militias_militia_high risk_state high risk
298,"stern honor president, major pet poise, biden adopt cat, poise return white, adopt cat",2,January 2020,0.9797,298_dog_indoguration_dog major_biden dog
301,"rick scott, sen rick scott, sen rick, rick, gop sen rick",2,January 2020,-0.9918,301_rick scott_rick_scott_sen rick
303,"day violence chaos, violence chaos buy, chaos buy, chaos buy gun, americans worry election",1,January 2020,-0.6227,303_unrest_election violence_potential election_violence
304,"shift biden florida, administration treat, seniors expendable, treat seniors, administration treat seniors",2,January 2020,0.9709,304_seniors_florida seniors_warn sign trump_older
308,"advocate school, earthers, closure today, closure today flat, today flat earthers",1,January 2020,-0.35935,308_reopen_school_reopen school_school reopen
315,"voter suppression, suppression, deny gop engage, voter suppression try, lewandowski deny",2,January 2020,-0.562425,315_suppression_voter suppression_voter_despite smooth
324,"anonymous, miles taylor, miles, employ private security, trump anonymous go",2,January 2020,-0.97985,324_anonymous_miles taylor_miles_reveal anonymous
326,"donald trump, donald, trump, trump like president, donald trump like",1,January 2020,-0.2388647058823529,326_donald_trump like president_donald trump_donald trump like
328,"jen psaki, psaki, jen, jen psaki wear, sec jen",2,January 2020,0.4023,328_psaki_jen_jen psaki_press secretary jen
332,"california get billion, billion wildfire relief, receive prompt outrage, get billion wildfire, relief victims",1,January 2020,-0.74895,332_california_wildfire_wildfires_reject california
333,"boycott, plan restrain biden, plan restrain, georgia runoff boycott, threaten mitch",1,January 2020,-0.4352,333_boycott_boycott georgia_boycott runoff_boycott runoff elections
337,"election outcome barr, outcome barr, evidence fraud change, barr evidence fraud, fraud change election",36,January 2020,-0.7097455882352941,337_election outcome barr_outcome barr_evidence fraud change_barr evidence fraud
341,"fossil fuel, fossil, fuel subsidies face, subsidies face big, plan end fossil",3,January 2020,0.2131999999999999,341_fossil fuel_fossil_fuel_fossil fuel industry
363,"america second america, second america, second america better, america better ask, better ask",2,January 2020,-0.8707,363_america america_america_america wrong_american aby
368,"rural counties like, counties like, lose rural counties, democrats lose rural, rural counties",2,January 2020,-0.07455,368_rural_democrats rural_suburbs_rural america
376,"pennsylvania announce sign, announce sign, trump pennsylvania announce, pennsylvania announce, announce sign executive",1,January 2020,0.9912,376_fracking_ban fracking_fracking ban_ban
381,"squads national embarrassment, fire squads national, squads national, hang fire, hang fire squads",1,January 2020,-0.94595,381_fire squads_squads_executions_fire squad
382,"ice cube, cube, ice, cube defend, ice cube defend",2,January 2020,0.93015,382_ice cube_cube_ice_plan black
385,"bribery, scheme, bribery scheme, justice department investigate, department investigate",3,January 2020,-0.119147619047619,385_pardon scheme_bribery_scheme_bribery pardon
386,"censorship, condemn republican appointees, report pandemic impact, warren congresswoman, warren congresswoman haaland",2,January 2020,-0.9924,386_censorship_tech_censor_big tech
387,"rahm, rahm emanuel, emanuel, weigh rahm, emanuel transportation",4,January 2020,-0.46155,387_rahm_rahm emanuel_emanuel_transportation
389,"tanden, neera tanden, neera, omb, pick neera",8,January 2020,-0.14045,389_tanden_neera tanden_neera_pick neera
390,"lock bitter fight, lock bitter, bitter fight jockey, fight jockey, fight jockey underway",1,January 2020,-0.7619538461538462,390_administration_biden administration_administration biden_roles biden administration
0,"coronavirus, covid, empathy, relief, virus",51,February 2020,-0.44572,0_covid_coronavirus_relief_covid relief
0,"deaths, covid, coronavirus, deaths day, covid case",36,February 2020,-0.44572,0_covid_coronavirus_relief_covid relief
1,"georgia, official, georgia election official, georgia election, election official",51,February 2020,-0.3385423076923076,1_georgia_runoffs_georgia senate_senate runoffs
1,"georgia, runoffs, senate runoffs, ally urge georgia, georgia republicans sit",28,February 2020,-0.3385423076923076,1_georgia_runoffs_georgia senate_senate runoffs
2,"lindsey graham, lindsey, money donors lack, graham get money, lindsey graham get",5,February 2020,-0.4841666666666667,2_impeachment_graham_lindsey graham_lindsey
2,"graham, battle new south, jaime harrison lose, harrison lose lindsey, lindsey graham national",4,February 2020,-0.4841666666666667,2_impeachment_graham_lindsey graham_lindsey
3,"vaccine, approve pfizer, pfizer, approve pfizer biontech, perdue buy",9,February 2020,-0.1156399999999999,3_vaccine_covid vaccine_pfizer_vaccines
3,"vaccine, covid vaccine, vaccines, approval, coronavirus vaccine",12,February 2020,-0.1156399999999999,3_vaccine_covid vaccine_pfizer_vaccines
5,"wisconsin, supreme court, supreme, court, religious school",16,February 2020,-0.4020999999999999,5_wisconsin_court_supreme court_supreme
5,"pack, court, supreme court, supreme, pack court",9,February 2020,-0.4020999999999999,5_wisconsin_court_supreme court_supreme
