Topic,Words,Frequency,Timestamp,comment_sentiment,name
95,"pandemic, stock market, focus future pandemic, highlight gao, gao devastate report",9,November 2020,-0.4375028368794326,95_pandemic_pandemic trump_control pandemic_go control pandemic
96,"women, white women, women vote, white women vote, gop women",20,November 2020,-0.153,96_women_suburban women_suburban_white women
96,"women, number black, number black women, record number black, black women",6,November 2020,-0.153,96_women_suburban women_suburban_white women
97,"golf, go golf, trump golf, golf course, trump go golf",29,November 2020,-0.2613862068965517,97_golf_pga_trump golf_championship
97,"years time start, conservatives complain obama, golf out far, years conservatives complain, years conservatives",1,November 2020,-0.2613862068965517,97_golf_pga_trump golf_championship
98,"school, dean, university, american anti christian, anti american anti",10,November 2020,-0.4048,98_school_education_degree_university
98,"teachers, school, education, patriotic education, patriotic",14,November 2020,-0.4048,98_school_education_degree_university
99,"carroll, jean carroll, jean, rape, sexual",32,November 2020,-0.3114727272727273,99_rape_carroll_jean carroll_jean
99,"carroll, jean carroll, jean, sexual, defamation",21,November 2020,-0.3114727272727273,99_rape_carroll_jean carroll_jean
100,"clintons home, fbi investigate maga, ambush biden campaign, campaign bus horrify, bus horrify",2,November 2020,-0.3414,100_bus_campaign bus_biden bus_caravan
100,"train carry, gop lawmakers crash, train carry gop, crash garbage truck, crash garbage",1,November 2020,-0.3414,100_bus_campaign bus_biden bus_caravan
101,"immediately basic reason, power immediately basic, basic reason, need remove power, remove power immediately",1,November 2020,-0.1283099999999999,101_invoke amendment_pence_invoke_amendment
101,"legacy stroke, legacy stroke pen, trump legacy stroke, erase trump legacy, erase trump",1,November 2020,-0.1283099999999999,101_invoke amendment_pence_invoke_amendment
102,"cooper, video, anderson cooper, share video, anderson",14,November 2020,-0.5399909090909091,102_video_cnn video_youtube_cnn
102,"video, meltdown hilarious deepfake, park creators, hilarious deepfake, creators mock",6,November 2020,-0.5399909090909091,102_video_cnn video_youtube_cnn
103,"buttigieg, pete, pete buttigieg, transportation, ambassador",6,November 2020,0.9657,103_buttigieg_pete_pete buttigieg_transportation
103,"buttigieg, pete, pete buttigieg, transportation, buttigieg transportation",38,November 2020,0.9657,103_buttigieg_pete_pete buttigieg_transportation
104,"order, executive order, executive, house rescind appointment, regulation order day",5,November 2020,-0.4859607142857142,104_executive order_executive_order_reverse trump policies
104,"executive order, executive, order, powell white house, sidney powell white",8,November 2020,-0.4859607142857142,104_executive order_executive_order_reverse trump policies
105,"ted cruz, ted, cruz, shit, boss say ted",4,November 2020,-0.3346724137931035,105_cruz_ted_ted cruz_resign
105,"cia head, cruz, ted cruz, ted, good people texas",2,November 2020,-0.3346724137931035,105_cruz_ted_ted cruz_resign
106,"romney, undemocratic, mitt romney, mitt, undemocratic action",21,November 2020,-0.2241884615384615,106_romney_mitt romney_mitt_romney say
106,"romney, mitt romney, mitt, sad embarrass, embarrass",10,November 2020,-0.2241884615384615,106_romney_mitt romney_mitt_romney say
107,"dominion, dominion vote, dominion vote systems, vote systems, systems",21,November 2020,-0.2250888888888888,107_dominion_dominion vote_dominion vote systems_vote systems
107,"dominion, dominion vote, sidney, sidney powell, powell",21,November 2020,-0.2250888888888888,107_dominion_dominion vote_dominion vote systems_vote systems
108,"rittenhouse, kyle rittenhouse, kyle, kenosha, bail",40,November 2020,-0.8328828571428571,108_rittenhouse_kyle rittenhouse_kyle_kenosha
108,"kyle, rittenhouse, kyle rittenhouse, merchandise, fight fund free",4,November 2020,-0.8328828571428571,108_rittenhouse_kyle rittenhouse_kyle_kenosha
109,"treason, insurrection, aide purge, aide purge officials, days year old",12,November 2020,-0.6723166666666667,109_insurrection_treason_insurrection trump_violent insurrection
109,"unpack opinion trump, trump treasonous legal, legal scholar unpack, scholar unpack, scholar unpack opinion",7,November 2020,-0.6723166666666667,109_insurrection_treason_insurrection trump_violent insurrection
110,"mccarthy, kevin mccarthy, kevin, leader kevin mccarthy, leader kevin",9,November 2020,-0.8371076923076923,110_mccarthy_kevin mccarthy_kevin_leader kevin mccarthy
110,"mccarthy guarantee gop, mccarthyism worse, new kevin mccarthyism, guarantee gop house, new kevin",2,November 2020,-0.8371076923076923,110_mccarthy_kevin mccarthy_kevin_leader kevin mccarthy
111,"executions, brandon bernard, brandon, bernard, execution",37,November 2020,-0.86838125,111_executions_execution_execute_death penalty
111,"executions, death penalty, penalty, execute, death",16,November 2020,-0.86838125,111_executions_execution_execute_death penalty
112,"brief, intelligence, intel, intelligence brief, intel brief",28,November 2020,-0.0730937499999999,112_brief_intelligence_intelligence brief_intel
112,"brief, intelligence brief, intelligence, biden access, intel",43,November 2020,-0.0730937499999999,112_brief_intelligence_intelligence brief_intel
113,"steal election, steal, steal election trump, trump effort steal, effort steal election",28,November 2020,-0.3721425,113_steal election_steal_steal election trump_try steal
113,"steal, steal election, election steal, voters believe election, vote steal",10,November 2020,-0.3721425,113_steal election_steal_steal election trump_try steal
114,"fact check trump, fact check, check trump, fact, lie",12,November 2020,-0.6079375,114_lie_fact check_fact_mislead claim
114,"apples, lie year, mcnamee disinformation spread, study liars see, liars see",7,November 2020,-0.6079375,114_lie_fact check_fact_mislead claim
115,"alaska, rank choice vote, rank choice, choice vote, rank",29,November 2020,0.0335791666666666,115_alaska_rank choice_rank choice vote_choice vote
115,"alaska, colorado, happen colorado, colorado republican party, happen colorado republican",9,November 2020,0.0335791666666666,115_alaska_rank choice_rank choice vote_choice vote
116,"census, manager tell counter, use fake answer, anomalies, counter use",13,November 2020,-0.5326857142857143,116_census_halt census_census count_end census
116,"census, census case, trump census, skeptical trump census, trump census plan",10,November 2020,-0.5326857142857143,116_census_halt census_census count_end census
118,"gsa, transition, biden transition, begin gsa, emily murphy",88,November 2020,-0.292248717948718,118_gsa_transition_biden transition_begin gsa
118,"feedback button, button right, right field day, button right field, press feedback",1,November 2020,-0.292248717948718,118_gsa_transition_biden transition_begin gsa
119,"resent, enablers, constitution open eye, resent enablers, enablers resent",3,November 2020,-0.4915875,119_amendment_invoke_invoke amendment_remove
119,"rsum unfit public, unfit public office, mckinsey rsum, mckinsey rsum unfit, donald trump jan",2,November 2020,-0.4915875,119_amendment_invoke_invoke amendment_remove
120,"tucker, carlson, tucker carlson, carlson apologize, tucker carlson apologize",48,November 2020,-0.4793089285714286,120_tucker_carlson_tucker carlson_carlson apologize
120,"carlson, tucker, tucker carlson, vaccine tucker, vaccine tucker carlson",11,November 2020,-0.4793089285714286,120_tucker_carlson_tucker carlson_carlson apologize
121,"want carry, want carry gun, carry gun capitol, gun capitol, report newly elect",4,November 2020,-0.0868999999999999,121_boebert_lauren boebert_lauren_rep lauren boebert
122,"thanksgiving, holiday, holiday party, white house plan, house plan",49,November 2020,-0.2654368421052631,122_thanksgiving_holiday_holiday party_house plan
122,"thanksgiving, christmas, santa, fauci tell, fauci",13,November 2020,-0.2654368421052631,122_thanksgiving_holiday_holiday party_house plan
124,"abrams, stacey, stacey abrams, runoff stacey, runoff stacey abrams",17,November 2020,0.0481818181818181,124_abrams_stacey_stacey abrams_abrams say
124,"stacey, stacey abrams, abrams, stacey abrams run, abrams run",11,November 2020,0.0481818181818181,124_abrams_stacey_stacey abrams_abrams say
125,"food, food stamp, stamp, food bank, hunger",18,November 2020,-0.0023416666666666,125_food_food stamp_stamp_hunger
125,"food, poverty, freeze cherry, hungry, cherry",17,November 2020,-0.0023416666666666,125_food_food stamp_stamp_hunger
126,"nra, bankruptcy, nra report, nra report allege, executives irs",7,November 2020,-0.57767,126_bankruptcy_nra_file bankruptcy_rifle association
127,"nypd, drop case thousands, protest report, tower source, thousands arrest george",2,November 2020,-0.3286666666666666,127_nypd_floyd_george floyd_floyd protest
127,"nypd, floyd, floyd protest, george floyd, protest",9,November 2020,-0.3286666666666666,127_nypd_floyd_george floyd_floyd protest
128,"environmental, pollution, epa, environmental rollbacks, new environmental rollbacks",23,November 2020,-0.5665629629629629,128_epa_trump epa_environmental_pollution
128,"epa, trump epa, healey challenge, rollback occur week, vote damn",4,November 2020,-0.5665629629629629,128_epa_trump epa_environmental_pollution
129,"mary, mary trump, niece, scar lose, mary trump say",9,November 2020,0.2828666666666666,129_mary_hitler_mary trump_mary miller
129,"apologize share, representative apologize, apologize share post, hampshire state representative, neo nazi website",1,November 2020,0.2828666666666666,129_mary_hitler_mary trump_mary miller
130,"federal judge dismiss, election certification, election certification georgia, certification georgia, judge dismiss",9,November 2020,-0.5172772727272728,130_georgia_judge_absentee_voter purge
130,"georgia supreme, georgia supreme court, georgia, judge, court reject latest",22,November 2020,-0.5172772727272728,130_georgia_judge_absentee_voter purge
131,"kushner, jar kushner, jar, nyt bruni suggest, bunch lawyers",3,November 2020,-0.3721117647058823,131_kushner_jar_jar kushner_ivanka
131,"kushner, shell company, shell, secretly pay, company secretly pay",25,November 2020,-0.3721117647058823,131_kushner_jar_jar kushner_ivanka
132,"mcenany, kayleigh, kayleigh mcenany, secretary kayleigh, secretary kayleigh mcenany",22,November 2020,0.1188454545454545,132_mcenany_kayleigh_kayleigh mcenany_secretary kayleigh
132,"mcenany, kayleigh, kayleigh mcenany, press secretary kayleigh, secretary kayleigh mcenany",16,November 2020,0.1188454545454545,132_mcenany_kayleigh_kayleigh mcenany_secretary kayleigh
133,"michigan, restaurants, rise, rise new, whitmer",49,November 2020,-0.4325230769230769,133_restaurants_michigan_whitmer_restrictions
133,"whitmer, pass bill, restaurants, michigan, michigan house",17,November 2020,-0.4325230769230769,133_restaurants_michigan_whitmer_restrictions
134,"overturn, overturn election, trump attempt overturn, attempt overturn, attempt overturn election",32,November 2020,-0.4970855072463767,134_overturn election_overturn_effort overturn_effort overturn election
134,"overturn, overturn election, real plan overturn, real plan, overturn result talk",10,November 2020,-0.4970855072463767,134_overturn election_overturn_effort overturn_effort overturn election
135,"mishandle tucson, republican ballot mishandle, tucson vote site, ballot mishandle, ballot mishandle tucson",1,November 2020,-0.9943,135_box_drop box_ballot drop box_ballot drop
136,"amazon, workers, gig, alabama, amazon workers",13,November 2020,-0.4226749999999999,136_amazon_uber_prop_lyft
136,"amazon, warehouse, job scam, food stamp, stamp",11,November 2020,-0.4226749999999999,136_amazon_uber_prop_lyft
137,"maga march, million maga march, million maga, march, maga",66,November 2020,-0.2991361445783132,137_maga march_million maga_million maga march_march
137,"maga march, maga, million maga march, million maga, chant destroy gop",18,November 2020,-0.2991361445783132,137_maga march_million maga_million maga march_march
138,"fcc, pai, ajit pai, ajit, net neutrality",12,November 2020,-0.81188,138_fcc_pai_ajit pai_ajit
138,"fcc, pai, ajit pai, ajit, fcc chairman",23,November 2020,-0.81188,138_fcc_pai_ajit pai_ajit
139,"biden harris, harris, security brief, sale, celebrations biden harris",14,November 2020,0.0512868421052631,139_biden harris_harris_hay bale_bale
139,"biden harris, harris, presidential daily brief, presidential daily, daily brief",5,November 2020,0.0512868421052631,139_biden harris_harris_hay bale_bale
140,"wood, lin wood, lin, reject lin, reject lin wood",10,November 2020,-0.4811749999999999,140_wood_lin wood_lin_lawyer lin
140,"wood, lin wood, lin, lin wood go, wood go",4,November 2020,-0.4811749999999999,140_wood_lin wood_lin_lawyer lin
141,"mccain, cindy mccain, cindy, meghan, meghan mccain",9,November 2020,0.0220035714285714,141_mccain_cindy mccain_cindy_meghan
141,"mccain, cindy mccain, cindy, meghan, meghan mccain",14,November 2020,0.0220035714285714,141_mccain_cindy mccain_cindy_meghan
142,"scottish, sound, confidence sound finance, inspire confidence, finance sound business",12,November 2020,0.7845,142_scotland_scottish_golf_golf course
142,"scotland, scottish, golf, golf course, plane",1,November 2020,0.7845,142_scotland_scottish_golf_golf course
143,"deny republicans, reject effort toss, republicans petition throw, ballot county address, news judge reject",2,November 2020,-0.455325,143_drive_drive vote_harris county_texas
143,"chief suggest form, form union state, texas gop chief, gop chief suggest, chief suggest",4,November 2020,-0.455325,143_drive_drive vote_harris county_texas
144,"cheney, liz cheney, liz, trump respect sanctity, respect sanctity",4,November 2020,0.1811714285714285,144_cheney_liz cheney_liz_vote impeach
145,"conspiracy, conspiracy theories, theories, conspiracy theory, theory",30,November 2020,-0.6532719298245614,145_conspiracy_conspiracy theories_theories_theorists
145,"conspiracy, conspiracy theories, theories, conspiracy theorist, theorist",7,November 2020,-0.6532719298245614,145_conspiracy_conspiracy theories_theories_theorists
146,"raid, rebekah jones, rebekah, data, scientist",6,November 2020,-0.96018,146_raid_data scientist_data_rebekah jones
146,"covid data, raid, data, data scientist, florida",3,November 2020,-0.96018,146_raid_data scientist_data_rebekah jones
147,"refuse certify legitimate, legitimate vote felony, certify legitimate vote, certify legitimate, legitimate vote",6,November 2020,-0.3643838709677419,147_florida_felons_early vote_early
147,"florida, felons, shy attempt, election florida house, suggest democrats rely",6,November 2020,-0.3643838709677419,147_florida_felons_early vote_early
148,"arctic, refuge, right arctic, wildlife refuge, wildlife",50,November 2020,-0.5566690476190476,148_arctic_refuge_drill_wildlife refuge
148,"drill, arctic, reject trump drill, drill proposal major, administration move sell",3,November 2020,-0.5566690476190476,148_arctic_refuge_drill_wildlife refuge
149,"moms face trump, twitter threat mitch, experts protect speech, face trump order, smack moms face",3,November 2020,-0.4074714285714286,149_provoke_trump provoke_mcconnell_feed lie
149,"republicans stop feed, stop feed trump, beg republicans, beg republicans stop, feed trump beast",1,November 2020,-0.4074714285714286,149_provoke_trump provoke_mcconnell_feed lie
150,"fascism, fascist, trump fascist, nietzsche, violent fantasy trump",12,November 2020,-0.4696538461538461,150_fascism_fascist_fascists_trump fascist
150,"fascism, call fascism, time call fascism, time call, fascist",4,November 2020,-0.4696538461538461,150_fascism_fascist_fascists_trump fascist
151,"endgame, trump endgame, scaramucci, scaramucci predict piece, scaramucci predict",8,November 2020,-0.54276875,151_final days_final_days_trump final days
151,"flattery, flattery finality, dose flattery, get dose, trump get dose",6,November 2020,-0.54276875,151_final days_final_days_trump final days
152,"watch clear customs, reason know better, ways better, wait watch clear, read wait",7,November 2020,-0.567325,152_read_check read_lips check_read lips
152,"feel uneasy, uneasy, uneasy feel, uneasy feel uneasy, feel uneasy feel",5,November 2020,-0.567325,152_read_check read_lips check_read lips
154,"yellen, janet yellen, janet, treasury, treasury secretary",34,November 2020,-0.0149295081967213,154_yellen_janet yellen_janet_treasury
154,"yellen, janet yellen, janet, treasury, yellen treasury",7,November 2020,-0.0149295081967213,154_yellen_janet yellen_janet_treasury
155,"clayton say, obama interview, interview minutes cbs, clayton say step, say step early",2,November 2020,0.33706,155_minutes_interview_minutes interview_interview trump
155,"camera interview election, rag minutes interview, interview krebs, outlandish line donald, donald trump camera",2,November 2020,0.33706,155_minutes_interview_minutes interview_interview trump
156,"youtube, oann, youtube suspend, suspend, youtube temporarily",14,November 2020,-0.4386719999999999,156_youtube_youtube suspend_channel_trump channel
157,"perdue, stock, trade, stock trade, sen perdue",36,November 2020,-0.0965611111111111,157_perdue_stock_trade_stock trade
157,"perdue, stock, david perdue, stock trade, perdue stock",5,November 2020,-0.0965611111111111,157_perdue_stock_trade_stock trade
158,"haaland, interior, interior secretary, deb, deb haaland",18,November 2020,0.1586142857142857,158_haaland_interior_deb_deb haaland
158,"haaland, interior, deb, deb haaland, interior secretary",39,November 2020,0.1586142857142857,158_haaland_interior_deb_deb haaland
159,"minimum wage, wage, minimum, raise minimum, raise minimum wage",6,November 2020,-0.25246,159_wage_minimum wage_minimum_raise minimum wage
159,"minimum wage, minimum, wage, hour federal, stand way minimum",3,November 2020,-0.25246,159_wage_minimum wage_minimum_raise minimum wage
160,"gig company, gig, donations, halt ukraine aid, labor pacs",3,November 2020,-0.098951282051282,160_donations_political donations_pause_contributions
161,"filibuster, democrats nix filibuster, chance senate democrats, manchin shoot chance, senate democrats nix",1,November 2020,0.2013181818181818,161_filibuster_senate filibuster_power share_mcconnell
161,"filibuster, udall, tie nuke, democrat part speech, speech udall say",2,November 2020,0.2013181818181818,161_filibuster_senate filibuster_power share_mcconnell
162,"exotic, joe exotic, pardon, tiger, tiger king",10,November 2020,-0.48275,162_exotic_joe exotic_tiger_tiger king
162,"exotic, joe exotic, tiger, tiger king, pardon",14,November 2020,-0.48275,162_exotic_joe exotic_tiger_tiger king
163,"democracy, american democracy, american, democracy donald, democracy donald trump",25,November 2020,-0.3748135802469136,163_democracy_american democracy_democracy trump_american
163,"democracy, american democracy, come trump american, trump american democracy, trump american",10,November 2020,-0.3748135802469136,163_democracy_american democracy_democracy trump_american
164,"concede, concede trump, acknowledge biden, refuse concede, refusal concede",38,November 2020,-0.51085,164_concede_embarrassment_refusal concede_refuse concede
164,"trump refuse concede, cool trump refuse, biden play cool, refuse concede, play cool",4,November 2020,-0.51085,164_concede_embarrassment_refusal concede_refuse concede
165,"boeing, flight, max, boeing max, plane",7,November 2020,-0.6312166666666666,165_flight_passengers_faa_airlines
165,"contribute fatal crash, recertification senate, cover information, contribute fatal, cover information contribute",1,November 2020,-0.6312166666666666,165_flight_passengers_faa_airlines
166,"new jim crow, gop new jim, jim crow tactics, new jim, crow tactics",3,November 2020,-0.2110285714285714,166_civil war_civil_war_gop parrot far
166,"civil war, civil, war, fantasy secession, fantasy secession supreme",8,November 2020,-0.2110285714285714,166_civil war_civil_war_gop parrot far
167,"counties send mail, texas counties send, bill block texas, new republican bill, block texas counties",1,November 2020,0.45855,167_ballot drop_drop_limit_drop box
168,"paris, paris climate, climate, agreement, paris climate accord",7,November 2020,-0.807988888888889,168_paris_paris climate_rejoin_rejoin paris
168,"paris, pact, paris climate, rejoin, rejoin paris",3,November 2020,-0.807988888888889,168_paris_paris climate_rejoin_rejoin paris
169,"high election loss, hit seven, hit seven month, month high election, rat hit seven",1,November 2020,-0.2279166666666666,169_approval rat_approval_rat_trump approval rat
169,"favorability rat, favorability, rise trump slip, favorability rat rise, slip gallup",3,November 2020,-0.2279166666666666,169_approval rat_approval_rat_trump approval rat
170,"aoc, squad, lack core competencies, democratic establishment say, stag intervention",7,November 2020,0.1692111111111111,170_aoc_squad_aoc squad_aoc win
170,"aoc, squad, house committee, aoc squad, secret ballot",18,November 2020,0.1692111111111111,170_aoc_squad_aoc squad_aoc win
171,"yang, andrew yang, andrew, run mayor, yang democrats",7,November 2020,0.0263899999999999,171_yang_andrew yang_andrew_mayoral
171,"yang, andrew yang, andrew, mayoral, new york city",10,November 2020,0.0263899999999999,171_yang_andrew yang_andrew_mayoral
172,"election secure american, secure american, secure american history, election secure, american history",24,November 2020,-0.5461552631578948,172_election secure american_secure american_secure american history_election secure
172,"election secure american, secure american history, secure american, election secure, american history",20,November 2020,-0.5461552631578948,172_election secure american_secure american_secure american history_election secure
173,"health care, obamacare, care, health, health care measure",9,November 2020,0.1802739130434782,173_care_health care_obamacare_health
173,"obamacare sign, obamacare sign up, sign up, up, obamacare",4,November 2020,0.1802739130434782,173_care_health care_obamacare_health
174,"latino, latino voters, hispanic voters, voters, hispanic",20,November 2020,-0.2303508771929824,174_latino_latino voters_latinos_latino vote
174,"latino, latinos, latino voters, latino vote, diverse political",8,November 2020,-0.2303508771929824,174_latino_latino voters_latinos_latino vote
175,"hunter, hunter biden, investigation, tax, test joe",10,November 2020,-0.3584777777777778,175_hunter biden_hunter_tax_investigation
175,"hunter biden, hunter, burisma entities, subpoena seek, subpoena seek info",14,November 2020,-0.3584777777777778,175_hunter biden_hunter_tax_investigation
177,"holocaust, holocaust memorials, memorials, white nationalists, schwarzenegger",15,November 2020,-0.53886,177_schwarzenegger_arnold schwarzenegger_arnold_schwarzenegger compare
177,"nazi, trump hitler, schwarzenegger, trump dod action, hitler comparison come",5,November 2020,-0.53886,177_schwarzenegger_arnold schwarzenegger_arnold_schwarzenegger compare
178,"landscape, season, season total, total landscape, season total landscape",4,November 2020,-0.0315666666666666,178_landscape_season_season total_season total landscape
179,"wolf, chad wolf, chad, dhs, krebs dhs",5,November 2020,-0.96565,179_chad wolf_chad_wolf_wolf resign
179,"work dhs official, nationalist tie, work dhs, official leave administration, detail work dhs",1,November 2020,-0.96565,179_chad wolf_chad_wolf_wolf resign
180,"white house, photo resurface biden, welcome pence white, welcome pence, biden welcome pence",9,November 2020,-0.3022903225806452,180_white house_white_oval_oval office
180,"early look biden, look biden inner, early look, house discuss transfer, invite trump white",2,November 2020,-0.3022903225806452,180_white house_white_oval_oval office
181,"indigenous sovereignty immediately, sovereignty immediately halt, biden urge honor, indigenous sovereignty, fossil fuel pipelines",3,November 2020,0.1334428571428571,181_keystone_pipeline_keystone pipeline_cancel keystone
182,"democrats, losses, democrats decade, election losses, grapple congressional state",15,November 2020,-0.0253885572139303,182_democrats_democrats decade_decade_lose deserve
182,"republicans track, republicans track house, track house, democrats, ballot losses america",12,November 2020,-0.0253885572139303,182_democrats_democrats decade_decade_lose deserve
183,"black live matter, black live, live matter, matter, live",5,November 2020,-0.4350285714285714,183_black live matter_live matter_black live_matter
183,"black live matter, black live, live matter, matter, live",6,November 2020,-0.4350285714285714,183_black live matter_live matter_black live_matter
187,"canada, trudeau, trump canada, congrats trudeau, selley",6,November 2020,0.0686666666666666,187_trudeau_canada_canadians_canada trudeau
187,"attack darcy cartoon, tie response, send astronaut moon, deal trump tongue, send astronaut",2,November 2020,0.0686666666666666,187_trudeau_canada_canadians_canada trudeau
188,"defund, defund police, police, civil right leaders, right leaders",16,November 2020,-0.4269636363636364,188_defund_defund police_police_civil right leaders
188,"civil right leaders, right leaders, civil right, meet civil right, biden meet civil",8,November 2020,-0.4269636363636364,188_defund_defund police_police_civil right leaders
189,"democracy, good day democracy, good day, day democracy, democracy hold",15,November 2020,-0.177168,189_democracy_american democracy_fight democracy_democracy opinion
189,"democracy, try topple pillar, stain try topple, indelible stain, indelible",8,November 2020,-0.177168,189_democracy_american democracy_fight democracy_democracy opinion
