,id,subreddit,author,created_utc,domain,url,title,num_comments,selftext,score,link_flair_text
224,ek1b2w,sports,nemos_nightmare,2020-01-04 19:40:36,youtu.be,https://youtu.be/2Oo0d3ezUEY,R.I.P. Stuart Scott. ESPN was never the same after,2,,2,:news: News
269,ekcvap,sports,catlovertshirt_com,2020-01-05 13:15:02,skynetnews24.com,https://skynetnews24.com/what-tv-channel-is-sweden-vs-finland-on-schedule-time-for-world-juniors-2020-bronze-medal-game/,"What TV channel is Sweden vs. Finland on? Schedule, time for World Juniors 2020 bronze medal game",0,,0,:news: News
278,ekfjdy,sports,fidarupdates,2020-01-05 16:55:57,i.redd.it,https://i.redd.it/v3zctci7qz841.jpg,Playing for Nigeria at the U-17 level propelled me into limelight - Victor Osimhen,0,,1,:news: News
302,eklcok,sports,hekjazaka,2020-01-05 23:57:13,i.redd.it,https://i.redd.it/buo06aqat1941.png,FAST / SELECTED / 1000 % OK : TOOLS IPTV et IPTV PACK AND SERVER,0,,1,:news: News
330,eks4w0,sports,JeEvil_City,2020-01-06 10:06:27,sportskeeda.com,https://www.sportskeeda.com/wwe/aew-rumors-chris-jericho-possibly-injured-after-njpw-wrestle-kingdom-14?key2=48108,Chris Jericho possibly injured after NJPW WrestleKingdom 14,0,,1,:news: News
395,el9q9g,sports,arm-diaspora,2020-01-07 10:15:50,eng.armlink.am,https://eng.armlink.am/azerbaijani-kickboxer-challenges-armenian-athlete.html,AZERBAIJANI KICKBOXER CHALLENGES ARMENIAN ATHLETE,0,,1,:news: News
396,el9wcy,sports,fisto2018,2020-01-07 10:36:50,i.redd.it,https://i.redd.it/xv96q4g44c941.png,TOP TEN INDIAN TEAMS OF 2019 - Fisto,0,,1,:news: News
463,elubud,sports,PrincessBananas85,2020-01-08 15:40:53,espn.com,https://www.espn.com/olympics/story/_/id/28446146/skater-badly-injured-fall-youth-winter-olympic-ceremony-rehearsal,Skater badly injured after fall in Youth Winter Olympic ceremony rehearsal.,1,,1,:news: News
520,em8un3,sports,eurotickets20,2020-01-09 12:17:37,eurotickets2020.com,https://www.eurotickets2020.com/euro-cup-teams-tickets/england-euro-cup-tickets,EURO 2020: Tammy Abraham says I don’t want to curse myself,0,,1,:news: News
816,eo44s0,sports,dreampisces,2020-01-13 13:30:54,i.redd.it,https://i.redd.it/yk7y6a0vsja41.jpg,"China New Year Notice of holidays Our company holiday time is from jan.15 to jan.31,2020.work officially started on February 1st. whish:Happy new year to all new and old customers!Heathlybody!Allthe best!",0,,1,:news: News
863,eodo4q,sports,JPPT1974,2020-01-14 01:04:44,youtube.com,https://www.youtube.com/watch?v=FIqKLZbD6jA&amp;feature=share,Conor McGregor back in spotlight but is Donald Cerrone getting shaft? | ...,0,,1,:news: News
920,eooa56,sports,PrincessBananas85,2020-01-14 17:22:39,espn.com,https://www.espn.com/racing/story/_/id/28482872/nascar-changes-rules-try-improve-short-track-racing,NASCAR changes rules to try to improve short-track racing.,0,,1,:news: News
1074,eproyo,sports,Fattylifter,2020-01-16 23:31:50,gfycat.com,https://gfycat.com/hollowseverehedgehog,"Ava Fiore has the best ""brains"" in sports talk",0,,1,:news: News
1208,eqtknd,sports,Minimalist55,2020-01-19 07:58:32,youtube.com,https://www.youtube.com/watch?v=72ArYTVFqec,Conor McGregor Hugs Granny Cerrone,2,,1,:news: News
1321,eroi1s,sports,Backpainrelief67,2020-01-21 03:07:16,youtube.com,https://www.youtube.com/watch?v=tGDDeUf0sqA,Can Sports Related Activities Cause Back-Pain,0,,1,:news: News
1350,erxyby,sports,luisgustavo-,2020-01-21 17:29:58,abcnews.go.com,https://abcnews.go.com/Sports/nba-player-chandler-parsons-faces-potentially-career-ending/story?id=68406948,"NBA player Chandler Parsons faces potentially career-ending injury after car hit by drunk driver, law firm says",0,,1,:news: News
1380,es4vz2,sports,BTC_is_waterproof,2020-01-22 01:46:45,abc.net.au,https://www.abc.net.au/news/2019-12-05/bet365-whistleblower-says-winners-given-delays/11768486,"In this sports betting company, the winners are called 'problem customers' - The Sportsbook is Bet365",0,,1,:news: News
1448,esl4dw,sports,GamblingCity,2020-01-23 00:35:54,gamblingcity.com,https://www.gamblingcity.com/Casinos/Search.aspx?General=1&amp;Country=0&amp;Jurisdiction=0&amp;SiteType=0&amp;SearchTerm=Sports-Betting&amp;BonusID=0&amp;SoftwareLogoID=0&amp;DepositMethod=0&amp;WithdrawalMethod=0,Online Sports Betting Sites,0,,1,:news: News
1505,et4w7o,sports,PrincessBananas85,2020-01-24 03:55:17,bleacherreport.com,https://bleacherreport.com/articles/2872522-report-antonio-brown-turns-himself-in-on-arrest-warrant-for-battery-burglary,"Report: Antonio Brown Turns Himself in on Arrest Warrant for Battery, Burglary.",0,,1,:news: News
1535,etb3b4,sports,Aziewa,2020-01-24 14:27:08,azibase.com,https://www.azibase.com/2020/01/juventus-coach-maurizio-sarri-thanks.html?m=0,Juventus coach Maurizio Sarri thanks Ronaldo’s mum,0,,1,:news: News
1816,euua6c,sports,PrincessBananas85,2020-01-27 20:57:09,espn.com,https://www.espn.com/olympics/story/_/id/28576127/world-champion-canoeist-wins-doping-case-citing-bodily-fluids-boyfriend,"World champion canoeist wins doping case, citing bodily fluids from boyfriend.",1,,1,:news: News
1838,euxtgg,sports,wontstoplearning,2020-01-28 00:53:12,thewestnews.com,https://thewestnews.com/nfl-players-and-teams-pay-tribute-to-kobe-bryant/1094,NFL players and teams pay tribute to Kobe Bryant,0,,1,:news: News
1883,ev5eo5,sports,RISHUVERMA12,2020-01-28 13:10:41,cabbazar.com,https://cabbazar.com/taxi/agra-to-jaipur,Agra to Jaipur Cab Service,0,,1,:news: News
1949,evev7b,sports,aftermaz,2020-01-29 00:41:00,v.redd.it,https://v.redd.it/fxk4b7s66md41,Shaq hurting over Kobe,1419,,104,:news: News
2141,ewcdny,sports,real_gimbo,2020-01-30 21:11:38,youtu.be,https://youtu.be/Jib-8IDKAVM,Floorball CIV 0-51 SUI,0,,1,:news: News
2232,ewuey3,sports,TinyTornado7,2020-01-31 20:29:30,fivethirtyeight.com,https://fivethirtyeight.com/features/how-much-football-is-even-in-a-football-broadcast/,How Much Football Is Even In A Football Broadcast?,10,,1,:news: News
2275,ex2bfa,sports,napolipiucom,2020-02-01 06:56:04,napolipiu.com,https://napolipiu.com/le-cinque-imprese-memorabili-della-storia-del-calcio,Le cinque imprese memorabili della storia del calcio,0,,1,:news: News
2564,eynnv3,sports,abdelkrimbelasri,2020-02-04 09:38:10,thecoinlibra.com,https://thecoinlibra.com/index.php/2020/02/04/super-bowl-streaker-arrested-for-trespass-after-flashing-at-game/,Super Bowl Streaker Arrested For Trespass After Flashing At Game,0,,1,:news: News
2703,ezjpag,sports,zephillou,2020-02-06 00:35:59,thecollinscup.com,https://thecollinscup.com/,Making Triathlon TV worthy - The Collins Cup | Would you watch?,2,,1,:news: News
2720,ezogyz,sports,savagedesi,2020-02-06 06:53:14,youtube.com,https://www.youtube.com/watch?v=cBYXd1COF4c&amp;feature=share,Gervonta Davis arrested for battering ex in shocking video,3,,1,:news: News
2785,f00phz,sports,realplayer16,2020-02-06 22:51:11,today.com,https://www.today.com/news/public-memorial-kobe-bryant-other-helicopter-crash-victims-set-feb-t173415,Public memorial for Kobe Bryant and other helicopter crash victims set for Feb. 24,1,,1,:news: News
2841,f0bav0,sports,Steely1809,2020-02-07 14:36:29,bbc.co.uk,https://www.bbc.co.uk/sport/motorsport/51415685,Anthoine Hubert fatal crash report finds no single cause and no-one to blame,2,,1,:news: News
2890,f0mq2l,sports,SeeWhatEyeSee,2020-02-08 04:42:58,yukon-news.com,https://www.yukon-news.com/sports/richie-beatties-yukon-quest-dog-team-arrives-in-dawson-before-he-does/,Richie Beattie’s Yukon Quest dog team arrives in Dawson before he does,0,,1,:news: News
3004,f16h5o,sports,Rankings_hub,2020-02-09 09:30:35,youtu.be,https://youtu.be/wl2z0mruw9g,Top 100 world's highest paid sportsmen of 2019,0,,1,:news: News
3258,f2ldo5,sports,CrankkDatJFel,2020-02-12 04:18:53,i.redd.it,https://i.redd.it/97szz1mu5fg41.jpg,Westminster Best in Show winner is Siba the Standard Poodle! Standard Poodle last won in 1991.,3,,1,:news: News
3276,f2pd54,sports,headline-code,2020-02-12 10:40:50,headlinecode.com,https://headlinecode.com/dwyane-wade-reveals-about-his-12-year-old-transgender-child-at-ellen-show/,"Former Basketball Player, Dwyane Wade had set an example on parenting and show how to be a supportive parent. Till last year December, Wade used to refer to his 12-year-old child Zaya as she/her. Zaya was born biologically a male named, Zion.",0,,1,:news: News
3462,f3vnxy,sports,IntelligentYinzer,2020-02-14 17:40:07,blavity.com,https://blavity.com/morehouse-college-becomes-first-hbcu-to-have-a-polo-team,Morehouse College Becomes First HBCU To Have A Polo Team,2,,1,:news: News
3466,f3wprz,sports,ashusingh1409,2020-02-14 18:49:24,theguardian.com,https://www.theguardian.com/football/2020/feb/14/manchester-city-banned-from-champions-league-two-seasons-ffp-uefa,Manchester City banned for 2 years from UEFA Champions League.,0,,1,:news: News
3836,f660kq,sports,headline-code,2020-02-19 05:29:06,headlinecode.com,https://headlinecode.com/ryan-newman-condition-to-be-stable-after-daytona-500-crash/,American Ryan Newman is in hospital “serious but not life-threatening” condition after crashing in Florida on the last lap of the Daytona 500.,0,,1,:news: News
3913,f6nmu0,sports,kfh227,2020-02-20 04:32:34,theroot.com,https://www.theroot.com/we-calculated-how-much-we-pay-trump-to-play-golf-it-tu-1841793634,America's tenth highest paid athlete is....,9,,1,:news: News
4172,f87kqk,sports,flying-pharmacist,2020-02-23 09:58:58,youtu.be,https://youtu.be/DMaARCS9Sko,Paramotoring season 2019 Czechia,0,,1,:news: News
4209,f8dk64,sports,PrincessBananas85,2020-02-23 18:34:43,espn.com,https://www.espn.com/racing/nascar/cup/story/_/id/28766113/ryan-newman-being-treated-head-injury-no-internal-injuries,"Ryan Newman being treated for head injury, has no internal injuries.",0,,1,:news: News
4254,f8jk4p,sports,BilexOS,2020-02-24 01:32:11,nbcnews.com,https://www.nbcnews.com/news/sports/kobe-bryant-memorial-what-you-need-know-n1138586,Kobe Bryant memorial: What you need to know,0,,1,:news: News
4303,f8taut,sports,Aziewa,2020-02-24 16:00:46,azibase.com,https://www.azibase.com/2020/02/man-city-star-kyle-walker-comes-under.html?m=1,Man City star Kyle Walker comes under attack from ex-girlfriend after impregnating model,0,,1,:news: News
4320,f8wivk,sports,PrincessBananas85,2020-02-24 19:24:30,bleacherreport.com,https://bleacherreport.com/articles/2877780-vanessa-bryant-sues-helicopter-company-after-death-of-kobe-gianna-7-passengers,"Vanessa Bryant Sues Helicopter Company After Death of Kobe, Gianna, 7 Others",0,,1,:news: News
4372,f97qob,sports,kassiusx,2020-02-25 09:25:36,theguardian.com,https://www.theguardian.com/sport/2020/feb/25/boxing-deontay-wilder-blames-ring-walk-outfit-knockout-loss-tyson-fury,Deontay Wilder blames knockout loss to Tyson Fury on heavy ring-walk costume!,0,,1,:news: News
4384,f9b1fi,sports,Jarijari7,2020-02-25 14:28:05,smh.com.au,https://www.smh.com.au/sport/sports-events-hit-by-the-coronavirus-epidemic-20200225-p544c8.html,International sports events hit by the coronavirus epidemic,1,,1,:news: News
4430,f9nwzs,sports,radarloveless,2020-02-26 04:49:58,lockhaven.com,https://www.lockhaven.com/news/local-news/2019/11/melania-trump-receives-official-white-house-christmas-tree/,"MISSING: Alex Mardis (Lock Haven, PA)",3,,1,:news: News
4473,f9x6ec,sports,Cardioblaster,2020-02-26 17:55:34,bbc.com,https://www.bbc.com/sport/tennis/51647687,Maria Sharapova retires: Five-time Grand Slam champion 'says goodbye' to tennis at 32.,0,,1,:news: News
4478,f9y5h7,sports,Sherbetipster,2020-02-26 18:57:02,i.redd.it,https://i.redd.it/emd134s9ebj41.jpg,"#FIFA is looking for $1 Billion for #ClubWorldCup2021. Leaders of European clubs like #Barcelona, #Liverpool and #Juventus traveled to FIFA headquarter for discussing the creation of a joint venture between FIFA and the European Club Association.",0,,1,:news: News
4557,faglog,sports,SimonDanziger,2020-02-27 18:36:55,9to5google.com,https://9to5google.com/2020/02/27/youtube-tv-fox-regional-sports/,YouTube TV loses Fox Regional Sports over Sinclair contract dispute.,1,,1,:news: News
4574,fal485,sports,zettoae,2020-02-27 23:29:24,cbssports.com,https://www.cbssports.com/nba/news/new-kobe-bryant-sneaker-by-nike-will-reportedly-be-released-in-march/,New Kobe Bryant sneaker by Nike will reportedly be released in March,12,,1,:news: News
4597,fask2f,sports,BilexOS,2020-02-28 10:04:53,abcnews.go.com,https://abcnews.go.com/Sports/wireStory/olympic-champion-sun-yang-banned-years-doping-case-69276762,Olympic champion Sun Yang banned for 8 years in doping case,0,,1,:news: News
4712,fbj1r2,sports,alecmark1,2020-02-29 21:03:36,toroox.com,http://toroox.com/CZ6X,"Liverpool Shocked 3-0 by Watford, Suffer 1st Premier League Loss This Season",0,,1,:news: News
4781,fbwf94,sports,Aziewa,2020-03-01 16:30:03,azibase.com,https://www.azibase.com/2020/03/real-madrid-barcelona-el-clasico-will.html?m=1,Real Madrid-Barcelona: El Clásico will decide who tops the table,0,,1,:news: News
4785,fbxn57,sports,t800x,2020-03-01 17:50:18,profootballtalk.nbcsports.com,https://profootballtalk.nbcsports.com/2020/02/29/proposed-cba-increases-penalties-for-dui/,Proposed CBA increases penalties for DUI - ProFootballTalk,0,,1,:news: News
4796,fbzmxq,sports,alecmark1,2020-03-01 19:59:59,toroox.com,http://toroox.com/7SzeJ,"Serie A, soccer clubs clash in Italy amid coronavirus chaos",0,,1,:news: News
4806,fc1g6k,sports,alecmark1,2020-03-01 22:00:15,toroox.com,http://toroox.com/rap8Dt,Full time: Real Madrid 2-0 Barcelona,0,,1,:news: News
4840,fc9q1z,sports,SimplyAbraham,2020-03-02 09:39:00,dailymail.co.uk,https://www.dailymail.co.uk/news/article-8059081/Daniel-Sturridge-sues-ex-landlord-100-000-owners-child-named-Netflix-account-n.html,"Daniel Sturridge sues ex-landlord for £100,000 because owner's child named Netflix account 'n*****'",0,,1,:news: News
4921,fcwesm,sports,PrincessBananas85,2020-03-03 15:44:17,espn.co.uk,https://www.espn.co.uk/f1/story/_/id/28826857/the-fia-investigation-ferrari-raised-more-questions-answers,The FIA's investigation into Ferrari raised more questions than answers.,2,,1,:news: News
4989,fdddq6,sports,PrincessBananas85,2020-03-04 13:59:18,espn.co.uk,https://www.espn.co.uk/f1/story/_/id/28833967/rival-teams-threaten-legal-action-ferrari-fia-engine-settlement,Rival teams threaten legal action over Ferrari-FIA engine settlement.,0,,1,:news: News
5083,fe4z1x,sports,BlankVerse,2020-03-06 00:22:30,latimes.com,https://www.latimes.com/sports/story/2020-03-04/how-sports-leagues-federations-teams-are-addressing-coronavirus-outbreak,"How sports leagues, federations and teams are addressing coronavirus outbreak",3,,1,:news: News
5285,ffbqab,sports,Aethion,2020-03-08 12:11:29,i.redd.it,https://i.redd.it/l7tmhbwxwfl41.jpg,Before and after UFC. Lots of comments about out doing men but knockout would come before this damage in men’s fight surely.,0,,1,:news: News
5408,fg3l6b,sports,Gateoftheories,2020-03-09 22:53:33,youtu.be,https://youtu.be/kbKpvCPMp5w,Ederson Costs Man City The Derby - GOT Your Boots On,0,,1,:news: News
5545,fgyt1i,sports,Perfect_Gas,2020-03-11 15:22:18,nypost.com,https://nypost.com/2020/03/11/floyd-mayweathers-ex-girlfriend-josie-harris-found-dead-in-car/,Floyd Mayweather’s ex-girlfriend Josie Harris found dead in car,0,,1,:news: News
5589,fh5gf8,sports,BobbyThreeSticks,2020-03-11 22:13:02,twitter.com,https://twitter.com/fabrizioromano/status/1237861870767235074?s=21,Breaking: Juventus defender Daniele Rugani has been found POSITIVE for the COVID-19 Coronavirus,8,,3,:news: News
5597,fh64hw,sports,SportsRFunnyPodcast,2020-03-11 22:55:57,twitter.com,https://twitter.com/wojespn/status/1237873632992350212?s=20,NBA Is Weighing Taking A Hiatus On The Season...,0,,1,:news: News
5677,fhcx0o,sports,sportticketexchange1,2020-03-12 08:03:57,i.redd.it,https://i.redd.it/e91rgoob87m41.jpg,Champions League - Man City's battle with Real Madrid is going forward as intentional,0,,1,:news: News
5688,fhf4ci,sports,twistedlogicx,2020-03-12 11:51:33,twitter.com,https://twitter.com/BryanDFischer/status/1237968722217684992,"[Fischer] A chronological sampling of events from the day that was Wednesday, March 11.",2,,1,:news: News
5704,fhhlar,sports,Devz0r,2020-03-12 14:56:53,reuters.com,https://www.reuters.com/article/us-health-coronavirus-sport-factbox/factbox-sports-events-hit-by-the-coronavirus-pandemic-idUSKBN20Z0MP?feedType=RSS&amp;feedName=worldNews,Here is a list of international sports events hit by the coronavirus outbreak,2,,1,:news: News
5712,fhibpj,sports,twistedlogicx,2020-03-12 15:45:18,twitter.com,https://twitter.com/BFQuinn/status/1238128488743342080,[Quinn] The Big Ten Tournament is cancelled.,0,,1,:news: News
5721,fhix8k,sports,830a,2020-03-12 16:21:57,afp.com,https://www.afp.com/en/news/3955/world-athletics-fines-russia-10m-caps-neutral-russian-athletes-10-doc-1pt9ad6,"World Athletics fines Russia $10m, caps neutral Russian athletes at 10",0,,1,:news: News
5730,fhjs6q,sports,twistedlogicx,2020-03-12 17:13:52,twitter.com,https://twitter.com/KeithSmithNBA/status/1238151128665260032,[Smith] Multiple reports coming in that both MLB and NHL will suspend operations.,2,,1,:news: News
5762,fhmt2e,sports,twistedlogicx,2020-03-12 20:17:52,twitter.com,https://twitter.com/ShamsCharania/status/1238197296761896963,[Charania] The NCAA has canceled the men’s and women’s basketball tournaments and March Madness.,147,,1,:news: News
5801,fhp3wv,sports,WilliamHadleytb,2020-03-12 22:37:17,finance.yahoo.com,https://finance.yahoo.com/news/coronavirus-hits-american-sports-nba-nhl-mls-teams-playing-in-closed-arenas-194531173.html,"Coronavirus hits sports: March Madness canceled; NBA, MLS, NHL seasons suspended",0,,1,:news: News
5809,fhpesv,sports,NaBUru38,2020-03-12 22:56:36,bbc.com,https://www.bbc.com/sport/51605235,How the virus has impacted sporting events around the world,0,,1,:news: News
5842,fhsdpp,sports,Ghandee,2020-03-13 02:20:23,i.redd.it,https://i.redd.it/95ih2912ocm41.jpg,The world right now.,0,,1,:news: News
5889,fhxyp8,sports,cyberv0r,2020-03-13 11:09:56,theguardian.com,https://www.theguardian.com/sport/2020/mar/12/russian-athletics-federation-fined-10m-for-breaching-anti-doping-rules?utm_term=Autofeed&amp;CMP=twt_b-gdnnews&amp;utm_medium=Social&amp;utm_source=Twitter#Echobox=1584094834,Russian Athletics Federation fined $10m for breaching anti-doping rules,1,,1,:news: News
5891,fhy44f,sports,HotDamnGeoff,2020-03-13 11:23:55,twitter.com,https://twitter.com/premierleague/status/1238421022652628992,"The Premier League, FA, EFL and WSL have collectively agreed to postpone the professional game in England",1,,1,:news: News
5923,fi25o2,sports,Deanimator22,2020-03-13 16:17:08,thesportrag.com,https://www.thesportrag.com/single-post/5-Things-to-Talk-About-Now-that-Sport-is-Gone,5 Things to Talk About Now that Sport is Gone 😭,0,,1,:news: News
5930,fi2oom,sports,Noexit007,2020-03-13 16:49:57,sports.yahoo.com,https://sports.yahoo.com/ncaa-tournaments-championships-college-athletes-seniors-eligibility-year-petition-092848893.html,Coronavirus ended their careers. Now college athletes are fighting to get them back (Petition in Comments),3,,1,:news: News
5959,fi7hx8,sports,Steed_Davidson,2020-03-13 21:48:20,i.redd.it,https://i.redd.it/002gn2lfgim41.jpg,SMH,0,,1,:news: News
5971,fi96xj,sports,pl1589,2020-03-13 23:38:33,deadspin.com,https://deadspin.com/good-news-deadspin-is-publishing-again-bad-news-for-t-1842302392,Deadspin is back,0,,1,:news: News
5979,fia1f6,sports,wtf220,2020-03-14 00:37:49,youtube.com,https://www.youtube.com/watch?v=shV-NSb3uns,BREAKING: Ian Wright &amp; Premier League Pundits Reaction on Coronavirus,1,,1,:news: News
5996,fida11,sports,viridiansons,2020-03-14 04:54:36,youtu.be,https://youtu.be/4drQDTpAdwE,"Friday the 13th, and we're entering day two without sports, 3/13/2020 | Scott Ferrall Coast To Coast",0,,1,:news: News
6040,fiiyuj,sports,SIUMoose,2020-03-14 14:13:51,i.redd.it,https://i.redd.it/7bpmgn78cnm41.jpg,US Weekend Plans...,7,,1,:news: News
6124,fit1vf,sports,beelze_BUBBLES,2020-03-15 00:58:33,/r/sports/comments/fit1vf/today_in_sports_news/,https://v.redd.it/7eysdbp7jqm41,Today in sports news:,0,,1,:news: News
6128,fitq5g,sports,Paper_Rain,2020-03-15 01:46:26,usatoday.com,https://www.usatoday.com/story/sports/2020/03/14/march-madness-what-do-espn-fs-1-others-do-no-sports-show/5049002002/,What do sports TV networks show when there's no sports being played?,0,,1,:news: News
6214,fjaxw7,sports,[deleted],2020-03-15 23:35:13,twitter.com,https://twitter.com/TheSteinLine/status/1239331517916217345,[Stein] mportant development for sport throughout the country: The CDC just announced it is recommending NO gatherings of 50+ people in the United States for the next EIGHT weeks,0,[deleted],1,:news: News
6215,fjay68,sports,twistedlogicx,2020-03-15 23:35:44,twitter.com,https://twitter.com/TheSteinLine/status/1239331517916217345?15,[Stein] Important development for sports throughout the country: The CDC just announced it is recommending NO gatherings of 50+ people in the United States for the next EIGHT weeks,4,,1,:news: News
6219,fjb1rm,sports,Four_Minute_Mile,2020-03-15 23:42:21,bbc.co.uk,https://www.bbc.co.uk/sport/51902553,"Coronavirus: 'In this current dark reality, sport doesn't matter but it does'",2,,1,:news: News
6253,fjjh2g,sports,Fulot_,2020-03-16 11:28:52,i.redd.it,https://i.redd.it/bf5xp880s0n41.png,I think we should allow Aus League posts,39,,1,:news: News
6350,fk5drj,sports,saralove90,2020-03-17 13:37:19,time-new24.com,https://www.time-new24.com/sport/108/%d8%aa%d8%a3%d8%ac%d9%8a%d9%84-%d9%8a%d9%88%d8%b1%d9%88-2020-%d8%a7%d9%84%d9%89-%d8%a7%d9%84%d8%b9%d8%a7%d9%85-%d8%a7%d9%84%d9%85%d9%82%d8%a8%d9%84-2021/,تأجيل يورو 2020 الى العام المقبل 2021,0,,1,:news: News
6468,fkst1h,sports,CricketHaven,2020-03-18 16:55:34,youtube.com,https://www.youtube.com/watch?v=GHdWkS3llIU&amp;feature=share,Top 8 Most Funny Run Outs in Cricket History | Cricket Haven,0,,1,:news: News
6477,fkvr2k,sports,ash-leg2,2020-03-18 19:43:31,adn.com,https://www.adn.com/outdoors-adventure/iditarod/2020/03/18/thomas-waerner-of-norway-earns-his-first-iditarod-win/?fbclid=IwAR0hJDN7fMB0yHC9cnN7m3_RUCrhr1Mv7FacCMaaMFubHh836X2fjcWMRy4,Thomas Waerner of Norway wins the Iditarod,0,,2,:news: News
6484,fkxipk,sports,PumpyChowdown,2020-03-18 21:25:28,abc.net.au,https://www.abc.net.au/news/2020-03-18/coronavirus-afl-round-one-announcement/12066394,Australian Football League (AFL) to go ahead with round one of men's 2020 season amid coronavirus pandemic,0,,1,:news: News
6583,flkscs,sports,PrincessBananas85,2020-03-20 00:01:44,espn.com,https://www.espn.com/olympics/story/_/id/28927318/italian-official-pleads-ioc-rethink-olympic-plans,Italian official pleads for IOC to rethink Olympic plans.,0,,0,:news: News
6632,fluna1,sports,ExponentialExpansion,2020-03-20 13:02:24,wfla.com,https://www.wfla.com/sports/buccaneers/its-official-tom-brady-signs-with-buccaneers/,It’s official: Tom Brady signs with Buccaneers,0,,1,:news: News
6636,flvnns,sports,Jarijari7,2020-03-20 14:11:41,smh.com.au,https://www.smh.com.au/sport/what-happens-when-we-can-t-get-our-fix-of-sport-20200318-p54bjl.html,What happens when we can't get our fix of sport?,0,,1,:news: News
6721,fmico2,sports,PradeepMadgaonkar,2020-03-21 17:13:52,i.redd.it,https://i.redd.it/lw112o6o62o41.jpg,History of Kabbadi,0,,1,:news: News
6735,fmo3lc,sports,PrincessBananas85,2020-03-21 22:14:01,espn.com,https://www.espn.com/olympics/story/_/id/28936608/lolo-jones-says-ioc-postpone-olympics-due-coronavirus,Lolo Jones: IOC should postpone Olympics due to coronavirus.,3,,1,:news: News
6762,fmv103,sports,ando772,2020-03-22 05:54:32,i.redd.it,https://i.redd.it/y6p5j0ngy5o41.jpg,For you new AFL fans out there.,0,,1,:news: News
6772,fmxs9i,sports,newsteam_sport,2020-03-22 10:20:58,i.redd.it,https://i.redd.it/dnfw860r77o41.png,Share your sport with newsTeam,1,,1,:news: News
6774,fmxzqa,sports,icedpickles,2020-03-22 10:41:22,apnews.com,https://apnews.com/8beb0f8d992c3d9b296594b74d43a0ce,Global athletes group calls for postponement of Olympics,6,,1,:news: News
6776,fmzb2l,sports,icedpickles,2020-03-22 12:38:31,reuters.com,https://www.reuters.com/article/us-health-coronavirus-olympics-exclusive/exclusive-tokyo-organizers-quietly-plan-for-potential-olympic-delay-sources-say-idUSKBN219083,"Tokyo organizers quietly plan for potential Olympic delay, sources say",1,,1,:news: News
6788,fn38pl,sports,Monimix24,2020-03-22 17:21:44,zee.gl,https://zee.gl/xxYVpFv,Ponting says 'monkeygate' lowest point of his captaincy stint,0,,1,:news: News
6790,fn3t7w,sports,Wu36Chambers7,2020-03-22 17:54:35,clture.org,https://clture.org/sports-movies-netflix/,Some really good classic sports movies on Netflix right now.,0,,1,:news: News
6854,fnjs9v,sports,Fr1sk3r,2020-03-23 13:15:59,insider.com,https://www.insider.com/manny-pacquiao-unafraid-to-die-to-help-philippines-fight-coronavirus-2020-3,Manny Pacquiao said he's 'not afraid to die' to help the Philippines battle the coronavirus pandemic,226,,1,:news: News
6864,fno50h,sports,dickfromaccounting,2020-03-23 17:39:02,usatoday.com,https://www.usatoday.com/story/sports/olympics/2020/03/23/olympics-2020-ioc-member-tokyo-games-postponed-dick-pound-coronavirus/2899848001/,IOC member says that 2020 Tokyo Olympics will be postponed due to coronavirus pandemic,2,,1,:news: News
6871,fnqifd,sports,updownvizzii,2020-03-23 19:45:35,upsidedownblogz.blogspot.com,https://upsidedownblogz.blogspot.com/2020/03/team-sports-everlasting-bond-team-is-it.html?m=1,All The Champions Have Champion Teams ! Find Out How Your Team Influences You and Your Life Now!,1,,1,:news: News
6900,fo2iq1,sports,Stevecage65,2020-03-24 09:55:42,knowfacts.info,https://www.knowfacts.info/2020/03/a-leagues-richest-club-says-virus-crisis-is-biggest-fiscal-threat.html?m=1,A-League's Richest Club Says Virus Crisis Is 'Biggest Fiscal Threat',0,,1,:news: News
