,id,subreddit,author,created_utc,domain,url,title,num_comments,selftext,score,link_flair_text
25402,k0wara,sports,Jimbrutan,2020-11-25 17:18:24,google.com,https://www.google.com/amp/s/www.dailymail.co.uk/sport/football/article-8986821/amp/Diego-Maradona-died-suffering-cardiac-arrest-according-reports.html,Diego Maradona dies at age 60 due to cardiac arrest,0,,1,:news: News
25416,k0wu49,sports,TheRealMimiBoom,2020-11-25 17:44:17,i.redd.it,https://i.redd.it/p0jqt7p5bf161.jpg,Biggest legend in the world Diego Maradona.. You have been a legend to the Football World and we will all miss you 😔😭🙏🏻 Rest in Piece Diego Maradona ❤️#RipDiego. #football #legend #rip,0,,1,:news: News
25447,k0z315,sports,fifaboyk,2020-11-25 19:32:38,i.redd.it,https://i.redd.it/u73z3fohuf161.jpg,R.I.P Maradona but legends never die❤️❤️🥇💔😥😭😭,0,,1,:news: News
25448,k0zchb,sports,Mostafa_Dahroug,2020-11-25 19:45:32,mostafadahroug.com,https://www.mostafadahroug.com/2020/11/the-death-of-diego-armando-maradona.html,The death of Diego Armando Maradona the greatest footballer in history,1,,1,:news: News
25450,k0zevm,sports,niiigga,2020-11-25 19:48:51,trendswide.com,https://trendswide.com/global-mourning-over-the-death-of-the-golden-boy-football-cries-goodbye-maradona/,Global mourning over the death of the “golden boy” .. Football Cries Goodbye Maradona,0,,1,:news: News
25465,k11qgi,sports,Matthew_Joe,2020-11-25 21:49:17,youtu.be,https://youtu.be/vyPrPEsjD9Q,‬⁩ ‎⁦‪#Argentina‬⁩ ⁦‪#Napoli‬⁩ and all the world are sad today 😔 RIP ❤️⁦‪#Maradona,0,,1,:news: News
25473,k13ay7,sports,kiwi_like,2020-11-25 23:09:39,apnews.com,https://apnews.com/article/diego-maradona-dies-argentina-soccer-60-8fcf6daf7b350e7612c050724455ac17,Argentine soccer great Diego Maradona dies at 60,0,,1,:news: News
25505,k1b7a7,sports,productstodays,2020-11-26 08:01:18,productstoday.co,https://www.productstoday.co/,Best Products Guide - Professional guidance for product shopping.,0,,1,:news: News
25544,k1fz1t,sports,ritrends1,2020-11-26 14:19:04,ritrends.com,https://www.ritrends.com/2020/11/iron-mike-tyson-in-big-comeback-fight.html,"Iron Mike Tyson in a big comeback fight, to make 10m dollars against Roy Jones Jr The massive earnings Mike Tyson will make in his boxing comeback against Roy Jones Jr has been revealed",0,,1,:news: News
25580,k1kbkx,sports,PrincessBananas85,2020-11-26 18:15:23,espn.com,https://www.espn.com/olympics/trackandfield/story/_/id/30393995/100-meter-world-champion-christian-coleman-appeals-doping-ban-court-arbitration-sport,100-meter world champion Christian Coleman appeals doping ban to Court of Arbitration for Sport.,1,,1,:news: News
25583,k1ly0w,sports,Ok_Windows,2020-11-26 19:44:09,everythingcanada.org,https://www.everythingcanada.org/blog/in-the-name-of-national-interest-elite-athletes-score-border-exemptions,"In the name of national interest, elite athletes score border exemptions",1,,1,:news: News
25589,k1mup3,sports,TOOOOOOOOOOOOOOOON,2020-11-26 20:35:12,zcodesystem.com,http://zcodesystem.com/webinarmainehill.php,Patrick Meme* Passive Income But For Sport Junkies.(How To:Bet In Any &amp; All Sports &amp; WIN!),0,,1,:news: News
25591,k1n9kw,sports,GOKU1927183,2020-11-26 20:58:58,youtube.com,https://www.youtube.com/watch?v=DFWHKfay7ec,"""JUAN DE DIOS ROMÁN""DERRAME CEREBRAL IRREVERSIBLE",2,,1,:news: News
25642,k23h8e,sports,GOKU1927183,2020-11-27 15:45:57,youtube.com,https://www.youtube.com/watch?v=BAevvDL7C8Q,"FALLECE""JUAN DE DIOS ROMÁN""",1,,1,:news: News
25796,k33xtu,sports,naveedflix,2020-11-29 05:35:36,youtu.be,https://youtu.be/Cmd77zvfgTM,Jones Jr Vs Mike Tyson Officially DRAW,29,,1,:news: News
25816,k35szu,sports,Optimal_Perspective2,2020-11-29 08:12:13,youtube.com,https://www.youtube.com/watch?v=mSe74-EcuyU,Mike Tyson vs Roy Jones Jr -( OFFICIAL )FULLFIGHT HIGHLIGHTS - 2020,0,,1,:news: News
25834,k39ey9,sports,smirse,2020-11-29 13:31:48,seraviral-ova.com,https://www.seraviral-ova.com/2020/11/The-transfer-window-Thauvin-says-he-is-touched-by-the-interest-of-AC-Milan.html,"[News]The transfer window: Thauvin says he is ""touched"" by the interest of AC Milan",0,,1,:news: News
25854,k3beqv,sports,TibPey,2020-11-29 15:42:19,i.redd.it,https://i.redd.it/5664ys8i87261.jpg,"YouKoach, the UBER of sport will launch in 2021!",0,,1,:news: News
25873,k3e7ms,sports,PrincessBananas85,2020-11-29 18:16:17,espn.com,https://www.espn.com/olympics/story/_/id/30412853/report-cost-tokyo-olympic-delay-put-2-billion,Report: Cost of Tokyo Olympic delay put at about $2 billion.,2,,1,:news: News
25889,k3grxr,sports,johnbradleypeele,2020-11-29 20:37:09,apnews.com,https://apnews.com/article/college-football-sports-football-james-franklin-tennessee-f3eb8897a9bde41802ebc48d41b174f0,Vanderbilt fires coach Derek Mason in his 7th season,3,,1,:news: News
25890,k3gt4y,sports,johnbradleypeele,2020-11-29 20:38:59,apnews.com,https://apnews.com/article/nfl-jeff-driskel-denver-broncos-kendall-hinton-new-orleans-saints-d61c906911fa12348e82a1b9353707dd,Broncos promote rookie receiver Kendall Hinton to sub at QB,0,,1,:news: News
25955,k3tc4y,sports,goat1408,2020-11-30 10:24:01,youtu.be,https://youtu.be/2Flpkaek_ro,Nate Robinson in Rocky IV,0,,1,:news: News
25959,k3u88i,sports,Major-Woodpecker476,2020-11-30 11:36:08,vancouversun.com,https://vancouversun.com/news/covid-19-at-least-42-people-test-positive-in-surrey-gym-outbreak,COVID-19: At least 42 people test positive in Surrey gym outbreak,5,,1,:news: News
26014,k3xngb,sports,PrincessBananas85,2020-11-30 15:16:14,espn.com,https://www.espn.com/olympics/story/_/id/30420025/organizers-tokyo-games-confirm-reported-3-billion-added-costs-1-year-postponement,Organizers of Tokyo Games won't confirm reported $3 billion added costs of 1-year postponement.,3,,1,:news: News
26054,k4c7ev,sports,PrincessBananas85,2020-12-01 03:05:57,espn.com,https://www.espn.com/mma/story/_/id/30425148/olympic-gold-medalist-boxer-claressa-shields-signs-multi-year-deal-fight-mma-sources-say,"Olympic gold medalist boxer Claressa Shields signs multi-year deal to fight in MMA, sources say.",7,,1,:news: News
26072,k4gyny,sports,BasilePupking,2020-12-01 08:24:45,youtube.com,https://www.youtube.com/watch?v=-8Gwzud-PiE&amp;feature=share,Дзюба слив видео - выводы из скандала,0,,1,:news: News
26074,k4gz7w,sports,Inspiration_lover333,2020-12-01 08:26:02,briefly.co.za,https://briefly.co.za/88873-mike-tyson-packs-a-punch-54-fighting-a-draw-roy-jones-jr.html?fbclid=IwAR29wD-joTsO4LtPanKkPSsjHvjXntw6uiNNwYMw5ryBgjWnD9z124TCG6E,"Mike Tyson still packs a punch at 54, fighting to a draw against Roy Jones Jr.",1,,1,:news: News
26108,k4sz3s,sports,uumoodypayload425,2020-12-01 20:10:48,i.redd.it,https://i.redd.it/vpltafmrum261.jpg,"New template, idk.",0,,1,:news: News
26170,k5bgqf,sports,ritrends1,2020-12-02 15:38:19,ritrends.com,https://www.ritrends.com/2020/12/stephanie-frappart-becomes-first-female.html,Stephanie Frappart becomes the first female referee to take charge of men’s league,0,,1,:news: News
26344,k74tgq,sports,[deleted],2020-12-05 09:49:10,seraviral-ova.com,https://www.seraviral-ova.com/2020/12/Full-Leeds-United-squad-revealed-for-Chelsea-trip-as-defenders-absence-raises-questions.html,Full Leeds United squad revealed for Chelsea trip as defender's absence raises questions,0,[deleted],1,:news: News
26366,k7a8vc,sports,AthleteDry1821,2020-12-05 16:17:28,youtu.be,https://youtu.be/gIEaceWeNW0,Top 10 Athletes who earned millions of dollars,0,,1,:news: News
26432,k7wg2g,sports,_literaryexpress_,2020-12-06 16:11:56,literaryexpress.org,https://literaryexpress.org/2020/12/06/pompeii/,"'I smell baby’s head and hear her heartbeat. She’s alive – for now. She breathes and she cries, heaving little sighs as she tries to wail time and time again. She’s not the only one – this baby of mine.'",0,,1,:news: News
26445,k81104,sports,GOKU1927183,2020-12-06 20:10:33,youtube.com,https://www.youtube.com/watch?v=GcqaZnkuFlw,"RAFAEL RUBIO LUJAN""RAFAELILLO""VUELVE A TOREAR!!!",1,,1,:news: News
26466,k84i7q,sports,LMkingly,2020-12-06 23:19:42,instagram.com,https://www.instagram.com/p/CIeQ8EmFJNq/?igshid=6gxovatlx10n,"Floyd Mayweather vs Logan Paul. Set for february 20, 2021",0,,1,:news: News
26467,k84jjw,sports,Vaynar,2020-12-06 23:21:45,instagram.com,https://www.instagram.com/p/CIeUxN5FfhY/?igshid=zbckbgjdrtdh,SportsCenter on Instagram: “Floyd Mayweather will be boxing Logan Paul on Feb. 20”,0,,1,:news: News
26470,k84lsl,sports,yarbousaj,2020-12-06 23:25:16,espn.com,https://www.espn.com/boxing/story/_/id/30465352/floyd-mayweather-jr-sets-exhibition-bout-youtuber-logan-paul,Floyd Mayweather Jr. sets exhibition bout against YouTuber Logan Paul,50,,1,:news: News
26524,k8oft9,sports,findsportclub,2020-12-07 20:13:17,giannisdag.medium.com,https://giannisdag.medium.com/comparing-sport-management-apps-520a39da013f,A comparison between software management apps,0,,1,:news: News
26582,k96p7h,sports,PrincessBananas85,2020-12-08 15:55:14,espn.com,https://www.espn.com/soccer/villa-san-carlos/story/4256557/mara-gomez-becomes-first-transgender-woman-to-play-football-in-argentina,Mara Gomez becomes first transgender woman to play football in Argentina.,6,,1,:news: News
26601,k9ab4d,sports,ritrends1,2020-12-08 18:53:35,ritrends.com,https://www.ritrends.com/2020/12/floyd-mayweather-fight-logan-paul-in.html,Floyd Mayweather fight Logan Paul in an exhibition showdown by February next year,0,,1,:news: News
26701,ka8x2t,sports,Stranger1982,2020-12-10 04:56:17,bbc.com,https://www.bbc.com/news/world-europe-55255240,"Paolo Rossi, Italy's 1982 World Cup hero, dies aged 64",2,,1,:news: News
26705,kab7lz,sports,aypundeh,2020-12-10 07:43:38,bbc.co.uk,https://www.bbc.co.uk/sport/football/55248469,[BBC] Paolo Rossi: Italy's 1982 World Cup hero dies aged 64,0,,1,:news: News
26743,kal8sz,sports,PrincessBananas85,2020-12-10 18:45:01,espn.com,https://www.espn.com/olympics/story/_/id/30489589/usopc-punish-athletes-protesting-olympics,USOPC won't punish athletes for protesting at Olympics.,17,,1,:news: News
26744,kam5m6,sports,cardart,2020-12-10 19:28:33,staradvertiser.com,https://www.staradvertiser.com/2020/12/09/breaking-news/victim-of-shark-attack-in-mauis-honolua-bay-dies-from-his-injuries/,Victim of shark attack in Maui’s Honolua Bay dies from his injuries,1,,1,:news: News
26749,kaotee,sports,PrincessBananas85,2020-12-10 21:35:24,espn.com,https://www.espn.com/olympics/figureskating/story/_/id/30491468/european-figure-skating-championships-canceled-first-world-war-ii,European figure skating championships canceled for first time since World War II.,2,,1,:news: News
26837,kbaoit,sports,a100amin,2020-12-11 20:31:04,/r/sports/comments/kbaoit/speedball_masters_championship_2017/,https://v.redd.it/m6qp59v2bm461,Speedball Masters Championship 2017,0,,1,:news: News
26854,kbg0e1,sports,AlamutJones,2020-12-12 01:32:58,theage.com.au,https://www.theage.com.au/sport/there-was-no-authority-on-how-to-handle-this-how-sport-negotiated-its-way-through-covid-20201208-p56lqk.html,'There was no authority on how to handle this': How sport negotiated its way through COVID,0,,1,:news: News
26931,kc361s,sports,norwich20,2020-12-13 03:19:17,dhninjas.digital,https://dhninjas.digital/en-vivo-ufc-brandon-moreno-vs-figueiredo-mexicanos-ufc/,EN VIVO UFC: Brandon Moreno vs Figueiredo Mexicanos UFC,0,,1,:news: News
27030,kcxang,sports,cardart,2020-12-14 13:07:21,abc.net.au,https://www.abc.net.au/news/2020-12-14/former-liverpool-manager-gerard-houllier-dies-aged-73/12983346,Former Liverpool manager Gerard Houllier dies aged 73,1,,1,:news: News
27087,kdexve,sports,Flat-Poetry6421,2020-12-15 04:41:55,kezi.com,https://www.kezi.com/content/news/Gym-closures-are-a-matter-of-prevention-health-officials-say-573298711.html,"Gym closures a proactive way to limit spread, health officials say",0,,1,:news: News
27108,kdlrrq,sports,ritrends1,2020-12-15 13:31:46,ritrends.com,https://www.ritrends.com/2020/12/nbas-demar-derozan-7-year-old-daughter.html,"NBA'S DeMar Derozan 7-year-old daughter saved the day, credited with foiling home intruder's plans",0,,1,:news: News
27121,kdrini,sports,PrincessBananas85,2020-12-15 18:39:25,espn.com,https://www.espn.com/nba/story/_/id/30526147/giannis-antetokounmpo-milwaukee-bucks-reach-five-year-228m-supermax-extension,"Giannis Antetokounmpo, Milwaukee Bucks reach five-year, $228M supermax extension.",816,,1,:news: News
27134,kdvaxg,sports,dkguy75,2020-12-15 21:46:40,jjasportstudio.com,https://www.jjasportstudio.com/index.php/layout/4412-rookie-bowden-blossoms-as-multiple-threat-for-dolphins.html,Rookie Bowden blossoms as multiple threat for Dolphins,0,,1,:news: News
27161,ke8ln7,sports,mehdi477aa,2020-12-16 12:49:43,youtube.com,https://www.youtube.com/watch?v=xBz_YMWuaeg&amp;feature=share,UNLIMITED STBEMU CODES | TOP 3 STB EMULATOR CODES |STB EMU PRO CODE | ST...,0,,1,:news: News
27198,kem8yb,sports,[deleted],2020-12-17 00:43:16,freep.com,https://www.freep.com/story/news/local/michigan/2020/12/16/michigan-senate-passes-bills-allow-college-athletes-get-paid/3928648001/,Michigan Senate passes bills to allow college athletes to earn money through endorsements,0,[deleted],1,:news: News
27225,keyt3u,sports,TylerFortierPhoto,2020-12-17 14:51:58,usatoday.com,https://www.usatoday.com/story/sports/college/2020/12/17/ncaa-overhaul-come-democrats-college-athletes-bill-rights/3935483001/,Democratic senators introduce 'College Athletes Bill of Rights' that could reshape NCAA,1090,,2,:news: News
27226,keywdu,sports,PrincessBananas85,2020-12-17 14:57:10,espn.com,https://www.espn.com/olympics/story/_/id/30538012/russia-banned-using-name-flag-next-2-olympics,"Russia banned from using its name, flag at next two Olympics.",161,,3,:news: News
27296,kfk0ov,sports,Anagnorisisa,2020-12-18 12:13:33,legalgamblingandthelaw.com,https://www.legalgamblingandthelaw.com/news/russia-banned-from-using-name-anthem-and-flag-at-world-sport-events/,"Russia Banned From Using Name, Anthem &amp;amp; Flag At World Sport Events",0,,1,:news: News
27331,kfwddu,sports,lishawhidbee,2020-12-18 23:28:37,cnn.com,https://www.cnn.com/2020/12/10/opinions/2020-in-sports-coronavirus-black-lives-matter-bass/index.html,The surreal world of sports in 2020,0,,1,:news: News
27355,kg5zeo,sports,[deleted],2020-12-19 11:09:20,rolexsydneyhobart.com,https://www.rolexsydneyhobart.com/news/2020/pre-race/2020-rolex-sydney-hobart-yacht-race-cancelled-amid-covid-19-concerns/,2020 Rolex Sydney Hobart Yacht Race cancelled amid COVID-19 concerns,1,[deleted],2,:news: News
27372,kgbve0,sports,LymphaticFilariasis,2020-12-19 17:22:01,sports.yahoo.com,https://sports.yahoo.com/nba-nfl-news-magic-johnson-richard-seymour-sc-councilwoman-stalks-taxpayer-money-175101323.html,A South Carolina councilwoman has been indicted on public corruption charges after allegedly using taxpayer money to “stalk” NBA Hall of Famer Magic Johnson in New Jersey,2,,4,:news: News
27375,kgcq06,sports,GopherChomper64,2020-12-19 18:02:48,fadeawayworld.net,https://fadeawayworld.net/2020/07/22/the-goats-of-each-team-sport-who-is-the-greatest-goat/,The GOATs Of Each Team Sport: Who Is The Greatest GOAT?,4,,1,:news: News
27445,kgvzcu,sports,HeMaFayed,2020-12-20 15:35:37,i.redd.it,https://i.redd.it/0xhatmcw2d661.jpg,https://klam4uu.blogspot.com,0,,1,:news: News
27531,khj7mb,sports,ritrends1,2020-12-21 15:11:34,ritrends.com,https://www.ritrends.com/2020/12/robert-lewandoskiin-has-emerged-as-fifa.html,Robert Lewandoskiin has emerged as FIFA Best Footballer of the year!!!,0,,1,:news: News
27543,khngzq,sports,PrincessBananas85,2020-12-21 18:50:39,espn.com,https://www.espn.com/olympics/skiing/story/_/id/30573285/two-olympic-champion-skier-petter-northug-jailed-traffic-drug-offenses,"Two-time Olympic champion skier Petter Northug to be jailed for traffic, drug offenses.",2,,1,:news: News
27665,kiosil,sports,Angel_Slayer014,2020-12-23 07:39:49,discord.gg,https://discord.gg/dsdzvsQBxg,Join the Army of Royal Forces of Foreign Legions Discord Server! Not related. Spam advertising. Join. We need new ACTIVE members. Working on name.,0,,1,:news: News
27823,kkjm0o,sports,scottvanc99,2020-12-26 14:45:30,svanc86.wixsite.com,https://svanc86.wixsite.com/boystory/post/the-daily-huddle-12-25,Check out my new blog! Each day I write The Daily Huddle to recap some of the headlines in the world of sports!,0,,1,:news: News
28015,kmgd0b,sports,GQveracity,2020-12-29 15:23:28,nbcnews.com,https://www.nbcnews.com/news/nbcblk/ante-what-players-nba-are-doing-racial-justice-n1252471,"'Up the ante': What players, NBA are doing for racial justice",0,,1,:news: News
28027,kmjbsz,sports,Weezy-NJPW_Fan,2020-12-29 18:01:17,profootballtalk.nbcsports.com,https://profootballtalk.nbcsports.com/2020/12/29/ben-roethlisberger-wont-play-sunday-mason-rudolph-starts/,"Ben Roethlisberger won’t play Sunday, Mason Rudolph starts vs the Cleveland Browns",11,,1,:news: News
28086,kmzzkn,sports,GOKU1927183,2020-12-30 10:37:15,youtube.com,https://www.youtube.com/watch?v=9rhAad7kYk4,"""ENRIQUE PONCE""EN LA RUINA",1,,1,:news: News
28104,kn36lj,sports,DingleBerries2020,2020-12-30 14:27:53,fox2detroit.com,https://www.fox2detroit.com/news/ohio-state-study-30-of-student-athletes-have-heart-damage-linked-to-covid-19,Ohio State study: 30% of student athletes have heart damage linked to COVID-19,82,,1,:news: News
28108,kn4121,sports,shorterlorter,2020-12-30 15:17:41,youtube.com,https://www.youtube.com/watch?v=ljDgoiVY9_U,chess is sport,0,,1,:news: News
28119,kn5a2s,sports,Big_Sin,2020-12-30 16:25:31,newswep.com,https://newswep.com/sports-fixtures-across-the-country-will-be-behind-closed-doors-again-in-new-covid-19-restrictions-36498/,Sports fixtures across the country will be behind closed doors again in new Covid-19 restrictions,1,,1,:news: News
28327,kogdy4,sports,bitarafhaber,2021-01-01 18:39:47,bitarafhaber.net,https://bitarafhaber.net/tff-baskani-ozdemir-mart-ayinda-taraftari-stada-almak-istiyoruz/,TFF President Özdemir: We want to take the fans to the stadium in March,0,,1,:news: News
28402,kowcpk,sports,Ziv1107,2021-01-02 11:56:57,i.redd.it,https://i.redd.it/97w220ewqw861.jpg,"I have to say that this M5 SmartWatch is lovely,I really liked them and I found it easy to track daily steps and many more cool features! It doesnt costs that much as apposed to other expensive watches that give you the same features! Happy new year guys!",0,,1,:news: News
28574,kq95lx,sports,Betolino01,2021-01-04 13:53:20,i.redd.it,https://i.redd.it/pskhy492mb961.jpg,"Betolino - new site for prediction of sport results, virtual games, etc.",0,,1,:news: News
28617,kqv6h2,sports,ritrends1,2021-01-05 09:42:01,ritrends.com,https://www.ritrends.com/2021/01/trouble-at-bridge.html,Trouble at the bridge,0,,1,:news: News
28630,kqz2dq,sports,racheledelstein44,2021-01-05 14:06:26,athleticallylost.wordpress.com,https://athleticallylost.wordpress.com/2020/12/18/176/,Mental health awareness blog written by athletes for athletes,0,,1,:news: News
28636,kr18i0,sports,mehdi477aa,2021-01-05 16:03:37,youtube.com,https://youtube.com/watch?v=NxyR-gqQtAk&amp;feature=share,Code Xtream IPTV 2021 unlimited صالح لمدة غير محدودة 😍,0,,1,:news: News
28663,krbcur,sports,PoignantBullshit,2021-01-06 00:00:23,nbcnews.com,https://www.nbcnews.com/feature/nbc-out/trans-women-retain-athletic-edge-after-year-hormone-therapy-study-n1252764,"Trans women retain athletic edge after a year of hormone therapy, study finds",31,,1,:news: News
28720,krora2,sports,MehMMAandStuff,2021-01-06 14:21:02,youtu.be,https://youtu.be/HX5QSJlQ0bc,PROOF Khabib Is From The FUTURE,0,,1,:news: News
28733,krvr7h,sports,Lurkwurst,2021-01-06 19:54:38,sports.yahoo.com,https://sports.yahoo.com/nba-lebron-james-wants-to-buy-atlanta-dream-kelly-loeffler-loss-activism-163255609.html,Now this is the kind of thing we're talking about.,0,,1,:news: News
28737,krxl2p,sports,sezen28,2021-01-06 21:25:43,bitarafhaber.net,https://bitarafhaber.net/dakar-rallisinde-dorduncu-etap-heyecani/,4th stage excitement in Dakar Rally,2,,1,:news: News
28890,ktgffv,sports,plaxs-sweatpants,2021-01-09 01:03:29,prosportsoutlook.com,https://prosportsoutlook.com/today-in-sports-january-08-2021/,"[Pro Sports Outlook] Today in Sports: January 8, 2021",0,,1,:news: News
28946,ku5gjn,sports,SportsPicksDaily,2021-01-10 02:32:22,discord.gg,https://discord.gg/WnrJYrN2,Starting Discord With My Free Picks To Share Profit An discuss Picks Plz join,1,,1,:news: News
29058,kvgiki,sports,PrincessBananas85,2021-01-12 00:49:56,nypost.com,https://nypost.com/2021/01/11/nascar-driver-hailie-deegan-in-hot-water-after-using-slur/,NASCAR driver Hailie Deegan in hot water after using slur.,0,,1,:news: News
29104,kvukic,sports,ritrends1,2021-01-12 16:10:47,ritrends.com,https://www.ritrends.com/2021/01/ufc-fighter-irwin-rivera-has-been.html,"UFC fighter, Irwin Rivera has being arrested over the murder of his sisters",0,,1,:news: News
29106,kvupkk,sports,ritrends1,2021-01-12 16:17:57,ritrends.com,https://www.ritrends.com/2021/01/ozil-leaving-arsenal-is-best-solution.html,"'Ozil leaving Arsenal is the best solution', Says Arteta",0,,1,:news: News
29136,kw5jw1,sports,PrincessBananas85,2021-01-13 01:13:27,espn.com,https://www.espn.com/olympics/story/_/id/30701612/video-allegedly-shows-former-us-olympic-gold-medalist-klete-keller-us-capitol-riot,Video allegedly shows former U.S. Olympic gold medalist Klete Keller in U.S. Capitol riot.,4,,1,:news: News
29150,kwbu0j,sports,sherlockholmesz,2021-01-13 07:44:19,newswingz.com,https://newswingz.com/bill-belichick-declines-presidential-medal-of-freedom-offer-from-trump/,Bill Belichick declines Presidential Medal of Freedom offer from Trump,0,,1,:news: News
29181,kwoin7,sports,sherlockholmesz,2021-01-13 20:00:32,newswingz.com,https://newswingz.com/2021-masters-to-allow-return-of-limited-number-of-fans/,2021 Masters to allow return of limited number of fans,0,,1,:news: News
29189,kwrcfv,sports,PrincessBananas85,2021-01-13 22:13:49,espn.com,https://www.espn.com/olympics/story/_/id/30706092/ex-olympic-swimmer-klete-keller-faces-3-federal-charges-participation-us-capitol-riots,Ex-Olympic swimmer Klete Keller faces 3 federal charges for participation in U.S. Capitol riots.,129,,5,:news: News
29190,kwrxjn,sports,Ro_The_Great,2021-01-13 22:42:32,apnews.com,https://apnews.com/article/2a2431b25720b8815727d4e2fe4e9062,The Latest: Olympic swimmer charged in attack on Capitol,0,,1,:news: News
29210,kx1aa3,sports,sherlockholmesz,2021-01-14 07:56:04,newswingz.com,https://newswingz.com/olympic-gold-medalist-klete-keller-charged-for-alleged-role-in-capitol-riots/,Olympic gold medalist Klete Keller charged for alleged role in Capitol riots,0,,1,:news: News
29222,kx58xy,sports,last_king11,2021-01-14 13:04:39,beagilefree.blogspot.com,https://beagilefree.blogspot.com/2021/01/real-story-to-lose-weight.html,Real story to lose weight,0,,1,:news: News
29246,kxdy50,sports,PrincessBananas85,2021-01-14 20:25:01,theguardian.com,https://www.theguardian.com/sport/2021/jan/14/brianna-mcneal-olympic-100m-hurdles-champion-could-face-eight-year-ban,"Brianna McNeal, Olympic 100m hurdles champion, could face eight-year ban.",2,,2,:news: News
29254,kxfwrf,sports,rathinpranav,2021-01-14 22:02:14,forms.gle,https://forms.gle/JdYygSwq8NM2jDeU6,"Hi guys, I would really appreciate if you could take this poll for my AP Government class regarding the legalization of marijuana",0,,1,:news: News
29262,kxijtw,sports,PrincessBananas85,2021-01-15 00:15:22,espn.com,https://www.espn.com/olympics/story/_/id/30713520/ex-us-olympic-gold-medalist-klete-keller-released-federal-custody,Ex-U.S. Olympic gold medalist Klete Keller released from federal custody.,13,,1,:news: News
29286,kxq6k2,sports,Carameldiet,2021-01-15 08:11:33,storyoffitness.info,http://storyoffitness.info/2021/01/15/why-are-british-and-european-athletes-are-coming-to-the-uae-to-train-for-the-olympics/,Why are British and European athletes are coming to the UAE to train for the Olympics?,0,,1,:news: News
29303,kxut82,sports,r4816,2021-01-15 13:45:51,yahoo.com,https://www.yahoo.com/sports/mlb-giants-diamondbacks-owners-donated-to-controversial-rep-lauren-boebert-160807561.html,"Giants, Diamondbacks owners donated to pro-QAnon Rep. Lauren Boebert",7,,1,:news: News
29307,kxw0tv,sports,kirsty4horsesj5,2021-01-15 14:52:08,youtube.com,https://www.youtube.com/watch?v=JCgcdqzEQa8&amp;ab_channel=Lympo,Digital Sports Revolution - Lympo (Cryptocurrency),1,,1,:news: News
29324,ky3yb6,sports,blonddy,2021-01-15 21:10:11,sports.yahoo.com,https://sports.yahoo.com/nfl-broncos-lb-von-miller-under-criminal-investigation-in-colorado-police-195643135.html,Broncos' Von Miller under criminal investigation in Colorado,5,,1,:news: News
29348,kyi146,sports,Lmao-Ze-Dong,2021-01-16 12:22:03,alanarnette.com,https://www.alanarnette.com/blog/2021/01/16/winter-k2-update-first-winter-k2-summit/?fbclid=IwAR0NZFi9go73Z2nHWw8gGHJrC9xU5JbfidcSoV_7iYyIIzE7lfAmqItjfb8,Nirmal Purja has just submitted K2 IN WINTER!,397,,1,:news: News
29363,kypd3x,sports,Lesterassler001,2021-01-16 19:21:19,ir3.xyz,https://ir3.xyz/6003306ab1a4a,Get Your Choice able Sports Element from home,0,,1,:news: News
29392,kyymqh,sports,PrincessBananas85,2021-01-17 03:45:21,espn.com,https://www.espn.com/olympics/story/_/id/30726166/former-ioc-exec-kevan-gosper-suggests-united-nations-rule-fate-tokyo-games,Former IOC exec Kevan Gosper suggests United Nations could rule on fate of Tokyo Games.,1,,1,:news: News
29404,kz281w,sports,TreadLicker,2021-01-17 07:46:25,i.redd.it,https://i.redd.it/mw5tpawskub61.gif,I owe sports fans $10 for nothing in return for losing a bet. I think sports are stupid. The guy I lost to likes sports and wants me to look like a moron in front of sports fans. Bill me at venmo: @bladerunner2017 or cashapp $1982gamerdude,2,,1,:news: News
