,id,subreddit,author,created_utc,domain,url,title,num_comments,selftext,score,link_flair_text
39366,omybq3,sports,Ravlor,2021-07-18 20:11:42,youtube.com,https://www.youtube.com/watch?v=lR07QILssec&amp;t=17s,How athletes unintentionally become dopers; The new documentary by the ARD doping editorial team questions the global anti-doping system. Researchers at the University Hospital of Cologne show in a groundbreaking experiment: A brief skin contact is enough to cause a positive doping test. [German],1,,1,:news: News
39368,omyqyp,sports,kolkatatoday-2021,2021-07-18 20:33:22,youtu.be,https://youtu.be/VLKJirXcwvM,The pulse of 130 crore Indians is racing! All eyes on you -Anurag Thakur,0,,1,:news: News
39392,on8etf,sports,Simulatour,2021-07-19 06:25:36,asia.nikkei.com,https://asia.nikkei.com/Spotlight/Tokyo-2020-Olympics/Top-sponsor-Toyota-cancels-all-Olympic-TV-ads-in-Japan,Top sponsor Toyota cancels all Olympic TV ads in Japan,0,,1,:news: News
39399,on9e0f,sports,anthonyg21795,2021-07-19 07:45:38,reddit.com,https://www.reddit.com/gallery/on9e0f,🌹🌺🍀🌱,0,,1,:news: News
39407,oncegw,sports,smith_gt3,2021-07-19 11:44:25,streamingdigitally.com,https://www.streamingdigitally.com/news/watch-olympics-live-stream/,How to Watch Olympics Live Stream for Free From Anywhere - Streaming Digitally,0,,1,:news: News
39496,oo8kie,sports,kolkatatoday-2021,2021-07-20 18:58:48,kolkatatoday.com,https://kolkatatoday.com/novak-djokovic-penned-heartfelt-post-acknowledges-the-unknown-artist-for-emotional-picture-after-winning-wimbledon-2021/,Novak Djokovic Penned A Heartfelt Post Acknowledges the Unknown Artist for ‘Emotional’ Picture After Winning Wimbledon 2021,1,,1,:news: News
39517,oogqll,sports,RENGAN167,2021-07-21 02:20:12,oke.io,https://oke.io/ro2YRO,ARTICLE: Everything was covered with a single link that covered multiple niches and products. Make your decision! &lt;GRAB and CLICK HERE&gt;,0,,1,:news: News
39518,oogwhu,sports,PrincessBananas85,2021-07-21 02:30:10,espn.com.au,https://www.espn.com.au/olympics/story/_/id/31851480/aussie-showjumper-jamie-kermond-banned-olympics-drugs-cocaine,Aussie showjumper banned from Olympics for drugs.,17,,1,:news: News
39556,oolmop,sports,kolkatatoday-2021,2021-07-21 08:28:29,youtu.be,https://youtu.be/I-AEOcykTv0,"Tokyo Olympic 2020:Billion Dreams ,One Goal ,Go For Gold",0,,1,:news: News
39560,oolswa,sports,JohnCena__,2021-07-21 08:42:07,apnews.com,https://apnews.com/article/2020-tokyo-olympics-sports-brisbane-australia-olympic-team-germany-olympic-team-cbaf0d0e504b8bb3861f35c2876b7bbb,Brisbane picked to host 2032 Olympics without a rival bid,5,,1,:news: News
39561,oom821,sports,AcesHouseSupport,2021-07-21 09:15:49,i.redd.it,https://i.redd.it/tx9515xd9jc71.jpg,"♦️♠️ Aces House ♣️❤️ Club code# np8ic 💥daily low stake cash games (NLH, ROE, PLO &amp; OFC) with splash pots💦💦, AND random hand bonuses!💥daily SnG’s (all entries directly to prize pool)💥instant payouts 💥weekly freeroll on Saturdays💥referral bonus👀",0,,1,:news: News
39579,ooqcwg,sports,salame_cioccolato_88,2021-07-21 13:54:44,i.redd.it,https://i.redd.it/uozaw2o4nkc71.png,1896 Summer Olympics medal table,0,,1,:news: News
39580,ooqfpn,sports,ernestomv0835,2021-07-21 13:58:54,google.com,https://www.google.com/amp/s/www.cbc.ca/amp/1.6110652,Brisbane officially chosen as host of 2032 Olympics,0,,1,:news: News
39602,oovm6p,sports,autonewstech,2021-07-21 18:14:20,autonews.tech,https://www.autonews.tech/2021/07/with-hybrid-events-active-net-expands.html,"With hybrid events, Active-net expands its reach across Europe.",0,,1,:news: News
39637,op3e66,sports,PrincessBananas85,2021-07-22 01:04:49,espn.com,https://www.espn.com/olympics/story/_/id/31858310/us-government-hold-13m-dues-awaits-reform-wada,U.S. government to hold $1.3M in dues as it awaits reform from WADA.,2,,1,:news: News
39641,op46yw,sports,[deleted],2021-07-22 01:53:49,tellmedoyouread.blogspot.com,https://tellmedoyouread.blogspot.com/2021/07/logan-paul-vs-anderson-silva-boxing.html,"LOGAN PAUL vs ANDERSON SILVA Boxing Match, Full Details and Date and Time Leaked?",0,[deleted],1,:news: News
39642,op47sj,sports,monulikeschocolate,2021-07-22 01:55:16,i.redd.it,https://i.redd.it/ux4ixtni7oc71.jpg,LOGAN PAUL vs ANDERSON SILVA will be massive,3,,1,:news: News
39676,ophrhx,sports,autonewstech,2021-07-22 16:46:07,autonews.tech,https://www.autonews.tech/2021/07/department-of-sports-invites-nomination-for-executive-post-graduate.html,"Under the Scheme Of Human Resource Development In Sports, the Department Of Sports invites nominations for the Executive Post Graduate Diploma In Sports Management (EPGDSM) Program.",0,,1,:news: News
39734,opzldf,sports,AbhiRastogi,2021-07-23 10:27:20,toofaanexpress.com,https://toofaanexpress.com/tokyo-olympics-linked-covid-19-cases-go-past-100-organisers-announce-19-new-cases/,"Tokyo Olympics Linked Covid-19 Cases Go Past 100, Organisers Announce 19 New Cases",0,,1,:news: News
39762,oq4xbn,sports,Weezy-NJPW_Fan,2021-07-23 15:37:05,twitter.com,https://twitter.com/247sports/status/1418593278774161410?s=21,"Texas and Oklahoma are leaving the Big 12, sources tell @ChipBrown247",3,,1,:news: News
39775,oq7kpu,sports,autonewstech,2021-07-23 17:46:02,autonews.tech,https://www.autonews.tech/2021/07/black-women-are-still-fighting-level-playing-field-sports.html,Sports organizations have compelled us to question their regard for Black women.,0,,1,:news: News
39779,oq856v,sports,Forsaken-Clerk-4994,2021-07-23 18:14:31,youtube.com,https://youtube.com/watch?v=5FNdpK1C9fY&amp;feature=share,Harry Kane Transfer To Manchester City Confusion As Tottenham Chairman D...,0,,1,:news: News
39822,oqjwx4,sports,kolkatatoday-2021,2021-07-24 05:36:28,youtu.be,https://youtu.be/Zr9vC4ak81Q,"Tokyo Olympics 2020 :One Goal ,Go For Gold",0,,1,:news: News
39853,oqrg4h,sports,QuibbleKev,2021-07-24 14:47:53,mypanhandle.com,http://www.mypanhandle.com/news/could-college-athletes-profit-from-adult-entertainment/amp/,Could college athletes profit from adult entertainment?,0,,1,:news: News
39901,or7c34,sports,kolkatatoday-2021,2021-07-25 07:41:08,kolkatatoday.com,https://kolkatatoday.com/mothers-blessings-works-for-mirabai-chanus-success-in-tokyo/,Mother’s blessings works for Mirabai Chanu’s success in Tokyo,0,,1,:news: News
39921,orawv1,sports,TheGravityBender,2021-07-25 12:45:38,generationiron.com,https://generationiron.com/otis-perkins-passed-away/,Powerlifter Otis Perkins passes away after car crash,2,,1,:news: News
39954,orh4af,sports,autonewstech,2021-07-25 18:35:18,autonews.tech,https://www.autonews.tech/2021/07/t20i-india-beats-sri-lanka-by-38-runs.html,T20I: India beats Sri Lanka by 38 runs,0,,1,:news: News
39992,orr7w3,sports,Extreme_Truth_,2021-07-26 04:16:19,i.redd.it,https://i.redd.it/atk3foeighd71.jpg,"Illustration picture shows a boxing bout between Belgian Ryad Mehri and Chinese Zhaoxin Zhang, for the World Boxing Association World Cruiserweight Title, Saturday 17 July 2021 in Brussels. (Photo by Yves Herman/Reuters)",0,,1,:news: News
40010,orsyja,sports,[deleted],2021-07-26 06:21:26,rollingstone.com,https://www.rollingstone.com/tv/tv-news/how-to-watch-2021-tokyo-olympics-online-free-1200807/,How to Watch the 2021 Tokyo Olympics: Stream the Games Free Online,0,[deleted],1,:news: News
40021,orvx3j,sports,Jamila_Alzaabii,2021-07-26 10:21:48,/r/sports/comments/orvx3j/the_dubai_sports_council_revealed_the/,https://v.redd.it/4it42neg8jd71,"The Dubai Sports Council revealed the organization of 270 international and local sports events with the support, supervision and cooperation of the Council in the first half of 2021, in addition to hosting 53 training camps for international clubs and teams 👌",0,,1,:news: News
40025,orwda0,sports,kolkatatoday-2021,2021-07-26 10:57:19,kolkatatoday.com,https://kolkatatoday.com/mirabai-chanu-the-dream-lifter/,Mirabai Chanu : The Dream ‘Lifter’,0,,1,:news: News
40140,oscqn9,sports,youhaveaids444,2021-07-27 01:11:41,i.redd.it,https://i.redd.it/c5ls20jhond71.jpg,Triathlete Flora Duffy has won Bermuda’s first ever gold medal at the Olympic Games.,0,,1,:news: News
40234,ossoff,sports,kolkatatoday-2021,2021-07-27 18:44:52,kolkatatoday.com,https://kolkatatoday.com/manipur-showers-love-and-blessings-to-mirabai-chanu/,Manipur Showers Love And Blessings To Mirabai Chanu,0,,1,:news: News
40275,ot3au8,sports,moconaid,2021-07-28 05:07:09,min.news,https://min.news/en/sport/ff416317e641d91a1cc47c30e65b197f.html,"The Tokyo Olympics was frantically complained by various countries: the Chinese team bought washing machines, and the athletes had no choice but to shop on the floor",1,,1,:news: News
40315,ot9hj2,sports,Responsiblesignals,2021-07-28 13:04:22,i.redd.it,https://i.redd.it/z8hkfvnecyd71.jpg,educations.,1,,1,:news: News
40316,ot9hp8,sports,kyle787211,2021-07-28 13:04:38,au.sports.yahoo.com,https://au.sports.yahoo.com/olympics-2021-piers-morgan-disgusting-simone-biles-comment-232012066.html,Piers Morgan savaged over 'shameful' Simone Biles comments,69,,1,:news: News
40320,ot9uge,sports,kolkatatoday-2021,2021-07-28 13:24:41,youtu.be,https://youtu.be/l698aqgym3Y,Mirabai Chanu Gets Roaring Welcome in Manipur,0,,1,:news: News
40388,otlpyy,sports,Codydw12,2021-07-28 23:28:46,apnews.com,https://apnews.com/article/sports-college-sports-football-texas-college-football-9141232fbd5ad53fab0c1ad6bb712817?utm_source=Twitter&amp;utm_medium=AP_Top25&amp;utm_campaign=SocialFlow,Big 12 accuses ESPN of trying to 'destabilize' conference,17,,1,:news: News
40438,otxivc,sports,beedawat,2021-07-29 13:30:51,i.redd.it,https://i.redd.it/ltf4c74zl5e71.png,"Mary Kom’s Olympic career ends in Tokyo 2020, boxing legend loses tight pre-quarters bout Mary Kom lost to Colombian Ingrit Valencia by a 3:2 split decision in the women’s 51kg (flyweight) round of 16. It was the Indian boxer’s second and final Olympics. (Source in Comment)",1,,1,:news: News
40477,ou4xk1,sports,kolkatatoday-2021,2021-07-29 19:53:42,kolkatatoday.com,https://kolkatatoday.com/tokyo-olympics-2020-sindhu-atanu-and-mens-hockey-team-shines-but-mary-kom-eliminated-on-day-6/,"Tokyo Olympics 2020 :Sindhu ,Atanu and men’s Hockey team shines but Mary Kom eliminated on day 6",0,,1,:news: News
40498,ou9pqy,sports,PrincessBananas85,2021-07-30 00:13:34,espn.com,https://www.espn.com/tennis/story/_/id/31888794/will-smith-star-king-richard-film-venus-serena-williams,Will Smith to star as 'King Richard' in film about Venus and Serena Williams.,0,,1,:news: News
40512,oucsd4,sports,autonewstech,2021-07-30 03:28:40,autonews.tech,https://www.autonews.tech/2021/07/olympics-australias-mckeon-wins-100-meters-of-freestyle-gold.html,Australia’s McKeon wins 100 meters of freestyle gold,0,,1,:news: News
40521,oudq40,sports,kolkatatoday-2021,2021-07-30 04:29:53,kolkatatoday.com,https://kolkatatoday.com/tokyo-olympics-2020-indian-boxer-lovlina-borgohain-wins-her-quarterfinal-bout-4-1-against-taipeis-chen-assures-a-medal/,Tokyo Olympics 2020 :Indian boxer Lovlina Borgohain wins her quarterfinal bout 4-1 against Taipei’s Chen ;assures a medal,0,,1,:news: News
40548,ouhmly,sports,kolkatatoday-2021,2021-07-30 09:53:25,kolkatatoday.com,https://kolkatatoday.com/tokyo-olympics-2020-archer-deepika-kumari-crashes-out-in-quarterfinals/,Tokyo Olympics 2020 :Archer Deepika Kumari crashes out in quarterfinals,0,,1,:news: News
40556,ouhz5c,sports,kolkatatoday-2021,2021-07-30 10:22:56,kolkatatoday.com,https://kolkatatoday.com/tokyo-olympics-2020-p-v-sindhu-enters-semi-finals-after-defeating-japans-akane-yamaguchi/,Tokyo Olympics 2020 :Archer Deepika Kumari crashes out in quarterfinals,0,,1,:news: News
40575,oujo2x,sports,pradnya123,2021-07-30 12:29:52,bignewsnetwork.com,https://www.bignewsnetwork.com/news/270459276/sports-analytics-market-projected-to-reach-52-billion-by-2024-with-a-remarkable-cagr-of-220,"Sports Analytics Market projected to reach $5.2 billion by 2024, with a remarkable CAGR of 22.0%",0,,1,:news: News
40591,oul6hl,sports,CovidInMyAsshole,2021-07-30 14:01:55,mirror.co.uk,https://www.mirror.co.uk/sport/boxing/floyd-mayweather-survived-drive-shooting-24652404,Floyd Mayweather survived drive-by shooting thanks to heroic bodyguard,8,,1,:news: News
40642,ouyy2p,sports,aphst,2021-07-31 02:19:53,twitter.com,https://twitter.com/barrysvrluga/status/1421293592807571457?s=09,"[Svrluga] Katie Ledecky, following her gold in the 800 meter free, committed to swim through the Paris Olympics in 2024.",10,,1,:news: News
40649,ouzek2,sports,kolkatatoday-2021,2021-07-31 02:51:54,kolkatatoday.com,https://kolkatatoday.com/tokyo-olympics-2020-indian-archer-atanu-das-loses-6-4-to-furukawa-after-a-close-battle-of-bows/,Tokyo Olympics 2020 :Indian archer Atanu Das loses 6-4 to Furukawa after a close battle of bows,0,,1,:news: News
40652,ov0jwa,sports,kolkatatoday-2021,2021-07-31 04:13:43,kolkatatoday.com,https://kolkatatoday.com/tokyo-olympics-2020-indian-boxer-amit-panghal-crashed-out-in-round-of-16/,Tokyo Olympics 2020 :Indian boxer Amit Panghal crashed out in round of 16,0,,1,:news: News
40655,ov1j4g,sports,kolkatatoday-2021,2021-07-31 05:30:11,kolkatatoday.com,https://kolkatatoday.com/tokyo-olympics-2020-indians-kamalpreet-kaur-qualifies-for-the-final-of-discus-throw-event/,Tokyo Olympics 2020: India’s Kamalpreet Kaur qualifies for the final of discus throw event,0,,1,:news: News
40662,ov2p24,sports,kolkatatoday-2021,2021-07-31 07:09:59,kolkatatoday.com,https://kolkatatoday.com/tokyo-olympics-2020indian-womens-hockey-team-beat-south-africa-4-3/,Tokyo Olympics 2020:Indian women’s hockey team beat South Africa 4-3,0,,1,:news: News
40687,ov5l65,sports,Blackpanthet,2021-07-31 11:35:08,mmanews.com,https://www.mmanews.com/2021/07/nick-diaz-to-teach-self-defense-in-partnership-with-stripchat/,UFC legend Nick Diaz announces shock partnership with adult site Stripchat and plans to teach self-defense classes to cam girls tonight,10,,1,:news: News
40697,ov6obg,sports,kolkatatoday-2021,2021-07-31 12:56:55,kolkatatoday.com,https://kolkatatoday.com/tokyo-olympics-2020-indias-ace-shuttler-pv-sindhu-loses-her-semi-final-match-to-chinese-taipeis-tai-tzu-ying-18-21-12-21/,"Tokyo Olympics 2020 : India’s ace shuttler PV Sindhu loses her semi-final match to Chinese Taipei’s Tai Tzu-Ying 18-21, 12-21",0,,1,:news: News
40748,ovi7n4,sports,AstuteYetIgnored,2021-08-01 00:22:21,yahoo.com,https://www.yahoo.com/sports/henry-cejudo-simone-biles-withdrawl-210407327.html,Henry Cejudo on Simone Biles’ withdrawal from Olympics: “I think she really needs to check herself”,10,,1,:news: News
40806,ovrpr3,sports,Uilliam56_X,2021-08-01 13:02:02,theguardian.com,https://www.theguardian.com/sport/live/2021/jul/31/tokyo-2020-olympics-athletics-swimming-gymnastics-boxing-golf-and-more-live?page=with:block-610694c38f0811859feba50d#block-610694c38f0811859feba50d,Yulimar Rojas sets first world record of the meet in women's triple jump and wins gold medal at tokyo!,1,,1,:news: News
40823,ovs44r,sports,Interesting_Box_3355,2021-08-01 13:28:04,youtu.be,https://youtu.be/tILJTcsWRhE,Most Popular games in India (2021),0,,1,:news: News
40827,ovshb8,sports,kolkatatoday-2021,2021-08-01 13:51:26,kolkatatoday.com,https://kolkatatoday.com/tokyo-olympics-2020-indias-shuttler-pv-sindhu-beats-he-bing-jiao-to-win-historic-bronze/,Tokyo Olympics 2020 :India’s Shuttler PV Sindhu Beats He Bing Jiao To Win Historic Bronze,0,,1,:news: News
40832,ovsnms,sports,Renxer0002,2021-08-01 14:02:05,reuters.com,https://www.reuters.com/lifestyle/sports/organisers-probe-drinking-incident-tokyo-sizzles-2021-08-01/,"Tokyo sizzles, tempers flare in boxing, Biles withdraws again",0,,1,:news: News
40855,ovwl7z,sports,autonewstech,2021-08-01 17:40:23,autonews.tech,https://www.autonews.tech/2021/08/tokyo-olympics-badminton-star-p-v.html,Tokyo Olympics: Badminton star P V Sindhu scripts history,0,,1,:news: News
40862,ovwv6x,sports,kolkatatoday-2021,2021-08-01 17:55:38,kolkatatoday.com,https://kolkatatoday.com/it-was-very-important-in-getting-a-medal-for-the-country-pv-sindhu/,It was very important in getting a medal for the country :PV Sindhu,0,,1,:news: News
40879,ow0iuj,sports,Eddie-Edwins,2021-08-01 21:14:50,i.redd.it,https://i.redd.it/i07ls5vlbte71.jpg,which #olympic’s sport best represents the tokens? HODL 👀,0,,1,:news: News
40919,ow977s,sports,kolkatatoday-2021,2021-08-02 06:46:15,kolkatatoday.com,https://kolkatatoday.com/indian-womens-hockey-team-beat-australia-to-enter-historic-semi-finals/,Tokyo Olympics 2020:Indian Women’s Hockey team beat Australia to enter historic semi-finals,0,,1,:news: News
40970,owhtra,sports,Away-Topic-6487,2021-08-02 16:15:04,quytech.com,https://www.quytech.com/sports-app-development.php,Sports App Development Company | Fantasy Sports App Development Services,0,,1,:news: News
40973,owi9k0,sports,FEI_1921,2021-08-02 16:35:48,i.redd.it,https://i.redd.it/cs6pop552ze71.jpg,Julia Krajewski becomes the first woman to ever win an Olympic Eventing gold! 🥇 57 years after the first female Eventer was allowed to compete. #Tokyo2020 #Olympics,0,,1,:news: News
40987,owlk3b,sports,WinHistorical3758,2021-08-02 19:13:06,exe.io,https://exe.io/jolG,"Megan Rapinoe: 'It sucks,' says forward as USWNT beaten by Canada in semifinals at Tokyo 2020 3 hours ago",0,,1,:news: News
40990,owmmxy,sports,BethanyClift,2021-08-02 20:04:56,bcfc.com,https://bcfc.com/news/articles/2021/blues-strike-up-first-of-its-kind-partnership/,Championship Football Club have moved into the world of Esports and Blockchain Technology,12,,1,:news: News
40994,own9zp,sports,DracDracAll,2021-08-02 20:36:52,food.ndtv.com,https://food.ndtv.com/news/pv-sindhu-to-eat-ice-cream-with-prime-minister-modi-twitter-reacts-2500526,"PV Sindhu To Eat Ice Cream With Prime Minister Modi, Twitter Reacts",0,,1,:news: News
41035,owvp4l,sports,kolkatatoday-2021,2021-08-03 04:16:18,kolkatatoday.com,https://kolkatatoday.com/tokyo-olympics-2020-belgium-beat-india-5-2-in-the-first-mens-hockey-semifinal/,Tokyo Olympics 2020 :Belgium beat India 5-2 in the first men’s hockey semifinal,0,,1,:news: News
41089,ox85ju,sports,rhormazar,2021-08-03 17:19:14,washingtonpost.com,https://www.washingtonpost.com/technology/2021/08/03/college-athletes-cameo-stars/,"College athletes are finally allowed to profit off their own images. So, of course, they’re turning to Cameo.",8,,1,:news: News
41197,oxxj25,sports,Away-Topic-6487,2021-08-04 17:20:49,quytech.com,https://www.quytech.com/blog/sports-app-development-cost-and-features/,Sports App Development Company | Fantasy Sports App Development Services,0,,1,:news: News
41246,oya38d,sports,kolkatatoday-2021,2021-08-05 04:27:31,kolkatatoday.com,https://kolkatatoday.com/tokyo-olympics-2020-41-years-drought-is-over-indian-hockey-team-clinch-the-bronze-medal/,Tokyo Olympics 2020 :41 Years of Drought Over ;Indian Hockey Team Clinches Bronze Medal,0,,1,:news: News
41279,oyfo9c,sports,KnowEntertainment,2021-08-05 11:35:00,youtube.com,https://youtube.com/watch?v=dCvPAMNbd_A&amp;feature=share,USA defeat Australia to take women’s football bronze,2,,1,:news: News
41293,oyhpv4,sports,steadypixel,2021-08-05 13:37:25,naijafans.com,https://naijafans.com/threads/chelsea-star-michael-ballacks-son-emilio-killed-in-a-biking-crash.1214/,Chelsea Star Michael Ballack's son Emilio killed in a biking crash,0,,1,:news: News
41326,oyoy22,sports,Xorlalidotcom,2021-08-05 18:47:21,xorlali.com,https://xorlali.com/messi-quits-barcelona-after-failed-contract-talks/,Messi Quits Barcelona After Failed Contract Talks,0,,1,:news: News
41340,oyr29m,sports,kolkatatoday-2021,2021-08-05 20:28:27,kolkatatoday.com,https://kolkatatoday.com/we-would-like-to-dedicate-this-medal-to-doctors-and-frontline-health-workers-who-have-saved-so-many-lives-in-india-manpreet-singh/,We would like to dedicate this medal to doctors and frontline health workers who have saved so many lives in India :Manpreet Singh,0,,1,:news: News
41403,oz60au,sports,PrincessBananas85,2021-08-06 12:51:32,espn.com,https://www.espn.com/olympics/story/_/id/31971594/allyson-felix-claims-10th-olympic-medal-shaunae-miller-uibo-defends-400-meter-title,Allyson Felix claims 10th Olympic medal as Shaunae Miller-Uibo defends 400-meter title.,14,,1,:news: News
41452,oze7wy,sports,kolkatatoday-2021,2021-08-06 19:55:30,youtu.be,https://youtu.be/mE2a1NfnNu4,We will always remember the great performance of our Women’s Hockey Team at Tokyo Olympics :PM Modi,0,,1,:news: News
41540,ozt7i4,sports,PrincessBananas85,2021-08-07 13:25:12,espn.com,https://www.espn.com/olympics/story/_/id/31979341/jessica-springsteen-us-equestrian-team-win-silver-medal-sweden,"Jessica Springsteen, U.S. equestrian team win silver medal behind Sweden.",9,,1,:news: News
41542,ozti2j,sports,kolkatatoday-2021,2021-08-07 13:43:44,kolkatatoday.com,https://kolkatatoday.com/it-happened-finally-23-year-neeraj-bring-gold-for-india/,It happened finally- 23 Year Neeraj bring Gold for India,0,,1,:news: News
41556,ozuiar,sports,Elite_VRTX,2021-08-07 14:42:53,twitter.com,https://twitter.com/f24hq/status/1424013607835246593?s=21,"Saudi Minister of Sports, Abdulaziz Bin Turki Al Faisal, gifts Saudi karate finalist, Tareg Hamidi (Silver medal 🥈), 5 million Saudi riyals ($1,333,316) for reaching the finals and bringing home the first Saudi medal in Tokyo 2020, and 4th medal in their history.",19,,1,:news: News
41565,ozvv7x,sports,autonewstech,2021-08-07 15:59:02,autonews.tech,https://www.autonews.tech/2021/08/india-wins-its-first-olympic-gold-medal.html,India wins its first Olympic gold medal in track and field thanks to Neeraj Chopra's triumph in the javelin.,0,,1,:news: News
41618,p073e9,sports,joker_wcy,2021-08-08 03:12:24,hongkongfp.com,https://hongkongfp.com/2021/08/07/china-promise-no-more-mao-zedong-pins-after-olympic-warning/,China promise no more Mao Zedong pins after Olympic warning | Hong Kong Free Press HKFP,17,,1,:news: News
41639,p0bayk,sports,pankajnetleon,2021-08-08 08:57:05,i.redd.it,https://i.redd.it/7mmqv3fgm3g71.jpg,"The closing ceremony of the Tokyo Olympics will begin at 4:30 pm Indian Standard Time on Sunday, August 8th.",2,,1,:news: News
41647,p0cfza,sports,MatterArising,2021-08-08 10:40:02,matterarising.com,https://www.matterarising.com/messi-breakdown-in-tears-as-he-say-goodbye-to-barcelona/,Messi breakdown in tears as he say goodbye to Barcelona ~ Matters Arising,0,,1,:news: News
41655,p0d70s,sports,MatterArising,2021-08-08 11:44:10,matterarising.com,https://www.matterarising.com/full-text-lionel-messis-barcelona-farewell-speech/,Full text Lionel Messi’s Barcelona Farewell Speech ~ Matters Arising,0,,1,:news: News
41660,p0dv0j,sports,siberjam,2021-08-08 12:34:41,fb.watch,https://fb.watch/7fyajhMOnV/,Lionel Messi received a standing ovation as he bid an emotional farewell to Barcelona 🥺,0,,1,:news: News
41677,p0hn6c,sports,Romeo_k1992,2021-08-08 16:20:35,ouo.io,https://ouo.io/B9HukDB,Beautiful flair,1,,1,:news: News
41722,p0t6lu,sports,Alive_Humor555,2021-08-09 03:16:06,tiktok.com,https://www.tiktok.com/@akissfornikkie/video/6994252576166284550?sender_device=pc&amp;sender_web_id=6967264622186563078&amp;is_from_webapp=v1&amp;is_copy_url=0,#bluetooth speaker##Wireless speaker# #DINDIN# Use code “NIKKIE20”for 20% off your purchase# Purchase link : https://dindinmodern.com/products/traveler-outdoor-bluetooth-speaker,0,,1,:news: News
41733,p0uyz7,sports,amathesimple,2021-08-09 05:20:50,youtu.be,https://youtu.be/qnnkq5SwrAg,Chess is also Sports - Can you Solve Chess Puzzle with in 5 Seconds,0,,1,:news: News
41736,p0v3fm,sports,freekzraga,2021-08-09 05:30:07,businessinsider.com,https://www.businessinsider.com/biden-told-us-olympic-athletes-so-damn-proud-of-them-2021-8,Biden Told US Olympic Athletes That He Is 'so Damn Proud' of Them,0,,1,:news: News
41748,p0x627,sports,International_One_83,2021-08-09 08:15:23,i.redd.it,https://i.redd.it/je6xul5tjag71.jpg,Book Now : https://bit.ly/3qFaN4L,0,,1,:news: News
41771,p12ihv,sports,RicePope,2021-08-09 14:26:26,i.redd.it,https://i.redd.it/glyg1gm4ecg71.jpg,"Well, it will be the Polish-Icelandic war",0,,1,:news: News
41808,p1eghu,sports,thewyldfire,2021-08-10 00:43:16,aljazeera.com,https://www.aljazeera.com/news/2021/8/9/investigation-reveals-football-used-to-launder-money-men-who-sell-football,Investigation reveals how football can be used to launder money,0,,1,:news: News
41848,p1ovjt,sports,RaviKumar121,2021-08-10 13:11:17,editorji.com,https://www.editorji.com/story/tokyo-olympics-2020-here-s-why-golden-boy-neeraj-chopra-chopped-off-his-long-hair-1628574812490,Tokyo Olympics 2020: Here's why golden boy Neeraj Chopra chopped off his long hair,0,,1,:news: News
41898,p1yfln,sports,kolkatatoday-2021,2021-08-10 21:12:44,kolkatatoday.com,https://kolkatatoday.com/messi-joins-psg/,Messi Joins PSG,0,,1,:news: News
41941,p2a9ig,sports,Trigmot,2021-08-11 10:21:02,i.redd.it,https://i.redd.it/gtxua93pfpg71.png,Every American Sports Team in one poster. We made this so that you can cross out the teams you hate and circle the teams you love. XD,0,,1,:news: News
41956,p2ebd6,sports,Dcm210,2021-08-11 14:36:18,theathletic.com,https://theathletic.com/,Can anybody explain why you'd subscribe to this over following sports on ESPN? It's about $70/yr,12,,1,:news: News
41957,p2egbt,sports,lurker_bee,2021-08-11 14:43:28,cbsnews.com,https://www.cbsnews.com/news/jessica-maiolo-paintball-team-usa-covid-kid-tiktok/?ftag=CNM-00-10aab7e&amp;linkId=127262663,Team USA Paintball player kicked off team for shaming child COVID patient on TikTok,142,,1,:news: News
42002,p2mbl3,sports,rmvmanagement,2021-08-11 21:15:36,puresportsnetwork.com,https://puresportsnetwork.com/2021/08/11/10-amazing-moments-in-sport/,10 Amazing Sports Moments,2,,1,:news: News
42006,p2npm7,sports,Mapropre,2021-08-11 22:25:33,twitter.com,https://twitter.com/ChiburaProsper/status/1425574838891126788?s=19,Created Lionel Messi a s a PSG player NFT you can view the Art by clicking on the link,0,,1,:news: News
