,id,subreddit,author,created_utc,domain,url,title,num_comments,selftext,score,link_flair_text
50457,rnbgqn,sports,RuseOwl,2021-12-24 02:11:27,calgaryherald.com,https://calgaryherald.com/sports/hockey/nhl/toronto-maple-leafs/rielly-latest-leaf-with-covid-19-post-christmas-games-in-doubt,Morgan Rielly latest Maple Leaf with COVID as post-Christmas games now in doubt,0,,1,:news: News
50464,rnfkv1,sports,Aditeuri,2021-12-24 06:00:01,reddit.com,https://www.reddit.com/gallery/rnfkv1,"BREAKING: Chris Dickerson, first openly gay IFBB Pro bodybuilder and 1982 Mr. Olympia has passed away at 82. He was also an accomplished opera singer and model.",0,,1,:news: News
50472,rnj16e,sports,Smartwatchestrendz,2021-12-24 09:47:37,bestsmartwatches.info,https://www.bestsmartwatches.info/2021/12/review-smartwatch-garmin-instinct-solar.html,"[Review Smartwatch Garmin Instinct Solar, Rugged Outdoor]",0,,1,:news: News
50547,rp3v4v,sports,celebsbioworld,2021-12-26 19:24:19,i.redd.it,https://i.redd.it/p8v6t41ttx781.jpg,"Mahendra Rajput Biography, age, wiki, Height, Family, Wife, Pro Kabaddi League, Achievements, Net Worth &amp; More",0,,1,:news: News
50675,rr7584,sports,rohitgupta010,2021-12-29 12:30:48,scrabbl.com,https://www.scrabbl.com/oldest-tourist-in-space-to-hottest-month-in-history-throwback-2021,Oldest Tourist in Space to Hottest Month in History: Throwback 2021,0,,1,:news: News
50736,rs862j,sports,dizzy_supposition,2021-12-30 18:13:23,vpnsports.com,https://www.vpnsports.com/news/flashback-2021-nba-records-broken-in-the-year-2021/,Flashback 2021: 5 NBA Records broken in the year 2021,0,,1,:news: News
50761,rsrvi8,sports,SquareRich1774,2021-12-31 11:22:23,upshot.email,https://upshot.email/how-well-do-you-remember-the-most-sordid-moments-in-sport-in-2021/?utm_source=reddit&amp;utm_medium=organic&amp;utm_campaign=quiz-of-the-year,How well do you remember 2021's most colourful sporting moments? Take this quiz to find out...,0,,1,:news: News
50765,rsuti2,sports,Goofy_030,2021-12-31 14:16:22,i.redd.it,https://i.redd.it/plprs7a6zv881.png,Robert Lewandowski named best Male Athlete of 2021 by the International Sports Press Association. A panel of 529 journalists from 114 countries voted.,0,,1,:news: News
50772,rsylw9,sports,SAIHARSHITKOTLA_11,2021-12-31 17:17:41,i.redd.it,https://i.redd.it/sr9tsflvvw881.png,"First 8 out of 10 of google top search trends this year are related to sports . with cricket having 5 searches, Association Football 2 searches and Basketball 1 search",0,,1,:news: News
50812,rtobs8,sports,jonfla,2022-01-01 17:47:26,theatlantic.com,https://www.theatlantic.com/ideas/archive/2021/12/nba-nfl-surrendered-vaccine-refusers-kyrie-irving/621142/,The NBA and NFL Surrendered to Their Vaccine Refusers,0,,1,:news: News
50865,ru8975,sports,hzj5790,2022-01-02 12:00:14,bbc.com,https://www.bbc.com/sport/59548186,Big sporting events &amp; full 2022 calendar,0,,1,:news: News
50957,rv7auj,sports,alexisimian,2022-01-03 17:41:44,24happenings.com,https://24happenings.com/sports/49235.html,Joan Barreda makes history with his stage victory - 24 Happenings,0,,1,:news: News
50958,rv7fpt,sports,alexisimian,2022-01-03 17:47:45,24happenings.com,https://24happenings.com/sports/48138.html,"María Sol, Messi's unknown sister who sweeps in a bikini - 24 Happenings",0,,1,:news: News
50964,rv9a6o,sports,taylon170,2022-01-03 19:06:53,/r/sports/comments/rv9a6o/ian_rapoport_speaks_on_why_antonio_brown_stormed/,https://v.redd.it/b47e98t3ui981,Ian Rapoport speaks on why antonio brown stormed off field shirtless ending his career with Tampa bay!,0,,1,:news: News
50972,rvdnj4,sports,IntelligentMachine20,2022-01-03 22:16:48,fiverr.com,https://www.fiverr.com/share/zxXw2E,AFFILIATE LINK PROMOTION,0,,1,:news: News
50980,rvi1he,sports,Embarrassed-Sun814,2022-01-04 01:37:09,reddit.com,https://www.reddit.com/gallery/rvi1he,Massage Guns,0,,1,:news: News
50996,rvn2lx,sports,Online-lover9898,2022-01-04 05:51:26,bestmarketrahul.in,https://www.bestmarketrahul.in/2022/01/10-best-chyawanprash-brands-in-india.html,10 Best Chyawanprash Brands In India,0,,1,:news: News
51028,rvx5hg,sports,247NewsBulletin,2022-01-04 15:36:30,247newsbulletin.com,https://247newsbulletin.com/sports/79523.html,Split testicle: MMA fighter suffers horror injury,0,,1,:news: News
51034,rw0ayf,sports,Spicy_Masala,2022-01-04 17:53:04,amp.awfulannouncing.com,http://amp.awfulannouncing.com/espn/ben-roethlisberger-mnf-allegations-immature-mistakes.html,ESPN Monday Night Football crew criticized for referring to Ben Roethlisberger's sexual assault allegations as 'immature',0,,1,:news: News
51084,rwkpn3,sports,PeasKhichra,2022-01-05 11:23:30,reuters.com,https://www.reuters.com/lifestyle/sports/no-special-treatment-djokovic-exemption-australian-officials-say-2022-01-05/,Djokovic needs to prove medical exemption or go home - Australian PM,0,,1,:news: News
51122,rwzw6f,sports,Ok_Low_796,2022-01-05 23:23:57,news.agorablue.co,https://news.agorablue.co/real-edge-past-giantkillers-alcoyano/,Real edge past giantkillers Alcoyano,0,,1,:news: News
51146,rx87p6,sports,BaddieBunny111,2022-01-06 06:58:21,onlyfans.com,https://onlyfans.com/baddiebunny111,OnlyFans Latina slut,0,,1,:news: News
51161,rxchjl,sports,Ok_Low_796,2022-01-06 11:32:49,news.agorablue.co,https://news.agorablue.co/nadal-says-djokovic-could-be-playing/,Nadal says Djokovic 'could be playing',0,,1,:news: News
51196,rxqoe3,sports,BlankVerse,2022-01-06 22:22:24,latimes.com,https://www.latimes.com/opinion/story/2022-01-06/world-cup-olympics-sportswashing-saudi-arabia-beijing-fifa-ioc-soccer#nt=0000016b-233f-d4d4-a1fb-afffef460001-liL1promoXSmall-7030col2-main,Op-Ed: Could this be the year 'sportwashing' backfires?,0,,1,:news: News
51242,ry86o2,sports,football_pure_fan,2022-01-07 14:08:51,foot-maniac.com,https://foot-maniac.com/urgent-ca-se-precise-pour-zinedine-zidane-au-psg/,🛑Urgent: Ça se precise pour Zinedine Zidane au PSG! ‣ FOOTBALL PURE MANIAC,0,,1,:news: News
51303,ryxqu1,sports,Angelinamark11,2022-01-08 11:21:28,i.redd.it,https://i.redd.it/j4ct2gmo7ga81.jpg,"new account, would love some karma ☺️ absolutely will return the favor",0,,1,:news: News
51307,ryyzgc,sports,Smartwatchestrendz,2022-01-08 12:40:09,techdhms.blogspot.com,https://techdhms.blogspot.com/2022/01/smart-watch-2022call-receivedial-170-in.html,"Smart Watch 2022(Call Receive/Dial), 1.70 in HD Full Touch Screen Smartwatch Fitness Tracker",0,,1,:news: News
51326,rz5mae,sports,namforb,2022-01-08 17:55:47,cronkitenews.azpbs.org,https://cronkitenews.azpbs.org/2017/10/12/flipside-cheerleading-prevalence-catastrophic-injuries/,Cheerleading is the most dangerous youth sport. A 2009 report from the University of North Carolina that concluded cheerleading accounted for 65.2% of all catastrophic injuries in youth sports.,0,,1,:news: News
51416,s02jps,sports,trendingvidsxz,2022-01-09 21:48:55,i.redd.it,https://i.redd.it/4e34hlwhgqa81.png,2 dead and 15 injured as rock collapses on them at Brazil https://jammmmmieoateng.blogspot.com/2022/01/2-dead-and-15-injured-as-rock-fell-on.html?m=1 hit link above to watch more,0,,1,:news: News
51428,s07it3,sports,LarryPeru,2022-01-10 01:36:02,reuters.com,https://www.reuters.com/lifestyle/sports/novak-djokovics-bid-stay-australia-goes-before-courts-2022-01-09/?utm_medium=Social&amp;utm_source=twitter,The judge hearing Novak Djokovic's legal challenge to the Australian government's decision to revoke the star tennis player's entry visa raised several concerns on Monday about how the Serbian was treated by border officials on arrival.,0,,1,:news: News
51443,s0ce4e,sports,usa-news-now,2022-01-10 05:41:00,usa-news-now.com,https://usa-news-now.com/bob-saget-death-full-house-house/,"Bob Saget, the wholehearted 'Full House' star and brilliantly filthy comic, died at the age of 65.",0,,1,:news: News
51445,s0d1ie,sports,usa-news-now,2022-01-10 06:16:09,usa-news-now.com,https://usa-news-now.com/leonardo-dicaprio-and-girlfriend-camila-morrone/,2022 Leonardo DiCaprio and Girlfriend Camila Morrone Show Off Their PDA During Their Island Getaway,0,,1,:news: News
51453,s0dzdp,sports,usa-news-now,2022-01-10 07:11:28,usa-news-now.com,https://usa-news-now.com/79th-golden-globe-awards-winners/,"2022 The Golden Globes award 'West Side Story,' Succession but without stars or a live transmission.",0,,1,:news: News
51468,s0hvog,sports,usa-news-now,2022-01-10 11:24:39,usa-news-now.com,https://usa-news-now.com/kumkum-bhagya-cast/,"Prachi agrees with Daljeet's Plan, Kumkum Bhagya, 10 January 2022, Written Update",0,,1,:news: News
51482,s0mt6d,sports,LarryPeru,2022-01-10 15:38:57,skysports.com,https://www.skysports.com/amp/tennis/news/12110/12512832/novak-djokovic-has-won-an-appeal-against-a-decision-to-refuse-him-a-visa-ahead-of-australian-open,"Rafa Nadal: ""Whether or not I agree with Djokovic on some things, justice has spoken and has said that he has the right to participate in the Australian Open and I think it is the fairest decision to do so, if it has been resolved that way. I wish him the best of luck!”",0,,1,:news: News
51490,s0ns0c,sports,Wide-Watch-746,2022-01-10 16:20:39,studio.youtube.com,https://studio.youtube.com/video/e_rZchE-jQ8/edit,Efeito 3D,0,,1,:news: News
51564,s1gbta,sports,t-educateblog,2022-01-11 16:03:34,t-educate0007.blogspot.com,https://t-educate0007.blogspot.com/2022/01/uk-parliament-forms-crypto-and-digital.html,UK Parliament Forms Crypto and Digital Assets Group to Regulate Space,0,,1,:news: News
51570,s1hufl,sports,OKPineapples,2022-01-11 17:07:30,i.imgur.com,https://i.imgur.com/b9bKXUd.png,"Conor McGregor has topped the 2021 list for athletes’ earnings per minute with an insane $8,695,652 per minute of competition, according to a recent report by Online Betting Report",0,,1,:news: News
51580,s1o5yb,sports,anupvoteforyou,2022-01-11 21:30:02,themainewire.com,https://www.themainewire.com/2022/01/athletes-who-had-covid-will-be-considered-fully-vaccinated-ncaa-says-in-new-guidelines/?s=09,"Athletes who had COVID will be considered ‘fully vaccinated,’ NCAA says in new guidelines",0,,1,:news: News
51629,s262g1,sports,usa-news-now,2022-01-12 13:18:21,usa-news-now.com,https://usa-news-now.com/maya-angelou-us-quarter/,2022 Maya Angelou is the first black woman to appear on a US quarter as the US Mint releases new coins.,0,,1,:news: News
51686,s33g8p,sports,SappyGilmore,2022-01-13 16:33:54,freep.com,https://www.freep.com/story/sports/college/michigan-state/spartans/2022/01/13/michigan-state-spartans-caesars-sportsbook-partnership-igaming/9198104002/,Michigan State athletics signs landmark partnership with Caesars Sportsbook,0,,1,:news: News
51750,s3tsur,sports,reyartee,2022-01-14 14:35:34,g-case-the-ultimate-gaming.kckb.st,https://g-case-the-ultimate-gaming.kckb.st/reyartee,https://g-case-the-ultimate-gaming.kckb.st/reyartee,0,,1,:news: News
51804,s4fi15,sports,[deleted],2022-01-15 08:10:05,t-educate0007.blogspot.com,https://t-educate0007.blogspot.com/2022/01/north-korean-hackers-stole-400-million.html,North Korean Hackers Stole $400 Million in Cryptocurrency Last Year,0,[deleted],1,:news: News
51873,s532si,sports,SnackSize_,2022-01-16 04:08:04,innocenceproject.org,https://innocenceproject.org/tampa-bay-buccaneers-exoneree-inspire-change-donovan-smith/,Tampa Bay Buccaneers Surprise Exoneree Robert DuBoise With Custom Cleats,0,,1,:news: News
51926,s5gfhp,sports,Baron-Munc,2022-01-16 17:15:31,turnednews.com,https://turnednews.com/maude-cyr-an-ultra-marathoner-struggling-with-post-covid-19-syndrome/,"Maude Cyr, an ultra-marathoner struggling with post-COVID-19 syndrome",0,,1,:news: News
51953,s5s3n8,sports,PrincessBananas85,2022-01-17 02:07:03,espn.com,https://www.espn.com/tennis/story/_/id/33082181/novak-djokovic-arrives-dubai-deportation-australia,Novak Djokovic arrives in Dubai after deportation from Australia.,0,,1,:news: News
52017,s6g9r6,sports,ssrrhyfty,2022-01-17 22:02:49,cutt.ly,https://cutt.ly/yImI3eU,Do you want to improve your paddling?,0,,1,:news: News
52077,s73vy5,sports,Makiix3,2022-01-18 18:14:50,convincingnews.com,https://convincingnews.com/2022/01/18/can-returning-pogba-solve-man-utds-midfield-and-mentality-problems/,Can returning Pogba solve Man Utd’s midfield and mentality problems?,0,,1,:news: News
52083,s76xkx,sports,reyartee,2022-01-18 20:25:15,loom-footwear.kckb.st,https://loom-footwear.kckb.st/reyartee,https://loom-footwear.kckb.st/reyartee,1,,1,:news: News
52143,s7zrne,sports,forbes,2022-01-19 20:33:02,forbes.com,https://www.forbes.com/sites/willyakowicz/2022/01/19/new-yorkers-wagered-150-million-during-first-weekend-of-legal-mobile-sports-betting/?utm_source=reddit&amp;utm_medium=social&amp;utm_campaign=forbes,New Yorkers Wagered $150 Million During First Weekend Of Legal Mobile Sports Betting,0,,1,:news: News
52168,s8btx3,sports,CButler19,2022-01-20 06:00:38,sports.mynorthwest.com,http://sports.mynorthwest.com/1558728/ncaa-adopts-new-policy-for-transgender-athletes/,NCAA adopts new policy for transgender athletes,1,,1,:news: News
52187,s8ibib,sports,KeepGoingWithaSmile,2022-01-20 12:53:52,si.com,https://www.si.com/college/2022/01/20/ncaa-updates-transgender-athlete-participation-policy,NCAA Updates Policy on Transgender Athlete Participation,0,,1,:news: News
52204,s8naw4,sports,ckeller9622,2022-01-20 16:50:04,discord.gg,https://discord.gg/t8wvZshNGK,New NFT drop,0,,1,:news: News
52248,s966ik,sports,Manjeera_nath,2022-01-21 08:34:10,twitter.com,https://twitter.com/rizin_pr/status/1484402209614102528?s=21,"Koike Kleber vs Ulka Sasaki announced for RIZIN TRIGGER 2 on February, 23rd.",0,,1,:news: News
52267,s9aoq3,sports,BriefRelationship934,2022-01-21 13:25:30,apnews.com,http://apnews.com/article/winter-olympics-coronavirus-pandemic-sports-entertainment-business-0fe04f7add5ba0dcaf85494e40e2e9fb,ESPN will not send reporters to Beijing Olympics,0,,1,:news: News
52274,s9dj4c,sports,Ok_Low_796,2022-01-21 15:40:00,news.agorablue.co,https://news.agorablue.co/call-of-duty-to-stay-on-playstation-says-microsoft/,"Call of Duty to stay on Playstation, says Microsoft",0,,1,:news: News
52291,s9ii5i,sports,Angel_Mario_,2022-01-21 19:18:29,i.redd.it,https://i.redd.it/2lqz69ukc3d81.jpg,Walmart is Giving Away $100 Gift Card Free.,0,,1,:news: News
52324,sa0403,sports,Ok_Low_796,2022-01-22 10:59:02,news.agorablue.co,https://news.agorablue.co/evans-loses-as-british-interest-ends/,Evans loses as British interest ends,0,,1,:news: News
52325,sa09et,sports,Angel_Mario_,2022-01-22 11:08:29,amazingofferbox.github.io,https://amazingofferbox.github.io/walmart-offer-461/,Walmart is Giving Away $100 Gift Card Free,0,,1,:news: News
52351,sa5j7h,sports,Bharat1450,2022-01-22 16:00:30,theverges.in,https://www.theverges.in/2022/01/vivo21-full-review.html,Vivo21 full review,0,,1,:news: News
52392,sahtqn,sports,cockroachjuice,2022-01-23 01:35:00,sciencedirect.com,https://www.sciencedirect.com/science/article/abs/pii/S1469029222000048,"A systematic review of performance slumps in sports: ""Performance slump causes include: perceived expectations for success and attributing performance decline to something about themselves.""",0,,1,:news: News
52426,satzww,sports,bettor2022,2022-01-23 13:46:27,100bookies.com,http://100bookies.com/top-100-betting-sites-eng/,TOP 100 Sports Betting Sites,0,,1,:news: News
52449,sb34sc,sports,Queasy_Specific_9278,2022-01-23 20:33:50,10news.com,https://www.10news.com/news/in-depth/in-depth-san-diego-company-making-covid-nasal-drops-says-new-formula-potent-against-omicron,"A treatment for Covid is in development its a Nasal Drops takes one minute and done, when we get this approved its sports back to normal.",0,,1,:news: News
52500,sbbpbk,sports,pereraglj,2022-01-24 03:08:49,vocal.media,https://vocal.media/humans/your-low-core-temperature-and-health-conditions-with-slow-metabolism-chemical-processes-that-convert-food-into-energy,Your low core body temperature and health conditions with slow metabolism (chemical processes that convert food into energy) - Energize 2022,0,,1,:news: News
52517,sbfpdx,sports,sportsguy14992191,2022-01-24 06:43:19,instagram.com,https://www.instagram.com/p/CYxC0wHPSFc/?utm_medium=copy_link,Please support and follow this Instagram account @peoplesgm if you are a sports fan! It covers everything! Check out more about it here!,0,,1,:news: News
52530,sbklhw,sports,sugarteebaby,2022-01-24 11:58:18,/r/sports/comments/sbklhw/im_so_down_to_get_my_dick_sucked_whos_up_and_down/,https://v.redd.it/ufmus50skmd81,im so down to get my dick sucked. Who's up and down to pull up?,0,,1,:news: News
52534,sbm714,sports,Ok_Low_796,2022-01-24 13:27:12,news.agorablue.co,https://news.agorablue.co/smeding-selected-for-beijing-2022/,Smeding selected for Beijing 2022,0,,1,:news: News
52548,sbrqen,sports,Ok_Low_796,2022-01-24 17:41:17,news.agorablue.co,https://news.agorablue.co/man-city-keen-on-river-plates-alvarez/,Man City keen on River Plate's Alvarez,0,,1,:news: News
52556,sbtilt,sports,thefreelioness,2022-01-24 18:58:11,i.redd.it,https://i.redd.it/k8xz3c0knod81.jpg,BLACKPINK MAKNAES LISA &amp; ROSE WITHOUT MAKEUP VS WITH MAKEUP,0,,1,:news: News
52562,sbwt7w,sports,sportsguy14992191,2022-01-24 21:20:17,instagram.com,https://www.instagram.com/p/CZFOemGFdPn/?utm_medium=copy_link,Please support and follow this Instagram account @peoplesgm if you are a sports fan! It covers everything! Check out more about it here!,0,,1,:news: News
52581,sc3e9e,sports,PrincessBananas85,2022-01-25 03:02:45,espn.com,https://www.espn.com/tennis/story/_/id/33141856/tennis-australia-reverses-course-ban-peng-shuai-protest-australian-open,Tennis Australia reverses course on ban of Peng Shuai protest at Australian Open.,0,,1,:news: News
52582,sc3yn0,sports,theWitchR,2022-01-25 03:30:33,theguardian.com,https://www.theguardian.com/sport/2022/jan/25/australian-open-reverses-it-ban-on-where-is-peng-shuai-t-shirts,Australian Open reverses its ban on ‘Where is Peng Shuai?’ T-shirts | Australian Open 2022 | The Guardian,0,,1,:news: News
52679,sdckqd,sports,thebelsnickle1991,2022-01-26 18:21:00,skysports.com,https://www.skysports.com/amp/boxing/news/12183/12525951/tyson-fury-vs-dillian-whyte-negotiation-deadline-extended-by-a-further-48-hours,Tyson Fury vs Dillian Whyte negotiation deadline extended by a further 48 hours,0,,1,:news: News
52682,sddcgd,sports,hydra_XI,2022-01-26 18:54:25,i.redd.it,https://i.redd.it/lomywgbww2e81.jpg,Interesting!,0,,1,:news: News
52692,sdh42l,sports,Ok_Low_796,2022-01-26 21:35:36,news.agorablue.co,https://news.agorablue.co/tt-bike-dangerous-to-train-on-pidcock/,TT bike 'dangerous' to train on - Pidcock,0,,1,:news: News
52736,se5lh9,sports,Barbaratomas,2022-01-27 18:51:45,telegraph.co.uk,https://www.telegraph.co.uk/athletics/2022/01/27/marcell-jacobs-exclusive-interview-didnt-dope-win-olympic-100m/,"Marcell Jacobs exclusive: 'My Olympic 100m win was down to blood, sweat and tears - not doping'",0,,1,:news: News
52915,sg45bq,sports,malikzaheer002012,2022-01-30 07:53:47,otgnewz.com,https://www.otgnewz.com/2022/01/elon-musk-offered-young-man-5000-dollar.html,"Elon Musk offered the young man 5,000 dollar to close his Twitter account",0,,1,:news: News
52929,sg8cpn,sports,Lost-Original-3176,2022-01-30 12:38:34,sambaloch7898.blogspot.com,https://sambaloch7898.blogspot.com/2022/01/us-east-coast-blanketed-by-bombogenesis.html,US East Coast blanketed by bombogenesis',0,,1,:news: News
52979,sgj706,sports,Fitnessduties,2022-01-30 21:16:15,fitnessduties.com,https://www.fitnessduties.com/2022/01/12-foods-that-boost-muscle-mass-gain.html?m=1,12 FOODS THAT BOOST MUSCLE MASS GAIN,0,,1,:news: News
53015,sgoekl,sports,Any-Low5519,2022-01-31 01:17:56,i.redd.it,https://i.redd.it/ruxz7yzycxe81.jpg,The Philippine National Football Women’s Team won it’s quarter finals game with Chinese Taipei 1 (4) - 1 (3). This will be the first time the country will compete in the FIFA Women’s World Cup.,0,,1,:news: News
53087,shdifs,sports,Professional-Lie-808,2022-01-31 21:59:11,i.redd.it,https://i.redd.it/3fkl3shfi3f81.jpg,"This weekend is JMSM annual sports conference. It features over 20 distinguished sports business executives from a wide collection of sports leagues and industry positions. For someone who’s passion is sports, this is an opportunity hard to pass on. Visit: www.jmsm.ca",0,,1,:news: News
53150,shyiof,sports,hydra_XI,2022-02-01 16:07:53,i.redd.it,https://i.redd.it/xsz3jksmw8f81.jpg,An interesting detroit indeed!,0,,1,:news: News
53163,si2gm8,sports,otgnewz6,2022-02-01 18:54:31,otgnewz.com,https://www.otgnewz.com/2022/02/boxers-tyson-free-and-dylan-white.html,Boxers Tyson Free and Dylan White compete for the Worl,0,,1,:news: News
53171,si5z7f,sports,PrincessBananas85,2022-02-01 21:21:03,espn.com,https://www.espn.com/racing/nascar/story/_/id/33194734/former-boxing-champion-floyd-mayweather-jr-here-win-set-debut-nascar-team-daytona,"Former boxing champion Floyd Mayweather Jr. 'here to win,' set to debut NASCAR team at Daytona.",0,,1,:news: News
53271,sjkw2f,sports,atiq32122,2022-02-03 14:41:40,21sportsnews.com,https://21sportsnews.com/2022/02/03/whats-next-for-michigan-now-that-jim-harbaugh-is-staying-plus-texas-am-has-historic-national-signing-day/,"What’s next for Michigan now that Jim Harbaugh is staying? Plus, Texas A&amp;M has historic National Signing Day",0,,1,:news: News
53278,sjn90q,sports,Adamsonyii,2022-02-03 16:20:36,mixi.mn,https://mixi.mn/?a=201752&amp;c=10530&amp;p=r,Check out this belly fat / weight loss supplement for women,0,,1,:news: News
53286,sjrela,sports,theWitchR,2022-02-03 19:07:54,theguardian.com,https://www.theguardian.com/sport/2022/feb/03/the-climate-crisis-is-wreaking-havoc-but-sport-can-be-a-part-of-the-solution?s=04,The climate crisis is wreaking havoc but sport can be a part of the solution,0,,1,:news: News
53327,skexhk,sports,NormandyLS,2022-02-04 14:44:17,i.redd.it,https://i.redd.it/d4v7jbdhwtf81.jpg,Putin caught napping at the Ukraine national team entering the Olympic opening ceremony,0,,1,:news: News
53331,skfcxb,sports,iamjoiealex,2022-02-04 15:02:26,24happenings.com,https://24happenings.com/sports/74208.html,Spectacular scenes at the Opening Ceremony of the 24th Winter Olympics (photos + videos),0,,1,:news: News
53332,skfdkd,sports,iamjoiealex,2022-02-04 15:03:08,24happenings.com,https://24happenings.com/sports/74191.html,"This is how Spain paraded at the opening ceremony of the Beijing Games, with Mirambell's gesture for the day against cancer (video)",0,,1,:news: News
53349,skn3gv,sports,EL_ABU3L0_22,2022-02-04 20:14:27,i.redd.it,https://i.redd.it/3i9n9gq6jvf81.png,"We talk about sports here, right?",0,,1,:news: News
53353,skpe7d,sports,henrydangerfan2022,2022-02-04 21:50:34,discord.gg,https://discord.gg/wgj4TBPMpR,join my server to talk about sports events in February,0,,1,:news: News
53389,sl9xkx,sports,Bharat1450,2022-02-05 15:47:15,theverges.in,https://www.theverges.in/2022/02/PocoPoco%20M4%20Pro%20smarty.html,Poco M4 Pro 5GDimensity 810 chipset spes leaked,0,,1,:news: News
53412,slj8wq,sports,Wild-Dig-8003,2022-02-05 22:58:28,sports.yahoo.com,https://sports.yahoo.com/16-penn-swimmers-say-transgender-teammate-lia-thomas-should-be-barred-from-competing-043818436.html,16 Penn swimmers say transgender teammate Lia Thomas shouldn't be allowed to compete,0,,1,:news: News
53442,slw2bc,sports,Potential_Papaya152,2022-02-06 12:57:43,youtu.be,https://youtu.be/1ur7zBpydbw,"Regardez ""Le snper vs le 6xti-_- freestyle rap français"" sur YouTube",0,,1,:news: News
53454,slzifa,sports,RebeccaNobody,2022-02-06 15:37:13,dailykos.com,https://www.dailykos.com/stories/2022/2/3/2078423/-Republicans-say-the-quiet-part-out-loud-in-anti-trans-bill-that-allows-trans-boys-to-join-boys-team,"Arizona says trans girls cannot compete in girls' sports, but trans boys CAN compete in boys' sports.",0,,1,:news: News
53465,sm2vbz,sports,renzo_reddit,2022-02-06 17:55:06,xgstudios.io,http://xgstudios.io/,Crypto Project for the Sports Community!,0,,1,:news: News
53543,smrah6,sports,salma_elmazen,2022-02-07 14:17:29,i.redd.it,https://i.redd.it/6dgl130c6fg81.jpg,Distinguished public interaction and a wonderful atmosphere witnessed by the Emirati Al-Jazira match and the Saudi Al-Hilal at Mohammed bin Zayed Stadium!,0,,1,:news: News
53598,snbup3,sports,jhonWilliam123,2022-02-08 05:10:25,24happenings.com,https://24happenings.com/sports/73610.html,"Eileen Gu, the American who chose to compete with China and is all the rage at the Winter Games",0,,1,:news: News
53612,snevhp,sports,Adamsonyii,2022-02-08 08:01:36,fasterfiles.net,https://fasterfiles.net/show.php?l=0&amp;u=525178&amp;id=39555&amp;tracking_id=,Hi everyone! Check out this offer from a generous company in USA to USA residents only.,0,,1,:news: News
53613,snfj55,sports,Adamsonyii,2022-02-08 08:44:21,paidfaucet.com,https://paidfaucet.com?r=Adamsonyii,Hi everyone! Get free Bitcoin every 5 minutes from this 100% legit site. This offer is unlimited,0,,1,:news: News
53622,snhwfl,sports,Adamsonyii,2022-02-08 11:22:11,paid-to-read-email.com,https://www.paid-to-read-email.com/?r=1631359,Hi everyone. Earn $100 Cash everyday for reading Emails.,0,,1,:news: News
53624,snijgw,sports,Adamsonyii,2022-02-08 12:00:15,remitano.net,https://remitano.net/btc/ng/join/4259683,"Hey everyone! Check out the easiest, safest and most convenient way to buy Bitcoin and other coin.",0,,1,:news: News
53681,snygp5,sports,newgreendriver,2022-02-08 23:40:01,i.redd.it,https://i.redd.it/gahg7ey9jog81.jpg,Mods deleting the truth,0,,1,:news: News
53704,so83ch,sports,HourlyPrimeNews,2022-02-09 07:53:15,i.redd.it,https://i.redd.it/z2re0eqzirg81.jpg,Praveen Kumar Sobti was a mild big: Bahadur Singh | A lot more sporting activities Information - Hourly Key News,0,,1,:news: News
53707,so8k5z,sports,Electrical-Ad9512,2022-02-09 08:22:17,youtu.be,https://youtu.be/0qrSmGnxJjI,"Regardez ""الجمهور المغربي يرد على إعتزال زياش #زياش # لقجع"" sur YouTube",0,,1,:news: News
